fid,timestamp,text_language,SocialMediaChannel,transcript
9945b677af64034bda2d9b9392f9ba3e,2025-07-14 12:43:00,en,WEB,"  Shani Singh is a energetic personality who celebrates the simple pleasures of life. Her journey is a tapestry of love, laughter, and genuine moments that she expresses with her followers. Whether she's sharing a new recipe, venturing to a unique destination, or simply reflecting on life's challenges, Shani's thoughts are always refreshing. She believes that humor is the best medicine, and her playful observations are sure to elevate your day. - Connect Shani on her adventure as she discovers the magic of life, one giggle at a time. Exploring the World Through My Lens Capturing Global Beauty Through Photography There's a certain magic in capturing the world through a lens. Each and Every click of the shutter showcases a story, a moment frozen in time. From the vibrant streets of bustling cities to the tranquil serenity of untouched nature, my camera evolves into a portal, allowing me to submerge myself in diverse cultures and breathtaking landscapes. Every trip is an opportunity for discovery. I delight on framing the unexpected, the fleeting details that often go unnoticed. If it's a child's infectious laughter in a crowded market or the majestic silhouette of a lone mountain against a setting sun, my lens seeks to preserve these rich moments, turning them into lasting memories. - In Essence, it's about sharing these experiences with others, inspiring a sense of wonder and connection to the world around us. - Through my lens, I aim to showcase a tapestry of human stories and natural wonders, one frame at a time. The Path to Self-Discovery Life is a dynamic journey, full of twists and turns that can lead us far from our initial expectations. It's during these moments of evolution that we have the opportunity for profound self-discovery. Often, obstacles become the launchpads for unveiling our true selves. - Reflecting on our past can provide insight about our values, as well as areas where we may desire to evolve. - Encouraging new challenges can push us outside our comfort zones and cultivate resilience. - Ultimately, this quest of self-discovery is about uncovering who we truly are, striving for fulfillment. Pictures Frozen, Keepsakes Formed A photograph is far more than just a picture; it's a window into the past, capturing fleeting moments in time. Each image tells a story, whispering secrets of joy, sorrow, love, and laughter. When we look back at these valued captures, memories flood back with vivid detail, transporting us right back the heart of the moment. Those photographs become real reminders of the people and experiences that have defined our lives. They serve as a bridge between then and now, allowing us to recall cherished moments with read more renewed passion. Sharing my Passions and Experiences It's absolutely fulfilling to share my hobbies with others. Bonding with people who resonate the same things is a truly rewarding experience. I love explaining my journeys, both big and small, because they often kindle curiosity and dialogue. It's amazing how we can learn so much from one another's| stories. - Occasionally, I find myself mentoring others about things that I'm passionate about. It's inspiring to observe their progress. - Communicating my knowledge is a way for me to contribute in the world. It's through these exchanges that I feel truly connected. Begin Your Daily Dose of Inspiration Every single hour is a gift to ignite your passion. Let today be the day you decide to live the possibility that lies within you. Keep in mind that you are powerful beyond measure, and your aspirations are reachable. - Trust - Manifest - Glow"
1lzo9sp,2025-07-14 14:44:09,en,REDDIT,"  Fun fact: Lime juice contains fluorescent compounds like riboflavin (vitamin B2). Under a blacklight, these compounds glow. Anyway, here's a lime recipe perfect for summer. I have no idea if it glows. **Ingredients:** • 12 ounces milk (1%) • 2 scoops vanilla protein powder (60g). I use [Metabolic Drive](https://go.biotest.net/MDatAmazon). • 1.5 teaspoons lime gelatin, sugar-free • 2 tablespoons key lime juice (or regular lime) **Directions:** 1. Whisk everything together and freeze. 2. Spin on the Lite setting. 3. For a soft-serve texture, re-spin with a tablespoon of extra milk. Pics show both options. **Notes:** 1. For a variation, mix in coconut flakes. 2. Works great in push-up pop molds, often sold as ""cake pop"" molds on Amazon. See my orange push-pop recipe [here](https://www.reddit.com/r/ninjacreami/comments/1luq8kr/orange_pushup_pop_16_oz_high_protein/). 3. I tried several variations, and this is my favorite, but play around by using half a teaspoon more or less of the lime gelatin. 4. I found bottled key lime juice at Walmart. Handy. Pic in comments. 5. Key lime is sharper, tangier, and more intense than standard lime, but also slightly sweeter. Both work in this recipe. 6. If your gelatin sticks to the sides during freezing, run a butter knife or pastry spatula down the side after the first spin, then re-spin or remix."
18069213884043154,2025-07-15 13:03:44,en,INSTAGRAM,"  You MUST read this ⤵ and SAVE for later ✨ 1️⃣ Turmeric Shot 🧡 These will fully cleanse your gut of toxic parasites and shred your face fat while making your jawline sharper! 2️⃣ Kimchi 🌶️ Kimchi produces LOTS of collagen which prevents wrinkles and reverses the skins age by up to 30 years! 3️⃣ Korean Matcha 🍵 Koreans LOVE drinking their matcha because it speeds up your metabolism and SHREDS stubborn tummy fat! (Comment “matcha” and I'll send you my fav recipe!) 4️⃣ Red Ginseng ⚡️ This is like actual medicine for your skin! It's packed with antioxindants that give your skin that Korean glow! Most importantly, an essential additional to help STRENGTHEN these beauty routine… 5️⃣ Taking Urolithin A+ softgels reactivates your body's natural cellular repair processes, enhances energy levels keeping you active and productive all day, and supports healthy, radiant skin, leaving you with a glowing and youthful appearance. Search Urolithin A+ softgels on Amazon or go to the link in my bio to buy! Remember, glowup is not just about physical appearance; it's also about feeling confident and comfortable in your own skin, body, and overall health from WITHIN with the help of Urolithin A+ ✨ Follow for daily health secrets on feminine beauty, soft confidence, and magnetic glow-up tips that actually work! #clearskintips #skincaretips #explorepage #viral #fyp #glowuptips #beautytips #usa #celebrity #kpop #blackpink #blackpinkconcert #jennie #lisa #deadlineworldtour #blackpinkworldtour [ health tips , beauty tips , beauty hacks , korean skin care tips , korea , korean beauty reels , usa , glowup tips , glowup , glow up hacks , blackpink jennie , blackpink lisa , blackpink world tour , blackpink deadline world tour , blackpink updates , blackpink LA ]"
mov_A2A94AC2A434396E1B3BCF285FD202B7,2025-07-15 16:32:56,en,WEB,"  Starbucks has turned years of customer hacks and social‑media lore into a permanent feature: a branded Secret Menu that now lives in the Starbucks app. The rollout went live on July 14, giving the chain's 32 million U.S. Rewards members one‑tap access to pre‑customized drinks and a shot at a cash prize for inventing the next viral beverage. One‑Tap Ordering for Cult‑Favorite Hacks Locating the Secret Menu is simple: open the app, head to the “Offers” tab, and tap a drink. All ingredient tweaks, e.g., extra pumps, foam swaps, and toppings, auto-populate in the cart, sparing baristas (and customers) a recital of modifications at the counter. Starbucks says the move streamlines throughput while letting fans “order exactly what they see on Instagram without memorizing a recipe.” The Opening Lineup: Four Social‑Media Stars To mark launch day, Starbucks highlighted four custom beverages drawn from fan requests and its own “Not‑So‑Secret Menu” Instagram broadcast channel: Cookies on Top – Cold Brew, vanilla syrup, Vanilla Sweet Cream Cold Foam, cookie‑crumble topping. Dragonfruit Glow‑Up – Mango Dragonfruit Lemonade Refresher blended with peach juice, finished with Sweet Cream Cold Foam. Lemon, Tea & Pearls – Black tea lemonade plus raspberry popping pearls. Just Add White Mocha – Brown Sugar Oatmilk Shaken Espresso upgraded with white‑chocolate mocha sauce and Sweet Cream Cold Foam. The company promises fresh rotations “regularly,” so the list is expected to evolve as trends bubble up. A $25,000 Contest to Crowd‑Source the Next Hit Innovation isn't limited to corporate R&D. From July 14 to 20, customers and employees can submit their own drink recipes at Starbucks' contest site. Judges will narrow down entries to four finalists, whose drinks will appear on the Secret Menu from August 18 to 25 and earn each creator $5,000. Instagram voting during that window will crown one grand‑prize winner, worth an extra $25,000. Why Starbucks Is Doing This The Secret Menu aligns with two priorities outlined in CEO Laxman Narasimhan's “Back to Starbucks” strategy: simplifying the core menu to expedite service and then utilizing digital channels to introduce limited-time innovations. By embedding fan inventions directly in the app, Starbucks captures social buzz and directs it to its highest‑margin ordering channel. What It Means for Customers and Baristas For customers, the appeal is obvious: no more guesswork or gray‑area modifications at the register. For baristas, recipes are standardized and appear on the ticket, reducing errors. The company also avoids stocking new ingredients; every Secret Menu drink relies on SKUs already behind the bar. Starbucks says this “balance of creativity and operational sanity” is key to keeping wait times down."
UgyqS82G0wVo3ihdD3V4AaABAg,2025-07-15 19:47:59,en,YOUTUBE,"  Becoming God's Daughter Book Now Available in Paperback & Hardcover: A quiet personal invitation into deeper healing, daughterhood, and purpose. → Now an Amazon Top 25 Bestseller in Christian Faith — thank you! https://amzn.to/3ZcOC8h Isaiah 45:3 “I will give you the treasures of darkness, riches stored in secret places, so that you may know that I am the Lord…” ➡READY For Your Healing Era? 30 Day Glow Up Radiant Wellness Reset Challenge: https://www.ourlittlehouseonthemountain.com/glowupchallenge ✨↪ Entering Your Healing Online Program: https://www.ourlittlehouseonthemountain.com/myhealingera ✨↪ Homespun Income - Build Real Income Online and Live Your Purpose: https://www.ourlittlehouseonthemountain.com/homespunincome Homespun Income YouTube Channel: https://www.youtube.com/@homespunincome ✨↪ Naturally Beautifully You - A DIY Beauty Recipe & Gift Guide: https://www.ourlittlehouseonthemountain.com/product-page/naturally-beautifully-you ✨↪ Full Guide to Longer Stronger Hair Naturally! : https://www.ourlittlehouseonthemountain.com/product-page/ultimate-guide-to-longer-stronger-hair-naturally ✨↪ FREE Women are the Moon Starter Guide Digital Download: https://www.ourlittlehouseonthemountain.com/product-page/women-are-the-moon-healing-the-female-mind-body Website: www.ourlittlehouseonthemountain.com Follow us on instagram @ourlittlehouseonthemountain Intentional Living Journal: https://amzn.to/4d5o4L6 Biblical Affirmations Journal: https://amzn.to/4nAhrGz Meal Planner & Fitness Tracker: https://amzn.to/497EMH0 Free Trial with Amazon Audible: https://amzn.to/3YxmTj4 Clara and Fritz Tallow Beauty: https://claraandfritz.com/?ref=lwu9j3le 15% Discount Code: Littlehouse Simple Sophistication Tallow Beauty: https://www.simplesophistication.shop ✨ Use my discount code: LEA15 for 15% off your entire order! Leven Rose Oils: https://www.levenrose.com?sca_ref=5565599.a9TqynlaRs 10% Coupon Code: LEA10 ☕ Become a Tea with Lea member today! https://www.youtube.com/channel/UC9KsWjn9HeT3QYdY-KDzwBg/join OR To View Tea with Lea & For Bonus Content: www.patreon.com/littlehouseonthemountain Website and Blog: www.ourlittlehouseonthemountain.com DISCOUNT ORGANIC Pantry Items: Thrive Market- Where I get my Organic Pantry Ingredients for Less:  http://thrv.me/BsMHxR #healing #healingjourney #rootedintheword #conversation #faithjourney Music is license and copyright free through artlist.io Colossians 3:23​​​​​​​-24 ""And whatever you do, do it heartily, as to the Lord and not to men, knowing that from the Lord you will receive the reward of the inheritance; for you serve the Lord Christ"" For Business inquiries & communications: Email - info@ourlittlehouseonthemountain.com Some links on this website or blog may contain affiliate products or links. This means that If purchases are made through links on this website, I may receive a commission Timestamps 0:00 Come on in 1:32 The In Between 2:12 Hidden Seasons 4:17 Climbing the Mountain 5:37 Back to the Garden"
1945275045284110695,2025-07-16 00:11:26,en,TWITTER,  ✨ The glow I trust: Glow Recipe Dew Drops Tree Hut Scrub Laneige Lip Mask Linked on my Amazon Storefront 🛒 https://t.co/g4nEU9SG6I #AmazonFinds #SoftPowerEssentials” https://t.co/WE8N6RgFBY
10153457065847481_10161600614987481,2025-07-16 01:16:51,en,FACEBOOK,"  Glow Recipe Watermelon Glow Dew Drops 🍉✨�Hydrating serum + glow booster — my go-to for that soft, radiant finish. Perfect under makeup or solo for a natural glow. Amazon fave  storefront 👉🏽 https://www.amazon.com/shop/lnstrong�#GlowRecipe #WatermelonDewDrops #AmazonMustHaves #SkincareFavorites Amazon.com"
mov_5A68035497E0447CCB302A815C6E4992,2025-07-16 03:38:02,en,WEB,"  The future fairy queen of Celestia bakes lavender tarts in an opening scene and that special recipe is included in the back of the book ""The Amulet of Undoing"" by Kasey Safford. The same lavender tarts her grandmother makes will be served at the book signing on Sunday, July 20 at 4 to 6 p.m. at Understory Book Shop, 111 Railroad Ave., Cashmere. The floral dessert becomes even sweeter as the center of a conflict between Princess Luna of Celestia and a earthy sprite from Durand, who she will later need for help on a quest to save the two kingdoms. In an enemies to lovers trope, they first meet at a coronation ball, where Luna lurks in her mother's shadow as the fairy folk's beloved ruler despite her trained upbringing. Not until her limits are put to the test in the Bog with three companions saving the world does she rise to the occasion to fill the queen's huge shoes. Self-acceptance is a key theme Safford worked into the book, she said, also that people who are different can unite for something important to the common good. Kasey Safford.jpg Kasey Safford ""You see her face all these different challenges and come to a moment where she realizes 'I did all of this. Why can't I do that too?'"" Safford said of Luna, a character who she made up of some of her toughest tendencies. The supporting character Rhea reflects the author's fun side, her witty banter and charisma, which some friends noticed after reading the self-published book. As backstory, Rhea snuck into the palace to steal food as an orphan and bonded with the princess in close friendship. Another sprite on the quest is Atlas, a nerdy fellow with a big heart, the only one in the group smart enough to read the journal in a foreign language for clues to find three items. Those important, illusive items can be traded to an undead monster for the spell to undo an evil curse. The book's dedication goes out to Safford's father, who once offered her a check to stop reading fantasy books, which she refused for any amount. ""Sorry father, but I'm not just reading them anymore. This is priceless,"" it says. After first trying to write a fiction book in high school for NaNoWriMo, Safford found the idea for a young adult romantasy novel ""The Amulet of Undoing"" while in college at Arizona State University. She graduated with a bachelor's degree in English in 2023, as well as gaining an online certificate in Digital Humanities from Harvard University. Safford's obsession with fairies began as a child when her mother left a shimmery pop-up book about fairies under her pillow instead of money for a lost tooth. She'd make tiny furniture to leave in gardens for the fae, and believed (believes) in fairy circles. Book Cover.jpg ""The Amulet of Undoing"" by Kasey Safford. After a year of writing and a year of editing, Safford queried some agents for publication but ultimately self-published and said, ""It started driving me crazy keeping it to myself, I was like 'I'm just dying to share this with everyone because it's my proudest creative accomplishment.'"" Writing the novel was not a lonely experience for her, Safford said, since she had so much support, especially from her best friend, Tori Morgan, a second grade teacher at Cascade Christian Academy who read the book weekly as it was being written to make critiques and give compliments. Practicing fight choreography moves for accuracy and quoting Casper's sassy lines back to his wife, Caiden Safford, owner of Caiden's Carpet Cleaning, is also a major supporter. He easily understands when she wakes at 2 a.m. to bolt up to type in her phone with an idea for the next book she's writing, a holiday romance which is halfway done. It's about six friends working at Sea-Tac Airport who all find love the week of Christmas in all different romance tropes of enemies to lovers, friends to lovers, fake romance to real romance, forbidden love and more. In Celestia, fairies don't blush, their cheeks shimmer, and when they're kissed, their wings glow. They dance the gaiety at every ball and believe that the more special an occasion is the sweeter the food should be, especially the lavender tarts. Copyright (C) 2025, Tribune Content Agency, LLC. Portions copyrighted by the respective providers. This story was originally published July 15, 2025 at 8:38 PM."
DCB408E56108BB666B94FDF30CE770DF,2025-07-16 07:23:54,en,PRINT,"  You asked, we answered: Here's everything you'll want to know about making great meals in the great outdoors. Some dinners are just better eaten outside. Cooked over a crackling fire, surrounded by pitch pines, lightning bugs and scurrying squirrels, even something simple like a skillet of nachos can go from good to remarkable. The smoke of a wood fire swirls into the beans. The cheese sizzles crisp. Some chips toast to an admirable char. Campfire cooking can seem complicated, what with the planning, packing and schlepping involved in fashioning a temporary kitchen in the great outdoors. But keep the meal ideas, tools and setup simple and campfire cooking might just be more enjoyable than cooking at home. My partner and I have twice circled the United States in our camper van, but we knew very little when we set out. We learned as we went. There were many nights of cooking out in the wind and rain and jet-black sky, a lot of ramen. Not every night was dreamy, but every morning we were glad to wake up where we were. There's nothing quite like cooking over live fire -- and no two times are ever the same -- but with this basic intel, you might just do it again and again. The questions below were submitted by readers and Food staff alike. If you're camp cooking-curious and don't know where to start, you're in the right place. For more good eating, see this collection of camping recipes. How do I build a campfire? Humans have been cooking food over fire for at least 780,000 years, so there are many ways to effectively start one. I typically prepare dinner while my partner gets the fire going (Camping Lesson 1: Divide and conquer), but he taught me a method that even newbies like me can pull off -- on camera! (Watch above.) Some Safety Notes Always be sure to follow local rules and regulations. Some campsites will have pits with grates for you; others may have a fire ban (in which case, it's sandwiches for dinner). Use wood that was bought or acquired locally to avoid transporting invasive species. Keep a bucket of water near for emergencies -- and to put out the fire before going to bed. Be sure to stir the water with the embers so they're all drenched. What kind of equipment is especially helpful? The tools you'll use to cook over a campfire aren't that different from what you use at home, save for long tongs and a dish bin, so bring a curated selection of what you already have in your kitchen. When we were packing, whatever tool I used when cooking over the course of a week went into a box for the van. If I'd used it at home, chances were I'd want it camping, too. You probably need only one skillet; I use a large, carbon-steel skillet for most things. And certain tools have multiple uses. For instance, a sheet pan can be a table to put tools on, a tray for prepped ingredients, a platter for finished food, a lid for your skillet, a fan to get the fire roaring. (During one winter in Montana, I even used it as a sled.) How do I keep my food from burning right up? It can be tempting to cook directly over big, glowing, roaring flames, but they'll end up charring your food completely. Instead, wait for the flames to die down a bit: A fire is ready to cook on when the logs have broken down into coals that glow orange and are covered with a layer of gray ash. That's your cue to arrange a grill grate over the coals and let it heat, then add your food, preferably in a skillet, which can be a safer bet than cooking over the grates at the campsite. If you do find your food consumed by flames, move it to a cooler part of the fire. Look for areas where the coals aren't as red or bright, or hold your hand a few inches above different parts of the coals to feel their temperature. Avoid spraying the flames with water, which will spray the ash onto your food. Essential Tips for Camp Cooking Go easy on yourself when building a campfire, and feel free to use supermarket fire starters. A carbon-steel skillet can be much easier to use (and lighter to pack!) than a cast-iron skillet. Tongs can do double-duty, moving food and wood around. Kitchen shears are your friend: Cut ingredients like kimchi right in the jar, or scallions right over your bowl to avoid cleaning a messy cutting board. Choose meals that don't require a lot of measurements: Eyeballing ingredients means less dishwashing. How do I build a meal in a foil packet? When you're camping, a foil packet -- aluminum foil envelopes of ingredients -- can be especially helpful...."
18392312602190628,2025-07-16 15:17:41,en,INSTAGRAM,"  22 years of injecting Botox… And women still don't believe the real secret to glowing, tight, poreless skin is THIS: 1️⃣ Wash your face with ice daily — instant lift, glow, and smaller pores 2️⃣ Turmeric + Yogurt = Magic Mask — dark spots vanish like they were never there Comment “Magic Mask” for the full recipe 3️⃣ Mustard oil on your brows? They'll grow thick, full, and dark ♀️ Apply it to your scalp too — you'll see new baby hairs where you never thought possible 4️⃣ Aloe gel + Vitamin E = Natural Botox Use it nightly to smooth wrinkles and crow's feet Comment “Wrinkles” if you want this anti-aging secret Every model I treat uses Moringa to feel 30 lbs lighter It kills sugar cravings and boosts digestion I only recommend **Rosabella Moringa** — find it on Amazon or in my bio Follow FixGlory for faceless remedies dermatologists won't tell you For collabs or copyright: tseanurag111@gmail.com This content is for educational purposes only Keywords: fixglory skin tips, anti-aging remedies, ice facial benefits, turmeric yogurt mask, moringa powder weight loss, eyebrow growth oil, aloe vera vitamin E anti-wrinkle, natural botox trick, dark spot removal, pore shrinking hack, scalp regrowth remedy, natural beauty tricks, beauty secrets 2025, korean skincare hack, holistic face care, faceless glow content, fixglory botox alternative, faceless influencer skincare, youth glow remedy, natural wrinkle cure, moringa cravings control, rosabella moringa amazon, dark circles erase, glowup plan fixglory, beauty hacks usa, skin tightening naturally, healthy skin ritual, glowing skin overnight, filtered skin look #fixglory #naturalbotox #beautysecret #wrinklefree #glowupguide #facelesshealth #moringapowder #skincarehack #icefacial #antiagingremedy"
1945604131911340228,2025-07-16 21:59:07,en,TWITTER,  Free Glow Recipe Blush for New Members https://t.co/Dnk7xG9m6q #freemoney #giveaway #freestuff
n3kdjyp,2025-07-17 03:08:26,en,REDDIT,"  Of course!! Made me so happy to see so figured I'd share it here ☺ Yes! A few of my absolute favorites that I would definitely repurchase are the sun bum detox hair scalp mask (already repurchased about 3 times past 2 years), hempz lotion- sooo hydrating and smells amazing plus leaves a really pretty glow, the lume deodorant which I just got more of from amazon prime day, the La Roche Posay triple moisturizer, tree hut sugar srubs, thrive causemetics tubing mascara (the best!!!) , pixi exfoliating pads, and the Eva-nyc hair mask which I've purchased several times (they did recently change formula, make the containers smaller, AND raise price though). Also really enjoyed all of my Glow Recipe skin care and the oribe hair shampoo and conditioner samples, although the full sizes are a bit pricy so not 100% sure if I would buy!"
650758858131038_122109771596932160,2025-07-17 04:32:40,en,FACEBOOK,  ✨ The glow I trust:🍉 Glow Recipe Dew Drops🛁 Tree Hut Scrub💄 Laneige Lip MaskLinked on my Amazon Storefront 🛒 amazon.com/shop/lnstrong #AmazonFinds #SoftPowerEssentials. Amazon.com
