fid,timestamp,text_language,SocialMediaChannel,transcript
1935338246214664282,2025-06-18 14:06:09,en,TWITTER,  Coco & Eve Self Tanner Mousse Kit - (Medium) All Natural Sunless Instant Self Tanning Lotion with Bronzer & Mitt Applicator | Sunny Honey Bali Bronzing Kit #skincare #skincaretips #selftanner #SkincareEssentials #tanninglotion #amazon https://t.co/0Bm0rtFOmO
ad92fc29b7c509a82282780645acc307,2025-06-20 12:02:00,en,WEB,"  Beauty enthusiasts are flocking to snag a fake tan that 'ticks every box' for those seeking that sun-kissed summer look. Not only does it provide an even, streak-free glow, but this tanning marvel also boasts no need for washing off after application and promises no staining on white bed sheets. Even better, Bondi Sands' Liquid Gold Self Tanning Foam is currently experiencing a massive price drop. Ordinarily priced at £17.49, it's been cut by a whopping 44% on Amazon, now available for just £9.74 in a special offer. When compared with high street favourites, it's a bargain; it beats sale prices at Boots and Superdrug, coupled with the added perk of complimentary next day delivery for Amazon Prime members. To put things into perspective, Bondi Sands' Liquid Gold Self Tanning Foam is tagged at £11.66 at Boots and £11.65 at Superdrug. Promising an 'Aussie tan in no time', Bondi Sands' tanning foam develops within two to three hours and doesn't require rinsing. It's quick-drying, leaving your skin looking bronzed and luminous. READ MORE: Amazon air conditioner 'can cool an entire room in just 15 minutes' READ MORE: Next's 'smart' jumpsuit is perfect alternative to dresses for weddings This transparent foam, which causes no colour transfer, thereby keeping bed linen pristine, is infused with argan oil to ensure that the skin remains hydrated and smooth. Its coconut fragrance has been described as pleasantly subtle by users, reports the Manchester Evening News. This self-tanner boasts an impressive average rating of 4.7 out of five from over 200 reviews. One pleased user shared: ""I've been using this for ages now. Lovely colour, doesn't go streaky or patchy. Fades nicely. No overpowering smell and because it's clear, my bedsheets are still white."" A second enthused: ""I love this tan. I've tried nearly every tan out there and this is one of my favourites, it never goes patchy or streaky. It always looks natural and lasts longer than most tans I've used."" Another customer commented: ""Really good quality! Lasted me about a week without going patchy after showering several times too! You do have to re-apply it every week! But a lot better than some of the tans I've used!"" . One more user was pleasantly surprised: ""This product shocked me as the guide colour was very pale. Was worried it wouldn't show up. After about 4 or 5 hours the colour got nice and dark. Pleasantly surprised it didn't stain white sheets."" However, not everyone was completely satisfied, as one person noted: ""So, first thing to address it the scent when you put it on, is pleasant. It is very light in colour and really spreadable, which is good. The colour starts to develop quickly but I barely noticed due to the lack of orange pigment, great. Could be darker, but seems buildable. Following on from developed colour (pre washing) I smell like biscuits, *but* fresh ones, not bad in my opinion. Only complaint is my hands smell like damp wicker, or pencils, if you know, you know."" And another review pointed out: ""Lasts longer than all other tans I've used, only problem I had was a little lighter than I expected, would be perfect if it was a bit darker but it looked nice and natural, easy to apply. ."" But another shared their positive experience: ""Lovely tanning mouse. Used to use St Tropez but this is a nicer colour and fades better. Also cheaper. Used a mitt to apply and left overnight. None on the sheets in the morning. Had quite a few compliments on the natural colour."" For those considering a gradual tan, Coco and Eve's well-received Sunny Honey Gradual Tanning Lotion is currently discounted to £18.75 from £25 at Boots. Alternatively, for the deepest tan that sets in just two hours, the Loving Tan 2 HR Express Mousse is the go-to option, now priced at £29.56, reduced from £36.95 at LookFantastic. Bondi Sands' Liquid Gold Self Tanning Foam is currently on sale at Amazon for £9.74, down from £17.49."
mov_F1B5FE41D05C497D6438E99B54ACFFEC,2025-06-20 12:02:00,en,WEB,"  Beauty enthusiasts are flocking to snag a fake tan that 'ticks every box' for those seeking that sun-kissed summer look. Not only does it provide an even, streak-free glow, but this tanning marvel also boasts no need for washing off after application and promises no staining on white bed sheets. Even better, Bondi Sands' Liquid Gold Self Tanning Foam is currently experiencing a massive price drop. Ordinarily priced at £17.49, it's been cut by a whopping 44% on Amazon, now available for just £9.74 in a special offer. When compared with high street favourites, it's a bargain; it beats sale prices at Boots and Superdrug, coupled with the added perk of complimentary next day delivery for Amazon Prime members. To put things into perspective, Bondi Sands' Liquid Gold Self Tanning Foam is tagged at £11.66 at Boots and £11.65 at Superdrug. Promising an 'Aussie tan in no time', Bondi Sands' tanning foam develops within two to three hours and doesn't require rinsing. It's quick-drying, leaving your skin looking bronzed and luminous. This transparent foam, which causes no colour transfer, thereby keeping bed linen pristine, is infused with argan oil to ensure that the skin remains hydrated and smooth. Its coconut fragrance has been described as pleasantly subtle by users, reports the Manchester Evening News. This self-tanner boasts an impressive average rating of 4.7 out of five from over 200 reviews. One pleased user shared: ""I've been using this for ages now. Lovely colour, doesn't go streaky or patchy. Fades nicely. No overpowering smell and because it's clear, my bedsheets are still white."" A second enthused: ""I love this tan. I've tried nearly every tan out there and this is one of my favourites, it never goes patchy or streaky. It always looks natural and lasts longer than most tans I've used."" Another customer commented: ""Really good quality! Lasted me about a week without going patchy after showering several times too! You do have to re-apply it every week! But a lot better than some of the tans I've used!"" . One more user was pleasantly surprised: ""This product shocked me as the guide colour was very pale. Was worried it wouldn't show up. After about 4 or 5 hours the colour got nice and dark. Pleasantly surprised it didn't stain white sheets."" However, not everyone was completely satisfied, as one person noted: ""So, first thing to address it the scent when you put it on, is pleasant. It is very light in colour and really spreadable, which is good. The colour starts to develop quickly but I barely noticed due to the lack of orange pigment, great. Could be darker, but seems buildable. Following on from developed colour (pre washing) I smell like biscuits, *but* fresh ones, not bad in my opinion. Only complaint is my hands smell like damp wicker, or pencils, if you know, you know."" And another review pointed out: ""Lasts longer than all other tans I've used, only problem I had was a little lighter than I expected, would be perfect if it was a bit darker but it looked nice and natural, easy to apply. ."" But another shared their positive experience: ""Lovely tanning mouse. Used to use St Tropez but this is a nicer colour and fades better. Also cheaper. Used a mitt to apply and left overnight. None on the sheets in the morning. Had quite a few compliments on the natural colour."" For those considering a gradual tan, Coco and Eve's well-received Sunny Honey Gradual Tanning Lotion is currently discounted to £18.75 from £25 at Boots. Alternatively, for the deepest tan that sets in just two hours, the Loving Tan 2 HR Express Mousse is the go-to option, now priced at £29.56, reduced from £36.95 at LookFantastic. Bondi Sands' Liquid Gold Self Tanning Foam is currently on sale at Amazon for £9.74, down from £17.49."
mov_59A19CEA75231825295104F45E18F8B9,2025-06-20 13:05:42,en,WEB,"  FOURTH OF JULY READY    Hi, ladies! I hope everyone is hanging in there! What a crazy time to be alive, right? Is anyone else refreshing the news every couple of minutes? I am on X (formerly Twitter) and find myself checking it every hour. I know the ending of the story (God wins) already, but I keep checking! I am praying for our military personnel and leaders. If you have a family member in the military or police force, please know how much I appreciate their service. Speaking of this country, the Fourth of July is just around the corner, and I wanted to share a fun outfit for the occasion that can be worn day or night, and even as separates. I thought these matching denim pieces were so cute. The smocked top is slightly cropped (however, none of my skin is showing), and has removable spaghetti straps for a strapless look. The skirt has a smocked waistband that flows into a gathered, ankle-length silhouette. This is a great look to wear all summer long and into early fall. I paired an open-knit cardigan over my shoulders, but for the actual Fourth, I will be wearing this one . I paired these silver sandals with this look, but they are currently sold out in most sizes… sorry! These are a cute alternative . A few other things I've been loving lately…   These shirts by Rochelle Behrens (the black is so chic)  Laundry Sauce Detergent Pods and Dryer Sheets are so dang good and make your laundry smell divine  Diamond Cocon Sheer Eye – This lightweight concealing cream minimizes the look of dark circles and puffiness with a cocktail of active ingredients and a perfecting, luminous tint of color  The Cadence System for traveling is fantastic! The Nori Trim is a high-performance fabric shaver designed to remove pills and lint from clothing and furniture. Their steam iron is great too! Biom Mini All-Purpose Wipes Starte Kit is so cute and non-toxic. I keep it in my car, in the cup holder. Karam MD Trifecta – These three products are all you need! Simple and easy! Love these “ knickers !” They are so comfortable! Juliet Wines – Such a cool concept (read here )  Recess Pickleball Paddles ARE THE CUTEST! U-Beauty Super Body Hydrator will make your arms feel smooth as glass! I love this gradual tanning lotion from Coco & Eve. This gives great color in a flash! Use Code: CATHY15               We are keeping the grandkids tonight (overnight) so their parents can celebrate their anniversary. I can't believe they've been married sixteen years. Time goes by so fast, it's scary! I hope you have a great weekend! Stay well and Be safe! xx    Photos: Heather Nicole    TOP // SKIRT // CARDIGAN // SANDALS ( similar ) // BAG ( similar )// RING ( similar ), and this one would be great for the Fourth! MY FAVORITE FOURTH OF JULY ITEMS                          The post FOURTH OF JULY READY appeared first on The Middle Page ."
mov_3B86A31F687C66C95A0B0B1CB79851A3,2025-06-21 11:35:05,en,WEB,"  Magic tiktok products Amazon/Getty Creative Catrice www.amazon.com Catrice “Instant Awake” Under Eye Brightener The color adaptive formula is designed so one of two shades will work on any skin tone. Check out a TikTok of the brightener in action. Promising review: “Took years off my eyes! This product is so reasonably priced. I came across a TikTok promoting this and decided to take a chance since the price was super reasonable. My eyes looked brighter in a good way, and the concealer worked so well that I felt I looked younger. I got compliments from friends asking what I did differently with my makeup. I recommend it.” —Monica T. $6 at Amazon A set of cowboy straw toppers www.amazon.com A set of cowboy straw toppers www.amazon.com A set of cowboy straw toppers Check out a TikTok of the straw toppers in action. Promising review: “So SO CUUUTE! 10/10!! good product and keeps my straw from getting bugs or getting germs on it! plus it's really cute.” —JennA $6.99 at Amazon Kahi Wrinkle Bounce Hydrating Multi-Balm Amazon Kahi Wrinkle Bounce Hydrating Multi-Balm Amazon Kahi Wrinkle Bounce Hydrating Multi-Balm Check out a TikTok of the wrinkle balm in action. Promising review: “Okay! So I was skeptical at first, but honestly this stick is life changing!!! In a matter of minutes my skin felt hydrated and plumped. After an hour, still hydrated. No greasy after feeling, very light, and you can feel your skin hydrated and absorbing. I love the fact that you can use it on your eyes, lips and wrinkles!! Game changer for me, will def try the others!” —Kristy $22.99 at Amazon A set of deep set heart-shaped salad plates www.amazon.com A set of deep set heart-shaped salad plates www.amazon.com A set of deep set heart-shaped salad plates Promising review: “The quality is amazing. Bright white, ceramic! I loved them so much I ordered another set! Obsessed with them!”..."
1936392408364904703,2025-06-21 11:55:01,en,TWITTER,"  Coco & Eve Anti-Aging Tanning Serum - Face tanner with Skincare Actives for Gradual, Hydrating Glow. Natural Self Tanning Bronzer, with Niacinamide & Antioxidants for Healthy Glowing Skin (1.01 Fl Oz) https://t.co/f1O8mGFTzX"
1936392862293471505,2025-06-21 11:56:49,en,TWITTER,"  Coco & Eve Sunny Honey Bronzing Face Drops (Dark), Natural, Hydrating Hyaluronic Acid. Indoor Sunless Moisturizing Self Tanner. (1 fl oz) https://t.co/DOmYDWdqbS"
mov_C6F38F437B7BDEAF33C4AF7A790D9F93,2025-06-23 14:28:16,en,WEB,"  Amazon shoppers who have left glowing reviews for the best-selling fake tan product - and it's currently on sale 15:28, 23 Jun 2025Updated 15:28, 23 Jun 2025 This article contains affiliate links, we will receive a commission on any sales we generate from it. Learn moreThe Bondi Sands Liquid Gold Self Tanning Foam promises an 'Aussie tan in no time'(Image: ) Beauty enthusiasts are rushing to purchase a fake tan product that ""ticks every box"" and fulfils all the bronzing needs of those yearning for a sun-kissed glow just in time for summer. Bondi Sands' Liquid Gold Self Tanning Foam not only delivers a streak-free, uniform tan but also offers the benefit of being a no-rinse formula that doesn't stain white bed linen. Adding to its appeal, the tan is currently enjoying a significant price reduction. Typically retailing at £17.49 per bottle, Amazon has slashed the price by an impressive 44 per cent, offering it for just £9.74 for a limited time. READ MORE: Silentnight's £20 summer double duvet is 'perfect for warmer nights' READ MORE: Cordless lawn mower that 'cuts tall grass very easily' now £58 off on Amazon If you're price comparing, this deal trumps the discounted prices currently available at Boots and Superdrug, and even includes free next-day delivery for Prime members. Over at Boots, Bondi Sands' Liquid Gold is priced at £11.66, while Superdrug has it marked at £11.65 for members. Bondi Sands' Liquid Gold Self Tanning Foam promises an 'Aussie tan in no time', developing within two to three hours without the need for rinsing. It dries rapidly, leaving skin with a radiant bronze glow. Bondi Sands Liquid Gold tanning foam doesn't need washing off(Image: Bondi Sands) According to Manchester Evening News, its clear, non-transferable foam formula enriched with Argan oil leaves skin feeling luxuriously soft, and it features a coconut scent that shoppers describe as 'not overpowering'. Elsewhere, Coco & Eve's highly-rated Sunny Honey Gradual Tanning Lotion is currently £18.75 at Boots, down from its £25 RRP. Or if you want a darker tan that takes hold quickly, LookFantastic have the Loving Tan 2HR Express Mousse for £29.56, down from £36.95. Garnering an outstanding overall rating of 4.7 out of five stars from more than 200 reviews, customers are thoroughly impressed with this product. One satisfied customer shared: ""I've been using this for ages now. Lovely colour, doesn't go streaky or patchy. Fades nicely. No overpowering smell and because it's clear, my bedsheets are still white."" The tan develops in two to three hours and doesn't need to be rinsed off(Image: Bondi Sands) Another reviewer sang the product's praises: ""I love this tan. I've tried nearly every tan out there and this is one of my favourites, it never goes patchy or streaky. It always looks natural and lasts longer than most tans I've used."" A separate customer had a similarly positive experience, commenting: ""Really good quality! Lasted me about a week without going patchy after showering several times too! You do have to re-apply it every week! But a lot better than some of the tans I've used!"" Another enthusiastic user was thrilled with their results stating: ""This product shocked me as the guide colour was very pale. Was worried it wouldn't show up. After about 4 or 5 hours the colour got nice and dark. Pleasantly surprised it didn't stain white sheets."" Not everyone was entirely persuaded, with a critic noting: ""So, first thing to address is the scent when you put it on, it is pleasant. It is very light in colour and really spreadable, which is good. ""The colour starts to develop quickly but I barely noticed due to the lack of orange pigment, great. Could be darker, but seems buildable. Following on from developed colour (pre washing) I smell like biscuits, *but* fresh ones, not bad in my opinion. Only complaint is my hands smell like damp wicker, or pencils, if you know, you know."" Should you be seeking a sun-kissed glow during the heatwave, the Bondi Sands mousse might just hit the mark. Article continues below For those desiring a richer hue, we also recommend the Loving Tan's Deluxe Bronzing Mousse, currently on offer at £22.37. Join the Daily Record WhatsApp community! Get the latest news sent straight to your messages by joining our WhatsApp community today. You'll receive daily updates on breaking news as well as the top headlines across Scotland. No one will be able to see who is signed up and no one can send messages except the Daily Record team. All you have to do is click here if you're on mobile, select 'Join Community' and you're in! If you're on a desktop, simply scan the QR code above with your phone and click 'Join Community'...."
tw_sl_a92250348f147dc2bc9361e0d6097e2b,2025-06-26 12:16:35,fr,WEB,"  SPR_COMBO[fr]Ces 10 moments des films Pixar qui ont marqué les fans Cinéma Alors que Pixar vient de sortir son nouveau film d'animation intitulé Elio et dont la performance au box-office n'est pas celle espérée par le studio, nous vous proposons de vous replonger dans les productions du studio à la lampe en s'intéressant aux différents moments qui ont marqué les fans. De Là-Haut en passant par Toy Story, Vice-Versa ou encore Wall-E, voici les 10 moments que l'on oubliera jamais. #1 Là-Haut - La mort d'Ellie Certainement l'une des séquences les plus émouvantes offerte par Pixar. Le film débute sur l'histoire de Carl et de son grand amour Ellie. La scène musicale avec une bande son signée Michael Giacchino nous montre leur vie depuis leur enfance jusqu'à l'âge adulte comme leur mariage, leurs envies de voyages, et les aléas avec une chambre sans berceau, la maladie et enfin la mort d'Ellie. Une séquence qui reste gravée dans la mémoire et qui vous a forcément fait couler quelques larmes. #2 Toy Story 2 - L'histoire de Jessie C'est à ce moment du film que l'on comprend pourquoi Jessie la cow-girl ne veut pas que Woody tente de retrouver ses amis jouets. Sur la musique When she loved me, elle raconte son histoire passée. Elle était le jouet d'une petite fille qui a l'a délaissée quand elle est devenue grande et l'a abandonnée. Une séquence émouvante qui nous plonge dans la nostalgie de nos vieux jouets et qui donne envie d'aller dans le grenier pour les récupérer. #3 Toy Story 3 - L'incinérateur La franchise Toy Story nous offre des moments poignants comme cette scène où les jouets se retrouvent à la déchèterie et sont jetés dans un incinérateur. Tentant d'échapper à ce piège, ils se rendent compte qu'il n'y a plus d'issue possible. Woody, Buzz et les autres sont résignés à mourir. Ils se tiennent la main, silencieux face aux flammes de l'incinérateur attendant leur fin. Beaucoup ont imaginé que Pixar allait véritablement détruire les fameux jouets d'Andy. #4 Le Monde de Nemo - L'attaque du barracuda Là encore Pixar nous a ému dès le début du film avec cette scène d'ouverture dans laquelle un barracuda s'attaque à la famille de Marlin. Il dévore la maman Corail qui tente de sauver ses oeufs. Marin, le père est veuf et seul Nemo survit à cette attaque. #5 Wall-E - Les souvenirs effacés du robot Wall-E est un petit robot qui séduit tout de suite les fans. Il n'a que pour seule passion de regarder en boucle sa comédie musicale favorite Hello Dolly !. Mais à la fin du film, le public a été marqué quand Otto délivre une charge électrique dans la batterie de Wall-E et lui grille ses circuits. De retour sur Terre, Eve tente de le réparer en lui chargeant la carte mémoire mais tous ses souvenirs sont effacés. #6 Vice-Versa - Riley parle de son ancienne maison Dans cette scène, Riley parle de son ancienne maison devant sa classe mais l'émotion est trop forte pour elle. La tristesse prend le dessus et la jeune fille se met à pleurer. Elle ne comprend pas ce qui se passe. Un moment qui a ému de nombreux fans qui ont certainement déjà vécu un déménagement. #7 Vice-Versa - La disparition de Bing Bong Toujours dans Vice-Versa, une autre scène culte celle de la disparition de Bing Bong, l'ami imaginaire de Riley. Très important pendant l'enfance de l'héroïne du film, Joie tente de le ramener dans les souvenirs de Riley. Mais c'est peine perdue, Bing Bong appartient désormais au passé et son sort est scellé : il est amené à disparaître. Une séquence qui montre la fin de l'innocence et de l'enfance. #8 Monstre & Cie - Sully et Bouh se disent adieu Sully se lie finalement d'amitié avec la jeune Bouh. Mais quand il doit la ramener dans son monde et qu'il doit fermer la porte, on comprend qu'ils ne se reverront jamais. Une scène émouvante surtout quand Sully dit au revoir à Bouh et lui explique qu'il ne reviendra plus. #9 Le Voyage d'Arlo - La mort d'Henry Henry est un apatosaure agriculteur et le père de Libby ainsi que de Buck et Arlo. Il ne se ménage pas pour cultiver les champs autour de la ferme familiale. Malheureusement le père disparaît de façon brutale dans un raz-de-marée alors qu'il était en train de protéger son fils. Une scène qui n'est pas sans rappeler celle du Roi Lion. #10 Coco - La chanson de Miguel à son arrière-grand-mère Très certainement une scène aussi jolie que poignante quand Miguel est aux côtés de son arrière-grand-mère qui reste immobile même quand il lui montre une ancienne photo...."
