fid,timestamp,text_language,SocialMediaChannel,transcript
mov_CC6CE3E0735817F741E4E1C6ACE7941C,2025-07-09 16:00:00,en,WEB,"  The discounts can only be found on Amazon and apply to selected items This article contains affiliate links, we will receive a commission on any sales we generate from it. Learn more Luxury bedding brand Simba has launched an exclusive sale on Amazon, especially for Prime Day. Shoppers can make savings on selected items in categories such as mattresses, toppers and pillows. The deals are available to shop on Simba's Store on Amazon until Friday, July 11. Whether consumers are looking to upgrade their current set-up or try Simba for the first time, the offer includes savings on some its best-selling products. First up is an offer on a king-size Simba Hybrid Essential Mattress, now on sale for £559, down from £749. The hybrid-designed mattress features contoured support and cooling foam, which improves airflow and helps dissipate heat, making it ideal for hot sleepers. READ MORE: Huge Amazon Prime Day sale slashes Coco & Eve's 'best tanner on the market' by 30% READ MORE: Amazon Prime Day takes £108 off gadget that delivers 'perfect frothed coffee' Only the king size of this mattress is on sale; the other sizes are still full price. It is made with 'Simbatex foam' on the top, and 1,000 aerocoil springs sit underneath for pressure relief. Alternatively, Dunelm has a sale on all sizes in its Fogarty Dreamy Comfort range, now priced between £167.20 - £263.20, originally £209-£329. It's made from 1,000 pocket springs and is available in small, small double, double, king and superking. Free Amazon Prime membership £8.99 Free Amazon Get Prime here Amazon Prime membership, including exclusive Prime Day discounts and perks on Hello Fresh, music, books and Prime Video. Usually £8.99 a month, you can now get a 30-day free trial to get access to the latest deals. Returning to Simba's Hybrid Essential Mattress, one customer bought it after a weekend away, during which they slept on one. They said: ""I was having sciatica problems, and I was very uncomfortable when turning over in bed and would wake up constantly in the night. ""What a difference this mattress has made. It's not solved my sciatica, but I do get a comfortable night's sleep now. Would I change it? No way."" A second user rated it three stars, saying: ""This was meant to not allow body heat build-up. The theory and performance was unsound and wanting. My wife found it uncomfortable whilst I was happy with the level of support."" Another user simply said: ""Excellent product. Good delivery."" Shoppers can also find deals on a selection of pillows, one such offer is on the Simba Stratos Pillow. It has firm support and cooling properties thanks to its 'cool-touch tech' Simba Renew Bio fibres. Originally £60 per pillow, shoppers can now buy one for £48. Another Simba pillow offer is on this Hybrid option, which was £109 per pillow, now £87. It's designed for sleepers who love to flip their pillow over to the cooler side. Its quilted cover provides instant freshness and cooler comfort. Elsewhere on the high street, Argos offers a large selection of memory foam and orthopaedic pillows. For instance, this pack of two Silentnight memory foam pillows are £25, and has medium firmness. Consumers new to Simba can find general reviews of the brand's quality, delivery and customer service on Trustpilot, where there are more than 55,000 comments and ratings. One person said: ""Good sale and deals on refurbished products. Super comfy mattress. Easy to put together bed and great quality."" Another customer reported delivery complications, explaining: ""Delivery on Monday was announced on Sunday. Nobody was available at the supplier or the forwarder to rearrange delivery. Much time wasted on Sunday and Monday."" An additional Trustpilot reviewer added: ""Buying a Simba mattress online was easy. Delivery was quick and the mattress is absolutely amazing...."
mov_8A42FC3D56B33900A5FDBAC883E6649C,2025-07-09 19:53:40,en,WEB,"  Luxury bedding brand Simba has launched an exclusive sale on Amazon, especially for Prime Day. Shoppers can make savings on selected items in categories such as mattresses, toppers and pillows. The deals are available to shop on Simba's Store on Amazon until Friday, July 11. Whether consumers are looking to upgrade their current set-up or try Simba for the first time, the offer includes savings on some its best-selling products. First up is an offer on a king-size Simba Hybrid Essential Mattress, now on sale for £559, down from £749. The hybrid-designed mattress features contoured support and cooling foam, which improves airflow and helps dissipate heat, making it ideal for hot sleepers. Huge Amazon Prime Day sale slashes Coco & Eve's 'best tanner on the market' by 30% Amazon Prime Day takes £108 off gadget that delivers 'perfect frothed coffee' Only the king size of this mattress is on sale; the other sizes are still full price. It is made with 'Simbatex foam' on the top, and 1,000 aerocoil springs sit underneath for pressure relief. Alternatively, Dunelm has a sale on all sizes in its Fogarty Dreamy Comfort range, now priced between £167.20 - £263.20, originally £209-£329. It's made from 1,000 pocket springs and is available in small, small double, double, king and superking. Returning to Simba's Hybrid Essential Mattress, one customer bought it after a weekend away, during which they slept on one. They said: ""I was having sciatica problems, and I was very uncomfortable when turning over in bed and would wake up constantly in the night. ""What a difference this mattress has made. It's not solved my sciatica, but I do get a comfortable night's sleepnow. Would I change it? No way."" A second user rated it three stars, saying: ""This was meant to not allow body heat build-up. The theory and performance was unsound and wanting. My wife found it uncomfortable whilst I was happy with the level of support."" Another user simply said: ""Excellent product. Good delivery."" Shoppers can also find deals on a selection of pillows, one such offer is on the Simba Stratos Pillow. It has firm support and cooling properties thanks to its 'cool-touch tech' Simba Renew Bio fibres. Originally £60 per pillow, shoppers can now buy one for £48. Another Simba pillow offer is on this Hybrid option, which was £109 per pillow, now £87. It's designed for sleepers who love to flip their pillow over to the cooler side. Its quilted cover provides instant freshness and cooler comfort. Elsewhere on the high street, Argos offers a large selection of memory foam and orthopaedic pillows. For instance, this pack of two Silentnight memory foam pillows are £25, and has medium firmness. Consumers new to Simba can find general reviews of the brand's quality, delivery and customer service on Trustpilot, where there are more than 55,000 comments and ratings. One person said: ""Good sale and deals on refurbished products. Super comfy mattress. Easy to put together bed and great quality."" Another customer reported delivery complications, explaining: ""Delivery on Monday was announced on Sunday. Nobody was available at the supplier or the forwarder to rearrange delivery. Much time wasted on Sunday and Monday."" An additional Trustpilot reviewer added: ""Buying a Simba mattress online was easy. Delivery was quick and the mattress is absolutely amazing. Very happy overall."" Simba also has reductions on toppers, the Hybrid Mattress Topperwas £299-£499, and is now £254-£424. It comes in single, small double, double, king and superking."
1lvucnq,2025-07-09 21:06:23,en,REDDIT,"  I've never used self tanner before, I'm on accutane so I can't tan. I bought the coco and eve mousse tanner in the shade dark, (I have fair skin) and I planned on doing a patch test on my foot or something to see how long I should leave it on. It came with a mitt, a back applicator and a brush. I've watched a few youtube videos but I am so scared to use it because I have a wedding to attend on sunday. (today is wedensday). How long does it last? How often does it need reapplied? I've read to exfoliate and shave first, does this mean I should shave my arms too? (I have hairy arms, blond hairs at that). If you use tanner on your face, how do you keep it out of your hair? Just saw a reddit pots of a girls blond hair turning orange from tanner. What clothes do you recommend wearing after applying? I have a roommate so I can't wear my birthday suit."
mov_1D551090DB28E2B58C643348F409F572,2025-07-09 21:29:00,en,WEB,"  Want to be sure you're buying products that are tried and true during the Prime Day sales? There are numerous items that have been tested and recommended by Good Housekeeping that are on sale this week. Here are a few of the products on sale that have won Good Housekeeping awards that our National Consumer Unit highlighted for you in previous coverage. Top grilling finds Good Housekeeping top-grill items on sale for Prime Day Lavatools Javelin® PRO Duo Ultra-Fast 1-Second Professional Digital Instant Read Meat Thermometer for Grill and Cooking, Auto-Rotating Backlit Display, IP65 Water Resistant, NSF Certified – Sambal SHOP NOW amazon.com Weber Q1200 Liquid Propane Grill SHOP NOW amazon.com amazon.com Coleman RoadTrip 225 Portable Tabletop Propane Grill Gas Grill SHOP NOW amazon.com MR.SIGA Microfiber Cleaning Cloth, Pack of 12 SHOP NOW amazon.com RTIC Ultra-Light 52 Quart Hard Cooler Insulated Portable Ice Chest Box for Beach, Drink, Beverage, Camping, Picnic, Fishing, Boat, Barbecue, 30% Lighter Than Rotomolded Coolers, Patriot SHOP NOW amazon.com Beauty award-winners Good Housekeeping Beauty Award picks on sale for Prime Day John Frieda ULTRAfiller+ Thickening Shampoo SHOP NOW John Frieda amazon.com Dove Styling Aid Intensive Repair Mask for Damaged Hair SHOP NOW amazon.com Coco & Eve Sunny Honey Bali Bronzing Foam SHOP NOW Coco & Eve amazon.com Dove Beauty Whole Body Aluminum Free Invisible Deodorant Spray SHOP NOW Dove Beauty amazon.com Winning finds in bedding Good Housekeeping Bedding Awards picks seeing Prime Day sales Mellanni Bed Sheet Set SHOP NOW amazon.com Bedsure Comforter Duvet Insert SHOP NOW amazon.com California Design Den Full/Queen Duvet Cover SHOP NOW California Design Den amazon.com..."
mov_D59F0259C40A579EBC4E3FA8143D3737,2025-07-09 21:29:00,en,WEB,"  These portable grills tested by the experts at the Good Housekeeping Institute are great for your next backyard party, picnic, or camping trip. Over the past few years, my team and I have tested more than 50, and that includes charcoal grills, gas grills, portable grills, electric grills, and of course all the different accessories. The Weber Q 1200 liquid propane grill was Good Housekeeping's best overall pick at $259. We got really good heat distributions. And it has these folding side tables that *** lot of portable girls don't have. The Coleman Road Trip 225 portable tabletop propane grill was the best value pick at $165. There's two different cook zones on it, so you can cook one side on higher heat and then the other side on the lower heat. And for *** picnic, the Everdrecu portable charcoal grill costs $125. It heats up quickly, it's easy, it's lightweight, and it has these nice handles on the side so you can bring it with you. Good Housekeeping approved grilling gear for $50 or less. There are *** few things I always need with me when I'm grilling outside. These are some of the grilling products that Good Housekeeping editors love the most. First, the Turner and Tom's grilling set from Oxo for $23. They have these grips on the side so they stay cool, and they have this really great hook so you can hang it on the side of your barbecue. And there's actually even *** little bottle opener to check the. on your meat. This ultra fast thermometer from lava tools costs $43. It responds super quickly. You can actually see it's already reading the temperature of the room and it's magnetic, so you can actually stick it to the side of your grill or on your fridge, and this way it's always handy when you need it. And to grill up some veggies, this $24 grill pan from Weber, perfect for the things that'll fall through the grates. It cleans pretty easy and if you want, you can actually even store it right on your grill. It's summer grilling season and these Good Housekeeping approved gifts are sure to stand out at your next barbecue. First, this 6 piece knife set from Schmidt Brothers sells at stores like Crate and Barrel for about $150. This one comes in this beautiful case and all the knives you need to cut *** really large brisket or *** really good steak, and they'll always stay sharp. Testers also love seasoning with these spice kits from the Spice House. You can buy individual spices. Or grab their gi boxes which start at $38. You can get the ones that are made for your barbecue, so we have *** smaller size, *** larger collection, and if you want to try *** bunch of different flavors, these from Rodney Scott are delicious. And the Meter Pro wireless thermometer, which costs $130 will really amp up your grill gain. It measures the internal temperature of food as well as the ambient temperature of the grill. You connect it to your phone, you can walk away, and they'll tell you exactly when it's done. Need help getting caked on grease off your grill? These Good Housekeeping approved tools should make cleaning up *** breeze. First, these Mr. Siga microfiber cloths come in *** 12 pack for around $13. They're not too expensive, and you can use them on the outside to get all this grease, or you can pair them with *** degreaser and really get *** good clean. This one is *** favorite from Good Housekeeping's cleaning lab. It's the $16. Grill cleaner and degreaser spray from Parker and Bailey. It cleans up messes really quickly and it can be used on the inside of your grates or the outside of your grill. Bristles from wire brushes can break off and stick to your grill grates, causing serious danger if ingested. Instead, testers like this $20 coiled grill brush from Kona. It really scrapes the grapes. It's great for your cast iron grapes, and I would do it as soon as you're done cooking, and you won't have to think about it the next time you cook. These Good Housekeeping approved coolers will keep your drinks ice cold. We test hard coolers, we test soft coolers, we test coolers on wheels, totes, you think it, we test it. Like the $200 Igloo Trailmate journey cooler. It retains temperature really well and it has these really big bulky wheels that are actually good for all different terrains. For *** lightweight option, the Arctic Ultra Light 52 quart hard cooler costs $210. so it's 30% lighter than other coolers that are this size. I love the handles that are loose and you can actually hold them pretty easy on your own...."
mov_9D1BFCAAB50D7938E777C65304EFFFAF,2025-07-09 21:29:00,en,WEB,"  Want to be sure you're buying products that are tried and true during the Prime Day sales? There are numerous items that have been tested and recommended by Good Housekeeping that are on sale this week. Here are a few of the products on sale that have won Good Housekeeping awards that our National Consumer Unit highlighted for you in previous coverage. Top grilling finds Good Housekeeping top-grill items on sale for Prime Day Lavatools Javelin® PRO Duo Ultra-Fast 1-Second Professional Digital Instant Read Meat Thermometer for Grill and Cooking, Auto-Rotating Backlit Display, IP65 Water Resistant, NSF Certified – Sambal SHOP NOW amazon.com Weber Q1200 Liquid Propane Grill SHOP NOW amazon.com amazon.com Coleman RoadTrip 225 Portable Tabletop Propane Grill Gas Grill SHOP NOW amazon.com MR.SIGA Microfiber Cleaning Cloth, Pack of 12 SHOP NOW amazon.com RTIC Ultra-Light 52 Quart Hard Cooler Insulated Portable Ice Chest Box for Beach, Drink, Beverage, Camping, Picnic, Fishing, Boat, Barbecue, 30% Lighter Than Rotomolded Coolers, Patriot SHOP NOW amazon.com Beauty award-winners Good Housekeeping Beauty Award picks on sale for Prime Day John Frieda ULTRAfiller+ Thickening Shampoo SHOP NOW John Frieda amazon.com Dove Styling Aid Intensive Repair Mask for Damaged Hair SHOP NOW amazon.com Coco & Eve Sunny Honey Bali Bronzing Foam SHOP NOW Coco & Eve amazon.com Dove Beauty Whole Body Aluminum Free Invisible Deodorant Spray SHOP NOW Dove Beauty amazon.com Winning finds in bedding Good Housekeeping Bedding Awards picks seeing Prime Day sales Mellanni Bed Sheet Set SHOP NOW amazon.com Bedsure Comforter Duvet Insert SHOP NOW amazon.com California Design Den Full/Queen Duvet Cover SHOP NOW California Design Den amazon.com..."
mov_F6E242267E4958352AEC710BFBE06289,2025-07-09 21:29:00,en,WEB,"  Want to be sure you're buying products that are tried and true during the Prime Day sales? There are numerous items that have been tested and recommended by Good Housekeeping that are on sale this week. Here are a few of the products on sale that have won Good Housekeeping awards that our National Consumer Unit highlighted for you in previous coverage. Top grilling finds Good Housekeeping top-grill items on sale for Prime Day Lavatools Javelin® PRO Duo Ultra-Fast 1-Second Professional Digital Instant Read Meat Thermometer for Grill and Cooking, Auto-Rotating Backlit Display, IP65 Water Resistant, NSF Certified – Sambal SHOP NOW amazon.com Weber Q1200 Liquid Propane Grill SHOP NOW amazon.com amazon.com Coleman RoadTrip 225 Portable Tabletop Propane Grill Gas Grill SHOP NOW amazon.com MR.SIGA Microfiber Cleaning Cloth, Pack of 12 SHOP NOW amazon.com RTIC Ultra-Light 52 Quart Hard Cooler Insulated Portable Ice Chest Box for Beach, Drink, Beverage, Camping, Picnic, Fishing, Boat, Barbecue, 30% Lighter Than Rotomolded Coolers, Patriot SHOP NOW amazon.com Beauty award-winners Good Housekeeping Beauty Award picks on sale for Prime Day John Frieda ULTRAfiller+ Thickening Shampoo SHOP NOW John Frieda amazon.com Dove Styling Aid Intensive Repair Mask for Damaged Hair SHOP NOW amazon.com Coco & Eve Sunny Honey Bali Bronzing Foam SHOP NOW Coco & Eve amazon.com Dove Beauty Whole Body Aluminum Free Invisible Deodorant Spray SHOP NOW Dove Beauty amazon.com Winning finds in bedding Good Housekeeping Bedding Awards picks seeing Prime Day sales Mellanni Bed Sheet Set SHOP NOW amazon.com Bedsure Comforter Duvet Insert SHOP NOW amazon.com California Design Den Full/Queen Duvet Cover SHOP NOW California Design Den amazon.com..."
mov_F5FEB6697E5CCE2CFC6ACEEBFA96749B,2025-07-09 21:29:00,en,WEB,"  Want to be sure you're buying products that are tried and true during the Prime Day sales? There are numerous items that have been tested and recommended by Good Housekeeping that are on sale this week. Here are a few of the products on sale that have won Good Housekeeping awards that our National Consumer Unit highlighted for you in previous coverage. Top grilling finds Good Housekeeping top-grill items on sale for Prime Day Lavatools Javelin® PRO Duo Ultra-Fast 1-Second Professional Digital Instant Read Meat Thermometer for Grill and Cooking, Auto-Rotating Backlit Display, IP65 Water Resistant, NSF Certified – Sambal SHOP NOW amazon.com Weber Q1200 Liquid Propane Grill SHOP NOW amazon.com amazon.com Coleman RoadTrip 225 Portable Tabletop Propane Grill Gas Grill SHOP NOW amazon.com MR.SIGA Microfiber Cleaning Cloth, Pack of 12 SHOP NOW amazon.com RTIC Ultra-Light 52 Quart Hard Cooler Insulated Portable Ice Chest Box for Beach, Drink, Beverage, Camping, Picnic, Fishing, Boat, Barbecue, 30% Lighter Than Rotomolded Coolers, Patriot SHOP NOW amazon.com Beauty award-winners Good Housekeeping Beauty Award picks on sale for Prime Day John Frieda ULTRAfiller+ Thickening Shampoo SHOP NOW John Frieda amazon.com Dove Styling Aid Intensive Repair Mask for Damaged Hair SHOP NOW amazon.com Coco & Eve Sunny Honey Bali Bronzing Foam SHOP NOW Coco & Eve amazon.com Dove Beauty Whole Body Aluminum Free Invisible Deodorant Spray SHOP NOW Dove Beauty amazon.com Winning finds in bedding Good Housekeeping Bedding Awards picks seeing Prime Day sales Mellanni Bed Sheet Set SHOP NOW amazon.com Bedsure Comforter Duvet Insert SHOP NOW amazon.com California Design Den Full/Queen Duvet Cover SHOP NOW California Design Den amazon.com..."
mov_7BC1AE6EF10BAEE818804BEDD219F153,2025-07-09 21:29:00,en,WEB,"  These portable grills tested by the experts at the Good Housekeeping Institute are great for your next backyard party, picnic, or camping trip. Over the past few years, my team and I have tested more than 50, and that includes charcoal grills, gas grills, portable grills, electric grills, and of course all the different accessories. The Weber Q 1200 liquid propane grill was Good Housekeeping's best overall pick at $259. We got really good heat distributions. And it has these folding side tables that *** lot of portable girls don't have. The Coleman Road Trip 225 portable tabletop propane grill was the best value pick at $165. There's two different cook zones on it, so you can cook one side on higher heat and then the other side on the lower heat. And for *** picnic, the Everdrecu portable charcoal grill costs $125. It heats up quickly, it's easy, it's lightweight, and it has these nice handles on the side so you can bring it with you. Good Housekeeping approved grilling gear for $50 or less. There are *** few things I always need with me when I'm grilling outside. These are some of the grilling products that Good Housekeeping editors love the most. First, the Turner and Tom's grilling set from Oxo for $23. They have these grips on the side so they stay cool, and they have this really great hook so you can hang it on the side of your barbecue. And there's actually even *** little bottle opener to check the. on your meat. This ultra fast thermometer from lava tools costs $43. It responds super quickly. You can actually see it's already reading the temperature of the room and it's magnetic, so you can actually stick it to the side of your grill or on your fridge, and this way it's always handy when you need it. And to grill up some veggies, this $24 grill pan from Weber, perfect for the things that'll fall through the grates. It cleans pretty easy and if you want, you can actually even store it right on your grill. It's summer grilling season and these Good Housekeeping approved gifts are sure to stand out at your next barbecue. First, this 6 piece knife set from Schmidt Brothers sells at stores like Crate and Barrel for about $150. This one comes in this beautiful case and all the knives you need to cut *** really large brisket or *** really good steak, and they'll always stay sharp. Testers also love seasoning with these spice kits from the Spice House. You can buy individual spices. Or grab their gi boxes which start at $38. You can get the ones that are made for your barbecue, so we have *** smaller size, *** larger collection, and if you want to try *** bunch of different flavors, these from Rodney Scott are delicious. And the Meter Pro wireless thermometer, which costs $130 will really amp up your grill gain. It measures the internal temperature of food as well as the ambient temperature of the grill. You connect it to your phone, you can walk away, and they'll tell you exactly when it's done. Need help getting caked on grease off your grill? These Good Housekeeping approved tools should make cleaning up *** breeze. First, these Mr. Siga microfiber cloths come in *** 12 pack for around $13. They're not too expensive, and you can use them on the outside to get all this grease, or you can pair them with *** degreaser and really get *** good clean. This one is *** favorite from Good Housekeeping's cleaning lab. It's the $16. Grill cleaner and degreaser spray from Parker and Bailey. It cleans up messes really quickly and it can be used on the inside of your grates or the outside of your grill. Bristles from wire brushes can break off and stick to your grill grates, causing serious danger if ingested. Instead, testers like this $20 coiled grill brush from Kona. It really scrapes the grapes. It's great for your cast iron grapes, and I would do it as soon as you're done cooking, and you won't have to think about it the next time you cook. These Good Housekeeping approved coolers will keep your drinks ice cold. We test hard coolers, we test soft coolers, we test coolers on wheels, totes, you think it, we test it. Like the $200 Igloo Trailmate journey cooler. It retains temperature really well and it has these really big bulky wheels that are actually good for all different terrains. For *** lightweight option, the Arctic Ultra Light 52 quart hard cooler costs $210. so it's 30% lighter than other coolers that are this size. I love the handles that are loose and you can actually hold them pretty easy on your own...."
