fid,timestamp,text_language,SocialMediaChannel,transcript
mov_5150A1C0D8F7AA2ECBA465AA5F9FE25A,2025-06-29 09:31:00,en,WEB,"  Another glorious fortnight awaits us as Wimbledon captures Britain's imagination again from Monday. However, while there are some things you can bank on – strawberries, rain delays and slippy grass – the actual sport can throw up plenty of intrigue. So we tasked our experts with picking their winners, wildcards and dream scenarios before the first ball is whacked in anger. Here are their predictions: Who will win the men's championship? All right, I'm not sure I actually believe this, but it's just too dull to predict a third Carlos Alcaraz title on the bounce. And if the new “Big Two” reach the trophy match, Jannik Sinner will have maximum motivation to seek revenge for that epic French Open final. Winner: Jannik Sinner I cannot look beyond the player who has lost on grass just three times in his life. Fortified by winning an astonishing French Open final and by his second triumph in three years at Queen's, the Spaniard is poised to complete a Wimbledon 'three-peat' at 22, a year earlier than even Roger Federer managed it. Winner: Carlos Alcaraz After the French Open epic, Queen's and his impressive history on grass, it is hard to look past Carlos Alcaraz to lift the title again. For someone who only recently turned 22, he manages himself well on the tour, giving himself time off – like a short break in Ibiza after the French Open, only to come back and win at Queen's. Given his last two titles, it is hard to see how anyone can stop him on grass, although Novak Djokovic may view Wimbledon as his best chance to win a 25th grand-slam tournament. Winner: Carlos Alcaraz It is hard to look past the Spaniard winning again, especially after his victory at Queen's. Given how uncomfortable Jannik Sinner looks on grass at times, if they met in the final, I'm backing the two-time winner. Winner: Carlos Alcaraz Who will win women's championship? It takes a true mystic to predict a Wimbledon ladies' champion these days. Look at the last three winners: Barbora Krejcikova, Marketa Vondrousova and Elena Rybakina. Most sports fans wouldn't know them from Eve. So, let's plump for another winner from the Eastern Bloc, past or present. How about 18-year-old Russian prodigy Mirra Andreeva? She has the distinct advantage of having Conchita Martinez, the 1994 champion here, in her player box. Winner: Mirra Andreeva The world No 1's crushing baseline power should have secured her the Venus Rosewater Dish by now, but the combination of a shoulder injury and the All England Club's 2022 ban on players from Russia and Belarus has ruled her out of two of the past three tournaments. She believes her game is well-suited to grass and has reached both grand-slam finals so far this season. Winner: Aryna Sabalenka After reaching three successive major finals, it is hard to think that Aryna Sabalenka will at least not be standing on Centre Court for the women's final day, but it remains to be seen how much those final losses will have affected her. Grass is not a straightforward surface, but it is more likely to suit Sabalenka than Coco Gauff, who cannot defend in the same way she did at Roland Garros. Although the women's draw is often a lot more open than the men's, with a far greater chance of upsets. Winner: Aryna Sabalenka The women's winner is much harder to predict. We haven't had a repeat winner since Serena Williams in 2016 so I'll be picking Aryna Sabalenka to finally get the job done. Her route to the final is kind and she's the biggest draw. Winner: Aryna Sabalenka How will the Brits do? A hefty 15 wildcards have boosted the British contingent to 23, the highest number since 1984. But their draws are collectively horrible, so it could be a bloodbath over the first few days. Jack Pinnington Jones is one left-field prospect who could prove a handful. His first-round opponent is to be Tomas Martin Etcheverry, a confirmed clay-courter from Argentina. I struggle to envisage a bountiful harvest here. The draws for the main hopes could scarcely be worse: both Jack Draper and Emma Raducanu potentially face former champions in the second round, while Katie Boulter will do well to dispatch world No 9 Paula Badosa in the first. But a fast-improving Jacob Fearnley could go far. Despite there being more British players in the main draw than any other year since 1984, most of those have come in via the wildcard system, and only one, Jack Draper, is seeded. Should he find an impressive run of form post-tonsilitis, there is a good chance he will be in the second week, although it is hard to see if any other British players will join him. Emma Raducanu will be the favourite against fellow home-grown talent Mimi Xu, but after that 2023 champion Markéta Vondroušová and Aryna Sabalenka stand in her path, while Katie Boulter was drawn against ninth seed Paula Badosa. It is going to be a struggle for the Brits. I can see a lot of first-round exits...."
mov_ADED4DAFF02F8454B2277E8F8A729779,2025-06-29 15:43:41,en,WEB,"  Being Emma Raducanu is not the easiest task. For all the positives that come with achieving fame early, as she did after her stunning US Open triumph as an 18-year-old in 2021, the obligations and attention can be intense. Invariably when she plays her photo is splashed on the back pages and her every move is scrutinised. At Wimbledon the attention grows exponentially and nothing is off limits, as Raducanu discovered when she batted away questions about a possible romance with Carlos Alcaraz, a longtime friend, with whom she will play mixed doubles at the US Open. As Andy Murray learned over many years, dealing with all that takes experience and patience. No wonder, then, that Raducanu says she is not looking much further than her first-round battle with the 17-year-old Welsh player Mimi Xu on Monday. “Truthfully I don't expect much from myself this year,” she said on the eve of the event. Related: Novak Djokovic confident Wimbledon is his 'best chance' of extending slam record “I know I've been dealing with certain things. I just want to go out there and embrace the moment. I want to embrace the occasion. I know there's not many opportunities to be playing at Wimbledon. You get it once a year and for a finite amount of time. I'm just looking forward to going out there and feeling the surroundings and the atmosphere.” Though the 22-year-old has already experienced so much in her career, it is worth remembering that this will be only her fourth Wimbledon. She reached the last 16 on her debut in 2021 and again last year, showing her aptitude for grass and revelling in front of her home crowd. After having surgery on both her wrists and one ankle in 2023, she dropped outside the top 300 but has worked her way back up the rankings to No 40, which also makes her the British No 1 again, a nice rivalry with Katie Boulter developing. Her grass-court season began with two good wins at the revamped women's event at the Queen's Club, and then in Eastbourne last week she lost in the second round against Maya Joint, the Australian who went on to win the title. There Raducanu said she was dealing with some bad news off the court but she was all smiles this weekend, practising with Boulter on Sunday. “I had one day off after Eastbourne, which is not much time,” Raducanu said. “Right now I'm just happy to be at Wimbledon. That is a great kind of motivation to just keep going and deal with everything else afterwards.” Raducanu has also been battling a niggling back issue in recent weeks, with occasional spasms a cause for concern and discomfort but nothing serious. “It's just been managing [it], as I've said the last few weeks,” she said. “I wouldn't say it's 100% but a lot of the time with tennis players nothing is ever 100%. So just taking it as it comes.” John McEnroe, a three-time Wimbledon singles champion, had back issues early in his career. Reflecting now he wonders whether they were caused by the stress of the tour. Raducanu has the use of all the best doctors, of course, but stress is an undoubted factor in players' injuries and maybe something she looks at too, in due course. Providing Raducanu gets past Xu she is likely to play Marketa Vondrousova, the 2023 champion, which would be a far from easy proposition. Get through that and the world No 1 and tournament favourite, Aryna Sabalenka, may well be waiting in round three. Having pulled out on the opening day of last year's event with a shoulder injury, the Belarusian cannot wait to get started. “I'm super excited, super happy to be back, to be healthy and to be able to compete at this beautiful tournament,” she said. Sabalenka and Coco Gauff, who beat her to win the French Open three weeks ago, are seeded to reach the final, but both know there are many threats and dangers lurking in the draw, including Madison Keys, the American who won her first grand slam title at the Australian Open in January, when she beat Sabalenka in a brilliant final. Jasmine Paolini, the runner-up last year, is back, as is last year's champion, Barbora Krejcikova, who missed the first five months of this season because of a back injury. The Czech's victory last year made her the eighth different champion in the past eight tournaments on the women's side, and with Elena Rybakina (2022), Vondrousova and Petra Kvitova (2011 and 2014) the only previous champions in the draw, another new winner is a distinct possibility. Kvitova will be making her last Wimbledon appearance, having announced she will retire after the US Open. The 35-year-old is back after missing last year's event because of the birth of her son and plans to enjoy every moment. The left-hander's performance in the 2014 final against Eugenie Bouchard remains one of the best of any final in Wimbledon history. She will be missed."
mov_5DE807A2047D0E1746C400AA4949F28B,2025-06-29 15:43:41,en,WEB,"  Being Emma Raducanu is not the easiest task. For all the positives that come with achieving fame early, as she did after her stunning US Open triumph as an 18-year-old in 2021, the obligations and attention can be intense. Invariably when she plays her photo is splashed on the back pages and her every move is scrutinised. At Wimbledon the attention grows exponentially and nothing is off limits, as Raducanu discovered when she batted away questions about a possible romance with Carlos Alcaraz, a longtime friend, with whom she will play mixed doubles at the US Open. As Andy Murray learned over many years, dealing with all that takes experience and patience. No wonder, then, that Raducanu says she is not looking much further than her first-round battle with the 17-year-old Welsh player Mimi Xu on Monday. “Truthfully I don't expect much from myself this year,” she said on the eve of the event. “I know I've been dealing with certain things. I just want to go out there and embrace the moment. I want to embrace the occasion. I know there's not many opportunities to be playing at Wimbledon. You get it once a year and for a finite amount of time. I'm just looking forward to going out there and feeling the surroundings and the atmosphere.” Though the 22-year-old has already experienced so much in her career, it is worth remembering that this will be only her fourth Wimbledon. She reached the last 16 on her debut in 2021 and again last year, showing her aptitude for grass and revelling in front of her home crowd. After having surgery on both her wrists and one ankle in 2023, she dropped outside the top 300 but has worked her way back up the rankings to No 40, which also makes her the British No 1 again, a nice rivalry with Katie Boulter developing. Her grass-court season began with two good wins at the revamped women's event at the Queen's Club, and then in Eastbourne last week she lost in the second round against Maya Joint, the Australian who went on to win the title. There Raducanu said she was dealing with some bad news off the court but she was all smiles this weekend, practising with Boulter on Sunday. “I had one day off after Eastbourne, which is not much time,” Raducanu said. “Right now I'm just happy to be at Wimbledon. That is a great kind of motivation to just keep going and deal with everything else afterwards.” Raducanu has also been battling a niggling back issue in recent weeks, with occasional spasms a cause for concern and discomfort but nothing serious. “It's just been managing [it], as I've said the last few weeks,” she said. “I wouldn't say it's 100% but a lot of the time with tennis players nothing is ever 100%. So just taking it as it comes.” John McEnroe, a three-time Wimbledon singles champion, had back issues early in his career. Reflecting now he wonders whether they were caused by the stress of the tour. Raducanu has the use of all the best doctors, of course, but stress is an undoubted factor in players' injuries and maybe something she looks at too, in due course. Providing Raducanu gets past Xu she is likely to play Marketa Vondrousova, the 2023 champion, which would be a far from easy proposition. Get through that and the world No 1 and tournament favourite, Aryna Sabalenka, may well be waiting in round three. Having pulled out on the opening day of last year's event with a shoulder injury, the Belarusian cannot wait to get started. “I'm super excited, super happy to be back, to be healthy and to be able to compete at this beautiful tournament,” she said. Sabalenka and Coco Gauff, who beat her to win the French Open three weeks ago, are seeded to reach the final, but both know there are many threats and dangers lurking in the draw, including Madison Keys, the American who won her first grand slam title at the Australian Open in January, when she beat Sabalenka in a brilliant final. Jasmine Paolini, the runner-up last year, is back, as is last year's champion, Barbora Krejcikova, who missed the first five months of this season because of a back injury. The Czech's victory last year made her the eighth different champion in the past eight tournaments on the women's side, and with Elena Rybakina (2022), Vondrousova and Petra Kvitova (2011 and 2014) the only previous champions in the draw, another new winner is a distinct possibility. Kvitova will be making her last Wimbledon appearance, having announced she will retire after the US Open. The 35-year-old is back after missing last year's event because of the birth of her son and plans to enjoy every moment. The left-hander's performance in the 2014 final against Eugenie Bouchard remains one of the best of any final in Wimbledon history. She will be missed."
Ugx8UkDtai0USb_xxHl4AaABAg,2025-06-29 18:41:18,en,YOUTUBE,"  Hi Beauties!! Surprise! Here to the Most Unbelievable Haul from ... AMAZON Designer Inspired finds that are going to BLOW YOUR MIND! Oh my, I'm in shock! Plus I will be unboxing New exciting things from Dior, Sephora, to Summer Fashion pieces from Zara, Abercrombie, H&M, some Luxury PR from Chantecaille, Tatcha to Home Lux Pieces ... even a Ninja Slushy. Below find the links to each of the items on this haul and let me know Which were your favorites? My Amazon Storefront https://www.amazon.com/shop/heyitsjackeline NEW IN here https://shopmy.us/heyitsjackeline NEW RELEASES https://linktr.ee/HeyItsJackeline ▼ AMAZON FINDS & HAUL ▼ ZIIP Halo https://go.shopmy.us/p-20392534 Exclusive discount ZIIPJACKELINE Loewe Flamenco inspired Bag https://amzn.to/449lh09 Hermes inspired Roulis Bag https://amzn.to/3FWwQQt Khaite Raffia Lotus inspired Hobo Bag https://amzn.to/4ncEjeV Chanel inspired Dad Sandals https://amzn.to/44aKNCe Bottega inspired Yellow Bag https://amzn.to/465KJGP Louis Vuitton Nice BB Satin Insert https://amzn.to/44orVzJ Makeup Silicone Travel Case https://amzn.to/4lsjR83 Hair Clips Prongs Alligator https://amzn.to/4lbMZku Pink Supplement Case https://amzn.to/3Gooq4n White Supplement Case https://amzn.to/4ewCupg Bose Ultra Open Earbuds go.shopmy.us/p-20393903 DIOR J'Adore Hand Cream https://bit.ly/4kkToZk One Size Glass Setting Spray https://bit.ly/4jV5bNz One Size Setting Spray SPF 28 https://bit.ly/469ud8v Supergoop Lip SPF 40 - Pink Peppermint https://bit.ly/4lxunLr Saie Blush - Ciao https://bit.ly/3TLSiuy https://go.shopmy.us/p-20395366 CHARLOTTE TILBURY Blush Sticks https://bit.ly/3TEqoRg (Sephora) (US) https://bit.ly/4kR7z9s Charlotte Tilbury website 15% OFF Code: heyitsjackelineFA0Q1 https://go.shopmy.us/p-20205042 (UK) Ninja Slushi QVC https://go.shopmy.us/p-20394043 Spice Jars https://amzn.to/3TjLO66 Marble Flora Ruffled Centerpiece Arteriors https://go.shopmy.us/p-20392373 ZARA Yellow Sequin Skirt https://bit.ly/4loZzwg Abercrombie Mint Green Linen Top https://go.shopmy.us/p-20382699 Abercrombie White Cross Back Linen Top https://go.shopmy.us/p-20382720 Abercrombie White Linen Top Seashell Beads https://go.shopmy.us/p-20382816 Abercrombie White Linen Strapless Belted Top https://go.shopmy.us/p-20382958 Abercrombie Black Linen V Top https://go.shopmy.us/p-20383096 Bottega inspired Gold Kitten Heel Mule Sandals https://amzn.to/4nyexlF Abercrombie Black Linen Romper https://go.shopmy.us/p-20383194 H&M Mediterranean Kaftan Blouse https://go.shopmy.us/p-20395540 H&M Blue Mykonos Dress https://go.shopmy.us/p-20395662 H&M Light Weight Lady Cardigan https://go.shopmy.us/p-20395509 H&M Black dress https://go.shopmy.us/p-20383397 Salt & Stone Saffron Body Wash go.shopmy.us/p-20394344 Salt & Stone Saffron Deodorant go.shopmy.us/p-20394313 Salt & Stone Saffron Body Mist go.shopmy.us/p-20394334 Coco & Eve Gradual Tanning Lotion https://go.shopmy.us/p-20394484 Coco & Eve Face Tanning Spray https://go.shopmy.us/p-20394456..."
18049398533400713,2025-06-30 07:42:15,en,INSTAGRAM,  my top 5 picks for glowing skin all under $20! 1. Madecassoside blemish repair serum 2. Madecassoside blemish toner pads 3. Paula's choice acne spray 4. AmLactin daily norish 12% 5. coco & Eve antioxidant face mist #glowingskin #blemishrepairserum #koreanskincare #skinbarrierrepair #glasskin #hyperpigmentation #unevenskintone#amazonbestseller  #mediheal #primedaydeals #primedaymusthaves
n1b66ts,2025-07-04 14:15:29,en,REDDIT,  Here's something that has worked for me. I'm 58F and my skin has some spots and scars from all the years. I have used self tanner (coco and eve; jergens natural glow). I am pretty pale and use the lightest shade to just even out my skin. But my favorite is Tinge. I think it's marketed as a “body foundation” or “body makeup”. It's about $40 but the bottle lasts a long time. There's a skin color test on their website. I bought a body brush from Amazon for about $10. It does not rub off on clothes or sheets and gives me an airbrushed/filter look. Covers enough of the spots/discoloration to make me look a lot better. Not chalky or fake. I just love it. Here's a good representation. It's on the right leg. No paid endorsement or anything like that. ! [img](ojntpblj8vaf1)
1941157613678325979,2025-07-04 15:30:14,en,TWITTER,"  Our Tripeptide Hair Density Serum enhances the look of thicker, fuller hair with a lightweight, fragrance-free formula. Shop Coco & Eve today! https://t.co/8MubLQrY8d"
