fid,timestamp,text_language,SocialMediaChannel,transcript
my50uos,2025-06-16 19:58:11,en,REDDIT,"  You find a thin palatable carrier oil, I use 100% argan oil because I have it on hand for hair and skincare and it is inexpensive on Amazon ,$8 for almost a year supply. Then I get some 100% peppermint oil from Walmart health and beauty section -$6 for guru nanda brand. I then fill a  really good sealing travel size bottle with  my argan oil  and I add ample drops of  peppermint oil to my argan oil  to the desired strength. Some like it less minty some like it more minty... I tend to like mine  pretty strong. Shake it up. Now you have an all purpose magic potion. I use it to condition my hair, skin, or to feel cool if I'm over heated,  I use it instead of lube too. It also happens to be magic for when you get dry mouth and those fucked up sore spots on your tongue and mouth... You swish it around in your mouth when it starts to get irritated and fucked up and OMG it soothes the stinging sore spots  makes my mouth feel sooo much better. I do that every time my mouth starts to bother me ."
1le5e9d,2025-06-18 02:03:17,en,REDDIT,"  I originally went to get a water dispenser for my cat and left with a $40 in fun size candy, singles drink packets, and some stuff from the beauty aisle. Really excited about the Guru Nanda whitening pen, they're normally $2.50 on Amazon and the strips got such great reviews on Twitter."
myox8v5,2025-06-19 20:21:18,en,REDDIT,"  Use sensodyne toothpaste, also I won't lie crest strips did little to nothing for me while also hurting me sooo bad. I switched to guru nanda on amazon and they work soooo much better- no pain too!"
1935812082093457445,2025-06-19 21:29:00,en,TWITTER,"  If she remembers when guru nanda was #1 on tiktok shop, she's too young for u bro"
18006514340781916,2025-06-21 15:30:42,en,INSTAGRAM,"  Heaven sounds of sitar🥰🥰🥰🥰Happy Diwali Everyone! Presenting the full performance of the viral song ""Chanakya"" by Rishab Rikhiram Sharma. ""Chanakya"" is an ode to the legendary kingmaker Chanakya (Kautilya), who was instrumental in guiding Chandragupta to overthrow the Nanda dynasty. As the third release from Rishab's album Navaras, this powerful track captures the spirit of victory, symbolizing the triumph of good over evil and the essence of freedom. Out of the Navaras (9 emotions), ""Chanakya"" channels Veer Rasa (heroic sentiment) with its grand orchestration and immersive sound design. This live performance was part of Rishab's Sitar for Mental Health India Tour 2024 in Mumbai, presented in partnership with HSBC. Song: Chanakya Vocals, Sitar, and Music Production: Rishab Rikhiram Sharma Venue: NCPA Auditorium, Mumbai Musicians: Rishab Rikhiram Sharma – Sitar & Vocals Debjit Patitundi – Tabla Keith Peters – Bass Raghuraman – Guitar Kutala Khan – Khartal Video Edited by Namrata Misra Artwork by Vishali Bawa About Sitar for Mental Health: Founded in 2021 by Rishab, 'Sitar for Mental Health' seeks to promote mental wellness through the healing power of Indian classical music. By collaborating with mental health experts, we provide a holistic experience that integrates music therapy with mindfulness, creating a space for emotional awareness and personal growth. Our mission is to foster inner peace and mental clarity through the arts. About Rishab Rikhiram Sharma: A New York-based sitarist, composer, and mental health advocate, Rishab Rikhiram Sharma is dedicated to fusing the timeless beauty of Indian classical music with modern innovations. Born into the iconic Rikhi Ram family, Rishab began his training under the guidance of his father, Sanjay Sharma, and his guru, Pt. Ravi Shankar, becoming his final disciple. He has performed on prestigious stages worldwide, including the White House, sharing his vision of music as a means to promote mental health and well-being. Stream ""Chanakya"" on all platforms: Spotify: https://open.spotify.c... Apple Music: https://music.apple.co... Amazon Music: https://www.amazon.#song #instagram #india #world #worldwide"
0e157e1ab0c4a9ba5b2e0d42b31df614,2025-06-22 01:39:00,id,WEB,"  SPR_COMBO[id]PEDOMAN KARYA Ahad, 22 Juni 2025 Hilmy Hafidah: Jadi Wisudawan Terbaik Unismuh Makassar Bukan Berarti Saya Paling Hebat “Hari ini bukan tentang toga dan ijazah, tapi tentang malam-malam tanpa tidur, air mata dalam diam, serta doa-doa yang tak henti dipanjatkan.” Kalimat itu diucapkan Hilmy Hafidah, Wisudawan Terbaik Tingkat Universitas pada saat memberikan kesan dan pesan pada Acara Wisuda ke-85 Universitas Muhammadiyah (Unismuh) Makassar, di Balai Sidang Muktamar 47 Kampus Unismuh Makassar, Sabtu, 21 Juni 2025. Bukan dengan nada menyombongkan prestasi, melainkan penuh syukur dan kerendahan hati, ia menegaskan bahwa keberhasilannya adalah buah perjuangan kolektif—dari teman-teman seperjuangan, para dosen, hingga orang tua tercinta. “Perlu saya sampaikan, menyandang gelar wisudawan terbaik bukan berarti saya adalah yang paling hebat atau paling pintar di antara teman-teman semua,” ujar Hilmy yang merupakan alumni Program Studi Pendidikan Guru Sekolah Dasar (PGSD), Fakultas Keguruan dan Ilmu Pendidikan (FKIP) Unismuh Makassar. Perempuan asal Kabupaten Takalar ini menyelesaikan studinya dalam waktu 3 tahun 8 bulan dengan indeks prestasi kumulatif (IPK) hampir sempurna, yakni 3,99, dan nilai rata-rata 95,66. Namun, ia menolak menjadikan angka itu sebagai satu-satunya tolok ukur keberhasilan. “Saya hanyalah satu dari sekian banyak mahasiswa hebat di kampus ini, yang sama-sama berjuang, sama-sama jatuh bangun, dan saling menginspirasi,” kata Hilmy. Hilmy mengutip Al-Qur'an, Surah Al-Mujadilah, ayat 11, untuk mengingatkan bahwa ilmu bukan sekadar pencapaian akademik, melainkan tanggung jawab sosial dan spiritual. “Allah akan meninggikan derajat orang-orang yang beriman dan berilmu,” ujar Hilmy, lalu melanjutkan, “Tugas kita setelah ini adalah menjadikan ilmu sebagai cahaya bagi sekitar, bukan sekadar untuk mengejar gelar atau harta.” Mengutip Nelson Mandela dan Imam Syafi'i, Hilmy mengajak seluruh wisudawan untuk terus belajar, tetap rendah hati, dan senantiasa membawa nilai-nilai kebaikan yang telah diajarkan oleh almamater tercinta. Pada momen penuh haru itu, Hilmy juga menyampaikan ucapan khusus kepada Unismuh Makassar, atas pencapaian Unismuh Makassar masuk dalam pemeringkatan perguruan tinggi dunia versi Times Higher Education (THE) Impact Rankings 2025. “Ini bukti bahwa kampus kita tak hanya besar secara nasional, tapi juga diakui secara global,” kata Hilmy. Ia juga menilai Rektor Unismuh Makassar, Abdur Rakhim Nanda, telah membawa arah transformasi kampus menuju Integrated, Green, Islamic, Futuristic (I-GIFt), bukan sekadar motto, tapi visi nyata menuju universitas masa depan yang berdaya saing dan berkarakter Islami. Hilmy juga menyebut Ketua Prodi PGSD, Dr Aliem Bahri, yang juga pembimbingnya dalam menyusun skripsi, sebagai “menjadi pelita dalam perjalanan keilmuan.” Ia pun tak lupa menyampakan terima kasih kepada orang tua dan keluarga, atas cinta, doa, dan peluh yang tak terbalas. Begitu pun kepada Unit Kegiatan Mahasiswa (UKM) Lembaga Kreativitas Ilmiah Mahasiswa Penelitian dan Penalaran (LKIM-Pena), tempat ia belajar berpikir kritis dan menulis dengan hati, kepada Ikatan Mahasiswa Muhammadiyah (IMM) tempatnya menempa idealisme dan makna perjuangan, serta kepada almamater tercinta Unismuh Makassar, rumah intelektual dan spiritual yang telah membentuknya hingga sejauh ini. Mengakhiri pidatonya, Hilmy menyuarakan slogan UKM LKIM Pena: “Kerja keras, kerja cerdas, kerja ikhlas, sukses”, dan menutup dengan petuah Bugis yang sarat makna. “Resopa temmangingngi namalomo nalatei pammase dewata, hanya dengan kerja keras dan kesungguhan hati, seseorang akan mendapat rahmat Ilahi,” kata Hilmy. Menerima Tawaran Jadi Dosen Kepada wartawan seusai wisuda, Hilmy mengatakan ia menerima tawaran Rektor Unismuh Makassar Abdul Rakhim Nanda kepada dirinya untuk menjadi dosen Unismuh Makassar sebagai wisudawan berprestasi. “Untuk rencana selanjutnya, insya Allah saya akan menerima tawaran dari universitas yaitu menjadi dosen di Universitas Muhammadiyah Makassar. Saya akan menerima beasiswa yang diberikan oleh universitas kepada saya, dan insya Allah akan saya manfaatkan sebaik mungkin. Karena bagi saya ini adalah kesempatan luar biasa yang diberikan dan menjadi suatu kehormatan bagi saya karena saya yang diberikan amanah wisudawan terbaik,” tutur Hilmy. Biodata Hilmy Hafidah Hilmy Hafidah, perempuan kelahiran Gowa, 08 Juni 2004, adalah anak pertama dari dua bersaudara, dari ayah Hamiruddin, dan ibu Haswati. Selama kuliah, Hilmy telah dua tulisannya yang termuat pada jurnal ilmiah, yaitu pertama karya berjudul: “KeEffectiveness of differentiated learning in improving 4th grade reading skills MIS Masino” pada Journal Of Curriculum Development Universitas Pendidikan Indonesia, Bandung, Tahun 2025. Tulisan kedua, “Analisis pengaruh merdeka belajar kampus merdeka terhadap kualitas pengetahan mahasiswa Unismuh Makassar” pada Jurnal Penelitian dan Penalaran Universitas Muhammadiyah Makassar” Tahun 2025. Hilmy juga banyak mengikuti lomba dan kompetisi, antara lain Juara II (Silver Medal) pada Jakarta International Science Fair (JISF), yang diadakan Kementerian Agama Republik Indonesia, Universitas PTIQ Jakkarta, dan IYSA, Tahun 2025, dengan hasil Juga finalis International Youth Summit yang diadakan Universitas Sains Islam Malaysia dan Sentosa Foundation Tahun 2025, Juara II (Silver Medal) International Short Story Writing Competition, yang diadakan Sharepedia.id, Tahun 2025, Finalis Kampus Mengajar Angkatan ke-7, yang diadakan Kemendikbudristek RI Tahun 2024. Hilmy keluar sebagai Juara II Lomba Futuristics Prestige and Research Technology abd art (FAPERTA FAIR 4) yang diadakan Universitas Dhyana Pura (Undhira) Bali dan Sentosa Foundation, tahun 2023. Hilmy Hafidah juga meraih Pendanaan Bidang PKMPM Program Kreativitas Mahasiswa, Belmawa dan Kemendikbudristek tahun 2023, serta Pendanaan Bidang PKMPM, National Essay Competition (NEC), Belmawa dan Kemendikbudristek, tahun 2023. Organisasi Selain aktif berkarya dan mengikuti kompetisi, Hilmy Hafidah juga aktif dalam beberapa organisasi, antara lain Himpunan Pelajar dan Mahasiswa Takalar (Hipermata) Komisariat Unismuh Makassar, Himpunan Mahasiswa Program Studi (Himaprodi) PGSD FKIP Unismuh Makassar, Ikatan Mahasiswa Muhammadiyah (IMM) Komisariat Galesong Takalar, serta Lembaga Kreativitas Ilmiah Mahasiswa Penelitian dan Penalaran (LKIM-PENA) Unismuh Makassar. Semasa sekolah dari SD hingga SMA, Hilmy juga sudah sering mengikuti kegiatan dan lomba, antara lain olimpiade matematika, lomba menari, pramuka, MTQ, dan lomba pidato Bahasa Arab. Cerdas dan Bersungguh-sungguh Ketua Program Studi PGSD FKIP Unismuh Makassar, Dr Aliem Bahri, yang juga pembimbing skripsi Hilmy Hafidah, yang diminta komentarnya mengatakan, sejak awal masuk di Prodi PGSD, Hilmy Hafidah memang telah menunjukkan semangat dan motivasi yang sangat baik. “Ia bukan hanya mahasiswa yang cerdas dan bersungguh-sungguh dalam menempuh perkuliahan, tetapi juga pribadi yang aktif berkontribusi di luar kelas melalui berbagai organisasi seperti LKIM PENA, Ikatan Mahasiswa Muhammadiyah, dan beberapa organisasi lainnya,” kata Aliem. Lewat tulisan-tulisannya yang reflektif dan semangatnya mengikuti berbagai kompetisi, Hilmy mendapatkan hasil yang luar biasa. Semua itu dilakukannya dengan ketulusan dan dedikasi yang konsisten. “Menjadi wisudawan terbaik universitas adalah buah dari proses panjang yang dijalani dengan penuh kesungguhan. Atas nama program studi, kami menyampaikan rasa bangga yang mendalam dan doa terbaik untuk masa depan yang gemilang, serta mampu menjadi inspirasi bagi yang lain, khususnya mahasiswa PGSD,” kata Aliem. (asnawin)"
mov_F862820A104B367D05BE02366EB6E94D,2025-06-23 15:29:02,en,WEB,"  100+ Indian Classical Dancers took the Stage in Dubai for a Thematic Dance Production Celebrating the Timeless Power of Women Dubai, UAE – June 22, 2025: The vibrant city of Dubai witnessed a spectacular celebration of Indian art, culture, and community during a grand Indian classical dance show NARI SHAKTI (the power of women) which brought together 15 performances from over 100 artists. Culminating in the awe-inspiring thematic Bharatanatyam dance production, AGNI KANYE, the life of Draupadi, masterminded by the young & visionary Guru. Iswarya Bharadwaj, Founder of NANDA Performing Arts Centre & Gulf Indian Performing Arts & Music Society (GIPAMS), the show moved 2000+ multinational guests, onsite and online, multinational audiences emotionally with several of them in tears. The show was entirely conceptualized, planned & executed by women with majority self-made props & costumes, and supported by the Indian People's Forum (IPF), Trescon, SkyBlue Media, Precision Metals, Sprouts Speech Centre, Parva Group, Biyani Jewels, Almarai, GateWay ME, Konfhub, Introbot, Indian Women in Dubai, Gulf Gelathiyaru, Karnataka Sangha Dubai and UAE Tamil Sangam. AGNI KANYE: A Thematic Triumph of Good over Evil The centerpiece of the evening, AGNI KANYE, was a grand thematic Bharatanatyam dance production that captivated the audience with vibrant costumes, powerful narrative, mesmerizing choreography & impactful story-telling about the life of the famed Draupadi from Mahabharata, one of the two renowned Hindu epics in which families & friends from Kaurava & Pandava dynasties fought the holy war of Kurukshetra. The production brought together dancers as young as five and as experienced as fifty, showcasing the beauty of intergenerational collaboration and the transformative power of the arts. The inclusive show included exhibits from people of determination & women, and conferred the title of NARI SHAKTI to impactful women namely Karthika Vaidyanathan (Carnatic Singer & Filmfare Awardee), Puja Unni (Classical Dancer) and Renuka Parameshwar (Carnatic Teacher) for embodying the spirit of feminine power like Draupadi and creating positive impact on the society. UAE: A Global Beacon for Arts, A Stage for Dreams and Diversity NARI SHAKTI underscored the UAE's role as a global hub for artistic expression and cultural exchange. It was not just a showcase of talent—it was a living testament to the UAE's commitment to fostering an inclusive and tolerant society. The show highlighted how the Emirates continues to nurture global arts, culture, and communities, providing a platform where creativity knows no boundaries of age, nationality, or background. Iswarya's own journey which now inspires thousands is a shining example of this spirit. Raised in a humble, high-thinking Indian household in the UAE, Iswarya's ascent to 50+ awards & 500+ global stages—from the UK Parliament to Expo 2020 Dubai—has been powered by resilience, family support, and the UAE's visionary leadership. Looking Ahead: Empowering Through the Arts Iswarya says “My mission extends beyond the stage—I aim to launch arts-powered corporate wellness programs, focus on arts as a powerful medium for PODs, counsel aspiring artists for arts career, and perform for the Rulers of Dubai and Abu Dhabi as a tribute to their inclusive & tolerant leadership, and commitment to arts & women empowerment.” For media inquiries, interviews, or further information: connect@nanda.ae | +971589181900"
mov_7D11DC18CC5BF8CF9D080B8E44B0BBD2,2025-06-23 16:41:56,en,WEB,"  100+ Indian Classical Dancers took the Stage in Dubai for a Thematic Dance Production Celebrating the Timeless Power of Women. Dubai, UAE – June 22, 2025 The vibrant city of Dubai witnessed a spectacular celebration of Indian art, culture, and community during a grand Indian classical dance show NARI SHAKTI (the power of women) which brought together 15 performances from over 100 artists. Culminating in the awe-inspiring thematic Bharatanatyam dance production, AGNI KANYE, the life of Draupadi, masterminded by the young & visionary Guru. Iswarya Bharadwaj, Founder of NANDA Performing Arts Centre & Gulf Indian Performing Arts & Music Society (GIPAMS), the show moved 2000+ multinational guests, onsite and online, multinational audiences emotionally with several of them in tears. The show was entirely conceptualized, planned & executed by women with majority self-made props & costumes, and supported by the Indian People's Forum (IPF), Trescon, SkyBlue Media, Precision Metals, Sprouts Speech Centre, Parva Group, Biyani Jewels, Almarai, GateWay ME, Konfhub, Introbot, Indian Women in Dubai, Gulf Gelathiyaru, Karnataka Sangha Dubai and UAE Tamil Sangam. AGNI KANYE: A Thematic Triumph of Good over Evil The centerpiece of the evening, AGNI KANYE, was a grand thematic Bharatanatyam dance production that captivated the audience with vibrant costumes, powerful narrative, mesmerizing choreography & impactful story-telling about the life of the famed Draupadi from Mahabharata, one of the two renowned Hindu epics in which families & friends from Kaurava & Pandava dynasties fought the holy war of Kurukshetra. The production brought together dancers as young as five and as experienced as fifty, showcasing the beauty of intergenerational collaboration and the transformative power of the arts. The inclusive show included exhibits from people of determination & women, and conferred the title of NARI SHAKTI to impactful women namely Karthika Vaidyanathan (Carnatic Singer & Filmfare Awardee), Puja Unni (Classical Dancer) and Renuka Parameshwar (Carnatic Teacher) for embodying the spirit of feminine power like Draupadi and creating positive impact on the society. UAE: A Global Beacon for Arts, A Stage for Dreams and Diversity NARI SHAKTI underscored the UAE's role as a global hub for artistic expression and cultural exchange. It was not just a showcase of talent—it was a living testament to the UAE's commitment to fostering an inclusive and tolerant society. The show highlighted how the Emirates continues to nurture global arts, culture, and communities, providing a platform where creativity knows no boundaries of age, nationality, or background. Iswarya's own journey which now inspires thousands is a shining example of this spirit. Raised in a humble, high-thinking Indian household in the UAE, Iswarya's ascent to 50+ awards & 500+ global stages—from the UK Parliament to Expo 2020 Dubai—has been powered by resilience, family support, and the UAE's visionary leadership. Looking Ahead: Empowering Through the Arts Iswarya says “My mission extends beyond the stage—I aim to launch arts-powered corporate wellness programs, focus on arts as a powerful medium for PODs, counsel aspiring artists for arts career, and perform for the Rulers of Dubai and Abu Dhabi as a tribute to their inclusive & tolerant leadership, and commitment to arts & women empowerment.”"
mov_4ACA7E1AA93FCDE64B84C27A23EED70D,2025-06-23 17:25:15,en,WEB,"  100+ Indian Classical Dancers took the Stage in Dubai for a Thematic Dance Production Celebrating the Timeless Power of Women         Dubai, UAE – June 22, 2025: The vibrant city of Dubai witnessed a spectacular celebration of Indian art, culture, and community during a grand Indian classical dance show NARI SHAKTI (the power of women) which brought together 15 performances from over 100 artists. Culminating in the awe-inspiring thematic Bharatanatyam dance production, AGNI KANYE, the life of Draupadi, masterminded by the young & visionary Guru. Iswarya Bharadwaj, Founder of NANDA Performing Arts Centre & Gulf Indian Performing Arts & Music Society (GIPAMS), the show moved 2000+ multinational guests, onsite and online, multinational audiences emotionally with several of them in tears. The show was entirely conceptualized, planned & executed by women with majority self-made props & costumes, and supported by the Indian People's Forum (IPF), Trescon, SkyBlue Media, Precision Metals, Sprouts Speech Centre, Parva Group, Biyani Jewels, Almarai, GateWay ME, Konfhub, Introbot, Indian Women in Dubai, Gulf Gelathiyaru, Karnataka Sangha Dubai and UAE Tamil Sangam. AGNI KANYE: A Thematic Triumph of Good over Evil     The centerpiece of the evening, AGNI KANYE, was a grand thematic Bharatanatyam dance production that captivated the audience with vibrant costumes, powerful narrative, mesmerizing choreography & impactful story-telling about the life of the famed Draupadi from Mahabharata, one of the two renowned Hindu epics in which families & friends from Kaurava & Pandava dynasties fought the holy war of Kurukshetra. The production brought together dancers as young as five and as experienced as fifty, showcasing the beauty of intergenerational collaboration and the transformative power of the arts. The inclusive show included exhibits from people of determination & women, and conferred the title of NARI SHAKTI to impactful women namely Karthika Vaidyanathan (Carnatic Singer & Filmfare Awardee), Puja Unni (Classical Dancer) and Renuka Parameshwar (Carnatic Teacher) for embodying the spirit of feminine power like Draupadi and creating positive impact on the society. UAE: A Global Beacon for Arts, A Stage for Dreams and Diversity     NARI SHAKTI underscored the UAE's role as a global hub for artistic expression and cultural exchange. It was not just a showcase of talent—it was a living testament to the UAE's commitment to fostering an inclusive and tolerant society. The show highlighted how the Emirates continues to nurture global arts, culture, and communities, providing a platform where creativity knows no boundaries of age, nationality, or background. Iswarya's own journey which now inspires thousands is a shining example of this spirit. Raised in a humble, high-thinking Indian household in the UAE, Iswarya's ascent to 50+ awards & 500+ global stages—from the UK Parliament to Expo 2020 Dubai—has been powered by resilience, family support, and the UAE's visionary leadership. Looking Ahead: Empowering Through the Arts     Iswarya says “My mission extends beyond the stage—I aim to launch arts-powered corporate wellness programs, focus on arts as a powerful medium for PODs, counsel aspiring artists for arts career, and perform for the Rulers of Dubai and Abu Dhabi as a tribute to their inclusive & tolerant leadership, and commitment to arts & women empowerment.” For media inquiries, interviews, or further information: connect@nanda.ae | +971589181900"
