fid,timestamp,text_language,SocialMediaChannel,transcript
mxtsrlp,2025-06-15 00:03:19,en,REDDIT,"  Totally get the skepticism — but yep, I'd be using my own card and shipping to my own forwarding address, just like any Amazon order. I wouldn't even need access to someone's full account, just enough to complete the purchase as a guest or with a membership tied to it. Sorry, I'm more of a Reddit reader than poster. I figured this one time was worth asking since the price difference on Le Labo is pretty wild."
1934279562004734203,2025-06-15 15:59:19,fr,TWITTER,"  🎧 NOUVEAU PODCAST— Le Starter Pack des entretiens 🎧 Sur Le Labo des CIP ➔ https://t.co/Tb8J3tGnjA 🎧 Via La Collab' avec Pascal Kufel ➔ sur toutes vos plateformes préférées avec ce lien (Amazon, Deezer, ITunes…) :  https://t.co/ypYNYjRXgU https://t.co/YSI1OdKjTX"
1934293275797500056,2025-06-15 16:53:49,fr,TWITTER,"  SPR_COMBO[fr]🎧 NOUVEAU PODCAST— Le Starter Pack des entretiens 🎧 Sur Le Labo des CIP ➔ https://t.co/Tb8J3tGnjA 🎧 Via La Collab' avec Pascal Kufel ➔ sur toutes vos plateformes préférées avec ce lien (Amazon, Deezer, ITunes…) :  https://t.co/ypYNYjRXgU https://t.co/YSI1OdKjTX"
mxy2ref,2025-06-15 18:07:05,fr,REDDIT,"  SPR_COMBO[fr]c'est un labo d'analyse qui se charge de l'analyse de l'eau nous on était passé par un labo agrée par l'ANSES parce que c'était pour savoir si elle était potable, dans ton cas ce n'est peut-être pas obligatoire. en tout cas voila la liste: https://www.anses.fr/fr/content/liste-des-laboratoires-agrees-pour-le-controle-sanitaire-des-eaux je précise que la transmission depuis un autre chien ça peut se faire sans qu'il soit au contant direct de l'animal, par exemple pendant la balade si il renifle une trace d'urine d'un chien contaminé (faut que ce soit humide, si c'est sec il y a peu de risque), ou si un autre chien est venu pisser chez vous. mais d'après ce que tu dis ça semble effectivement plausible et probable que ce soit une population de rongeur infectés, et si ton bassin est vecteur de transmission, on peut supposer que tous les animaux qui boivent dedans sont potentiellement contaminés. pour éliminer le réservoir de la bactérie, il va malheureusement falloir te débarrasser de ces rongeurs. l'approche qui consiste à les capturer et à les soigner/vacciner parait irréalisable car coûteuse et pas pratique. à moins qu'il existe un traitement oral que tu pourrais mettre dans des appats que tu dissémines un peu partout dans les environs. je sais qu'on a fait ça pour éradiquer la rage chez les renards dans ma région."
mov_A3B65317F03857CB9390FBCFF0864307,2025-06-15 20:10:41,en,WEB,  Our Brands View all Click Here AERIN Beauty AERIN Beauty View Brand Page Aramis Aramis View Brand Page Aveda Aveda View Brand Page Balmain Beauty Balmain Beauty View Brand Page Bobbi Brown Cosmetics Bobbi Brown Cosmetics View Brand Page Bumble and bumble Bumble and bumble View Brand Page Clinique Clinique View Brand Page DECIEM DECIEM View Brand Page Dr.Jart+ Dr.Jart+ View Brand Page Editions de Parfums Frédéric Malle Editions de Parfums Frédéric Malle View Brand Page Estée Lauder Estée Lauder View Brand Page Jo Malone London Jo Malone London View Brand Page KILIAN PARIS KILIAN PARIS View Brand Page La Mer La Mer View Brand Page Lab Series Lab Series View Brand Page Le Labo Le Labo View Brand Page M·A·C M·A·C View Brand Page NIOD NIOD View Brand Page Origins Origins View Brand Page The Ordinary The Ordinary View Brand Page TOM FORD TOM FORD View Brand Page Too Faced Too Faced View Brand Page AERIN Beauty Logo Aramis Logo Aveda Logo Balmain Beauty Logo Bobbi Brown Cosmetics Logo...
mov_E5F3D04D4B8C487F60C0066B925766D1,2025-06-15 21:48:52,en,WEB,  Our Brands View all Click Here AERIN Beauty AERIN Beauty View Brand Page Aramis Aramis View Brand Page Aveda Aveda View Brand Page Bobbi Brown Cosmetics Bobbi Brown Cosmetics View Brand Page Clinique Clinique View Brand Page Dr.Jart+ Dr.Jart+ View Brand Page Editions de Parfums Frédéric Malle Editions de Parfums Frédéric Malle View Brand Page Estée Lauder Estée Lauder View Brand Page Jo Malone London Jo Malone London View Brand Page KILIAN PARIS KILIAN PARIS View Brand Page La Mer La Mer View Brand Page Lab Series Lab Series View Brand Page Le Labo Le Labo View Brand Page M·A·C M·A·C View Brand Page The Ordinary The Ordinary View Brand Page TOM FORD TOM FORD View Brand Page AERIN Beauty Logo Aramis Logo Aveda Logo Bobbi Brown Cosmetics Logo Clinique Logo Dr.Jart+ Logo Editions de Parfums Frédéric Malle Logo Estée Lauder Logo Jo Malone London Logo KILIAN PARIS Logo La Mer Logo Lab Series Logo Le Labo Logo M·A·C Logo The Ordinary Logo TOM FORD Logo Latest News View all News Click Here...
1934617715584782565,2025-06-16 14:23:01,tr,TWITTER,"  @berlin583 @magachain Hayır, Slazenger ActiveSport'un ""tarihin en iyi erkek parfümü"" olduğu iddiası doğru değil. Bazı kullanıcılar, özellikle Türkiye'de, uygun fiyatı ve ferah kokusu için övse de, uzman sıralamalarında yer almıyor. GQ ve InStyle gibi kaynaklar Creed veya Le Labo gibi markaları öne…"
1934810213477138646,2025-06-17 03:07:56,es,TWITTER,"  @0kktsu0 @EnMexicoMagico No puedo acceder a la lista completa de perfumes del hilo en X, pero basándome en recomendaciones de expertos para 2025, aquí hay una selección de colonias populares para hombres: 1. Le Labo Thé Matcha 26 – Versátil, notas frescas y sexys 2. Dior Sauvage Elixir – Cítrico,…"
1934931013215666337,2025-06-17 11:07:57,es,TWITTER,"  @yiyibotero06 @junior_23697 @EnMexicoMagico Aquí tienes un top 10 de fragancias unisex versátiles para 2025, basadas en reseñas de expertos: 1. Ombre Leather (Tom Ford) - Cuero, jazmín, ámbar; ideal para otoño/invierno. 2. Santal 33 (Le Labo) - Sándalo, cedro, cardamomo; perfecto para 10-21°C. 3. By The Fireplace (Maison…"
urn:li:ugcPost:7340752818804301825,2025-06-17 14:50:57,en,LINKEDIN,"  And it comes to an end! After an incredible journey, I'm proud to share that I've officially graduated from HEC Paris, Master in Marketing! This past year has been a whirlwind of creativity, strategy, and growth — and I've had the chance to work on unforgettable real-world projects with iconic brands: Parfums Christian Dior – Designed a Gen Z fragrance collection and promotional plan. L'Oréal x La Roche-Posay USA Bootcamp – Built a product concept and 360° campaign for next-gen UV protection. Veepee – Developed e-commerce strategies to engage younger audiences. McKinsey & Company – Crafted consulting strategies for platform growth. DDB x Amazon – Led a social media strategy to spotlight Amazon's sustainability efforts. Kering x DoDo Jewels – Selected as finalists to present a 360° market expansion strategy for DoDo Jewels. Cartier – Created storytelling and launch strategy for Cartier Home new collection. Our team won 1st place🥇 and was invited to a private Cartier piano concert. Another highlight: our London learning expedition, where we visited Burberry, Cartier, and Warner Bros. Discovery HQs, and connected with the HEC UK Alumni House. I was deeply inspired by the powerful voices of women leaders in marketing and luxury. To my incredible marketing crew — thanks for all the brainstorms, good vibes, and late-night laughs. And to our amazing program directors Gachoucha Kretz, PhD and Marion BOUYOU — thank you for crafting a journey that was both challenging and deeply rewarding. When I enrolled in this program, I never expected to grow this much — but it truly prepared me to become a better marketing leader, with stronger creativity, strategic thinking, and empathy. I'm thrilled to share my next chapter: I'll be joining The Estée Lauder Companies Inc. Presidential Management Scholar Program in China, working in the Marketing department of Le Labo Fragrances — a brand I deeply admire for its soul, storytelling, and slow beauty philosophy. On to the next adventure #HECParis #Marketing #Graduation #Luxury #Beauty #BrandStrategy #Storytelling #MarketingLeadership #WomenInMarketing"
61261101338_1173787044788433_C0EF77C053040A611D4C66728D923872ZZ,2025-06-18 01:54:47,fr,FACEBOOK,"  La Mort ? Pas pour tout le monde, voyons ! Ah, la mort… cette grande égalisatrice ! Ou du moins, c'est ce qu'on nous racontait avant que la science ne vienne mettre son grain de sel. Aujourd'hui, il est clair que face à la grande faucheuse, nous ne sommes pas tous logés à la même enseigne. Et c'est tant mieux pour certains ! Thérapies de pointe : le luxe de l'immortalité Fini le temps des simples pilules et des remèdes de grand-mère ! Désormais, les thérapies géniques sont là pour vous reprogrammer de A à Z. Votre ADN est un peu fatigué ? Un petit coup de polish génétique, et hop, vous voilà comme neuf ! Bien sûr, cette customisation moléculaire a un coût… astronomique. La médecine de précision, elle, vous assure un traitement sur mesure, calibré au millimètre près selon votre patrimoine génétique. Fini les tâtonnements, place à l'efficacité… pour ceux qui peuvent se l'offrir, bien entendu. Et les organes ? Cultivons-les ! Pourquoi attendre une greffe quand on peut avoir un foie flambant neuf, cultivé sur mesure dans un labo ultra-secret ? Quant aux interventions anti-âge, elles promettent de vous faire sauter des décennies d'un coup. Imaginez : prolonger votre jeunesse, conserver votre vitalité… pendant que les autres comptent leurs rides et leurs cheveux blancs. C'est le prix à payer pour ne pas vieillir, littéralement. La surveillance high-tech : votre corps, un compte en banque Oubliez les visites chez le médecin tous les six mois. Avec les capteurs de dernière génération et les analyses à domicile, votre corps devient une mine de données consultables en temps réel. La moindre petite anomalie est détectée avant même que vous n'ayez eu le temps de bâiller. Cela permet de prendre des mesures préventives immédiates ! Pendant que certains découvrent leur maladie au stade terminal, d'autres la déjouent avant même qu'elle ne pointe le bout de son nez. C'est ça, la proactivité de luxe ! Recherche privée : quand le profit prolonge la vie Qui finance ces merveilles ? Les grandes entreprises et les philanthropes éclairés, bien sûr ! Et comme ils ne font pas ça par charité – ou du moins pas seulement –, il est évident que le retour sur investissement passe avant tout. Les premiers servis ? Ceux qui ont le portefeuille le plus garni. Certains milliardaires se sont même déjà offert des thérapies expérimentales pour la longévité, histoire de prendre de l'avance sur l'humanité. C'est le principe du ""premier arrivé, premier servi"", mais avec la vie éternelle en jeu. Le ""mode de vie optimisé"" : parce que la santé, ça se mange (cher) ! Pourquoi se contenter de courir un jogging quand on peut avoir un coach sportif dédié, un chef personnel préparant des repas bio sur mesure, et un nutritionniste qui vous dit quel est le petit doigt de pied que vous devez bouger pour prolonger votre existence ? Les nantis peuvent s'offrir un environnement sans pollution, éviter les emplois stressants, et vivre dans une bulle de bien-être qui maximise leurs chances de longévité. Pendant que les autres subissent la pollution et le stress du métro-boulot-dodo, certains cultivent leur longévité comme un précieux jardin. Le capital humain et social : la richesse, ça se capitalise ! Et le clou du spectacle : en vivant plus longtemps et en meilleure santé, les riches peuvent continuer à accumuler plus de richesse et de pouvoir. C'est un cercle vertueux (pour eux, s'entend) : plus vous êtes riche, plus vous vivez longtemps et en bonne santé, plus vous devenez riche. C'est ce qu'on appelle l'optimisation du capital humain, où l'espérance de vie devient un actif financier. Alors, la mort est-elle vraiment aveugle ? Apparemment, elle a plutôt tendance à se pencher du côté de ceux qui peuvent se permettre d'ignorer ses avances. Une chose est sûre : pour prolonger l'existence, il va falloir allonger les billets. Et si l'accès à la vie éternelle dépend de votre compte en banque, eh bien, nous ne sommes décidément pas tous égaux devant la fin ! N'est-ce pas une merveilleuse perspective pour l'avenir ?"
5550296508_1097001682292482_1B3834C638EFFEDA0E7E129C956CDEB7ZZ,2025-06-18 01:56:49,fr,FACEBOOK,"  ET CA RECOMMENCE ! il y a 20 ans , les judéo-americains attaquaient l'irak sous pretexte qu ils avaient l arme atomique ( et ce jour là , ils avaient creer le terme ""arme de destruction massive""  ils aiment inventer des mots pour manipuler et ruser ( islamophobie , islamiste , integriste ,tolerance zéro , islamo gauchiste , complotiste etc etc)   mais sadam n'en avait pas , a ce moment la , l iran regardait comme l l egypte, la syrie , et l arabie regardent maintenant sans réagir. ( l'union fait la force et la désunion fait la faiblesse) Maintenant aussi israel a agressé l iran pour camoufler le genocide des gazaoui actuellement en cours le 18 juin 2025 ( encore 50 civils morts auj. devant distribution de farine mais cette fois c est a la mitrailleuse) , et ils pretendent que l'iran a l'arme atomique alors que  les barbouzes americains disent qu ils en sont très loin . Pour ces nazis (les chefs nazis etaient juifs) la vie humaine d'un musulman n''a pas de valeur.et le 11 septembre a new york c etait israel , Julian Assange l a prouver au péril de sa vie , mais les médias cache ce fait et aussi que le labo de wuhan etait dirigé par ""Yves lévy"" . Ce sont des menteurs et des assassins  donc tout ceux qui soutiennent ces criminels devront en répondre devant Dieu Israel et la Russie doivent respecter l'integrité territoriale de leurs voisins , mais les pays disposant de l arme nucléaire sont intouchables parait il , et israel vien de bombarder le yemen, la syrie, le liban et l'iran , nethanyahu a le feu au cul , lui et ses complices n iront pas en prison comme Olmert n y a pas été il y a 20 ans malgré les condamnations internationales , interpol est  donc evidement corrompu ,  l ONU est corrompu comme l OMS , les rotshilds et les 12 tribus  controlent la planète depuis 1945 et on placer des pantins un peu partout pour diriger les pays arabes asservis après avoir briser le dernier califat  , et a cemoment la le vol de la plestine a eu lieu , le plus drole c est que l 'iran a voter OUI pour la creation de l état hébreux en 1947 lol et ils (les révisionnistes) nous ont menti a l'école sur la deuxieme guerre mondiale  , sur les 12 hommes qui ont marchés sur la lune et avec un buggy en prime lol alors que les sondes modernes s y crashent toutes , on nous a dit qu en 2025 il n y aurais plus de petrole lol ca a provoquer un crash boursier  , que la couche d ozone allait nous tuer etc etc etc , pour provoquer des panique et des crises a des fins lucratives et stratégiques ( la peur se vend bien ; alors mets ton masque ou tu vas mourir !!! lol)  , on a tous été formater a l ecole  avec des mensonges mais moi j ai fait un ""reset"" ."
5550296508_1097447235581260_3E56A1B18E5582E57ED2BE3854B01D57ZZ,2025-06-18 01:57:04,fr,FACEBOOK,"  C.m. Johnigan ET CA RECOMMENCE ! il y a 20 ans , les judéo-americains attaquaient l'irak sous pretexte qu ils avaient l arme atomique ( et ce jour là , ils avaient creer le terme ""arme de destruction massive""  ils aiment inventer des mots pour manipuler et ruser ( islamophobie , islamiste , integriste ,tolerance zéro , islamo gauchiste , complotiste etc etc)   mais sadam n'en avait pas , a ce moment la , l iran regardait comme l l egypte, la syrie , et l arabie regardent maintenant sans réagir. ( l'union fait la force et la désunion fait la faiblesse) Maintenant aussi israel a agressé l iran pour camoufler le genocide des gazaoui actuellement en cours le 18 juin 2025 ( encore 50 civils morts auj. devant distribution de farine mais cette fois c est a la mitrailleuse) , et ils pretendent que l'iran a l'arme atomique alors que  les barbouzes americains disent qu ils en sont très loin . Pour ces nazis (les chefs nazis etaient juifs) la vie humaine d'un musulman n''a pas de valeur.et le 11 septembre a new york c etait israel , Julian Assange l a prouver au péril de sa vie , mais les médias cache ce fait et aussi que le labo de wuhan etait dirigé par ""Yves lévy"" . Ce sont des menteurs et des assassins  donc tout ceux qui soutiennent ces criminels devront en répondre devant Dieu Israel et la Russie doivent respecter l'integrité territoriale de leurs voisins , mais les pays disposant de l arme nucléaire sont intouchables parait il , et israel vien de bombarder le yemen, la syrie, le liban et l'iran , nethanyahu a le feu au cul , lui et ses complices n iront pas en prison comme Olmert n y a pas été il y a 20 ans malgré les condamnations internationales , interpol est  donc evidement corrompu ,  l ONU est corrompu comme l OMS , les rotshilds et les 12 tribus  controlent la planète depuis 1945 et on placer des pantins un peu partout pour diriger les pays arabes asservis après avoir briser le dernier califat  , et a cemoment la le vol de la plestine a eu lieu , le plus drole c est que l 'iran a voter OUI pour la creation de l état hébreux en 1947 lol et ils (les révisionnistes) nous ont menti a l'école sur la deuxieme guerre mondiale  , sur les 12 hommes qui ont marchés sur la lune et avec un buggy en prime lol alors que les sondes modernes s y crashent toutes , on nous a dit qu en 2025 il n y aurais plus de petrole lol ca a provoquer un crash boursier  , que la couche d ozone allait nous tuer etc etc etc , pour provoquer des panique et des crises a des fins lucratives et stratégiques ( la peur se vend bien ; alors mets ton masque ou tu vas mourir !!! lol)  , on a tous été formater a l ecole  avec des mensonges mais moi j ai fait un ""reset"" ."
mov_CA670F67421CE91E21AC6287AAD09666,2025-06-18 08:23:36,sv,WEB,"  SPR_COMBO[sv]Lee Cotter, vd och kreativ chef på 15-årsjubilerande Stutterheim, listar sina personliga favoriter. Joel Ågren  |  Publicerad för 19 sekunder sen  |  Lästid: 3 minuter Stil Kostym: Har som ambition att rita en egen detta år och låta Götrich sy upp den.  Skor: English derbys. Byxor: Stutterheim Bash Trouser. Tröja: Stickad 12 gg  distressed lambswool från  Commes des Garçons. Sneakers: Rick Owens x Converse.  Ytterplagg: Alltid någon typ av Melton-rock. Stilförebild: Shia LaBeouf. Träningskläder: Använder fortfarande mina träningskläder från Contra som jag ritade för Stadium år 2020.  Still going strong. Shopping Butik: Dover Street Market i New York eller Ginza och vintage-butiken Rellik i Nothing Hill och Paul Bocuse stammis-butik E. Dehillerin i Paris.  Senaste köp: japanska ullstrumpor med tår.  Mat och dryck Kök: Det franska och italienska köket hamnar på delad förstaplats. Vin: Hade vinkällare på Grappes i många år och försökte bli duktig på vin, nu dricker jag mest bara Prosecco. Öl: Peroni. Sprit: Amaro Averna.   Drink: Daiquiri. Restaurang: Lilla Ego i Stockholm.  Foto: Andreas Johansson. Bar: Le Bain på The Standard Hotel i New York.  Signaturrätt: Svamprisotto med benmärg och tryffel. Guilty pleasure: Cola Zero.  Jag har helt klart ett beroende. Resor Hemstad: Stockholm. Resmål: Franska eller  italienska rivieran.  Stad: Paris. Hotell: Costes i Paris.  Transportmedel: Uber eller cykel.  Teknik  App: Justwatch. Hörlurar: Apple. Laptop: Macbook Pro. Kamera: Leica M-A Silver. Tv: Samsung Frame.  Köp inte.  Ljudsystem: Audio Pro. Hem Möbel: Fåtöljen Togo Fireside Chair av Michel Ducaroy för Ligne Roset. Inredningsdetalj: Fotokonst av min vän Andreas Lundberg där han tolkar V Ave Shoe Repair. Lampa: Lampan Pia av Tore Ahlsén från 1940. Köpte en variant utan tyg på Södermalm i Stockholm för många år sedan. Kökspryl: Mitt knivset om 18 knivar från Sabatier som jag inhandlat begagnat på -medlemssidan ”Bittra kockar”..."
222008437823118_1260950988724778_B722006ED09B13B26C31CCD8D94490C2ZZ,2025-06-18 11:39:25,fr,FACEBOOK,"  Tinou Desch alors sur ma période de présence lors de mes années ""l'enfantement"" j'ai atteint mes objectifs professionnels. Et ma collègue l'année de son congé maternité a œuvré toute l'année pour que le labo atteind les objectifs globaux. Tout le monde a eu une prime sauf elle. Elle a ete un peu dégoûtée Les jours enfants malades ne sont pas présents dans tous les contrats sauf erreur de ma part il n'y a pas d'articles dans le code du travail s'y référant. Si dans votre société on ne fait pas de distinguo entre hommes et femmes tant mieux c'est que les choses progressent dans le bon sens mais ce n'est malheureusement pas le cas partout. Mon conjoint a demandé ses jours enfants malades on a commencé par lui dire que ce n'était pas possible vu qu'il était posté. Il a fait valoir ces droits mais ça lui a coûté en terme relationnel avec sa hiérarchie. (Nb je pense que beaucoup d'hommes sont également Victime de la société patriarcale)Ce n'est pas parce que vous n'y êtes pas confronté que ces problématiques ne sont pas de vrai  De plus j'ai 46 ans ce que vous décrivez comme situation n'existait pas ou était vraiment très rare quand j'ai commencé à bosser. L'écart je vais me le trainer toute ma vie et l'a avec l'article je m'aperçois que ça va s'accentuer à la retraite pourtant je bosse à temps plein depuis l'âge de 20ans. J'ai soutenu mon foyer élevé mes enfants en parallèle. Ah une dernière chose J'aimerais bien que vous évitez de me traiter de menteuse et j'ai également horreur de la mauvaise fois. Si on pouvait arrêter de se monter les un contre les autres et prendre le temps de s'écouter vraiment homme et femme avec chacun nos difficultés notre vision on pourrait peut être faire bouger les choses mais quand je lis les commentaires (homme comme femme) et bien je me dis que c'est loin d'être gagné. Une dernière chose je serai curieuse de savoir ce que vous mettez derrière les ""vrais problématiques féminines"" car là on parle entre autres de la retraite donc des revenus qu'on aura pour vieillir."
1935372586793197861,2025-06-18 16:22:36,fr,TWITTER,"  🛠️ Comment Survivre à l'Ère des Robots ? ✅ LES RÈGLES D'OR : 🧪 Testez TOUT (comme un labo de chimie !) 👀 Surveillez (les robots ont besoin de baby-sitters) 📊 Données fiables (pas de fake news pour les algos !) 🛑 Stop-loss intelligent (le bouton panique, version classe)… https://t.co/QeJ4VSg1ya"
