fid,timestamp,text_language,SocialMediaChannel,transcript
1936429729047044228,2025-06-21 14:23:19,fr,TWITTER,"  🎧 NOUVEAU PODCAST— Le Starter Pack des entretiens 🎧 Sur Le Labo des CIP ➔ https://t.co/Tb8J3tGnjA 🎧 Via La Collab' avec Pascal Kufel ➔ sur toutes vos plateformes préférées avec ce lien (Amazon, Deezer, ITunes…) :  https://t.co/ypYNYjRXgU https://t.co/YSI1OdKjTX"
1936442604775731686,2025-06-21 15:14:28,fr,TWITTER,"  @TheMrLambda @le_Parisien 🧠 21 juin = été. Chaleur = normale. Canicule ? Peut-être. Mais on va pas jouer à se faire peur avec des courbes sorties du même labo que ceux qui comptaient les cas ""positifs asymptomatiques"" en 2020. ⚠️ Les données ? Météo France. Oui, les mêmes qui depuis le Covid sont…"
885498d069015eb32c43ea01890058cf,2025-06-21 21:02:00,fr,WEB,"  SPR_COMBO[fr]Présentation : Un Havre Joueur dans le Univers du Vente en Ligne Dans une industrie régit par les entreprises majeures déshumanisés, L'Espace Jouet émerge comme une refuge de poésie concrète. Créé en 2012 à Lyon, ce bijou du e-commerce français a su convertir l'acte d'choisir un jouet en un cérémonial magique. Éloigné des processus automatisés, il représente un déclaration pour une consommation responsable, heureuse et vraiment personnelle. Grâce à plus de 5 000 produits soigneusement choisies – des jouets Corolle aux circuits Scalextric en passant par les jouets en bois jurassiens – cette entreprise a gagné 15 000 familles chaque mois. Son clé ? Une alchimie rare entre expertise artisanale, innovation numérique et éco-conscience. Plongeons dans l'univers de cette marque qui transforme l'art de faire rêver les enfants. L'Agencement d'un Havre Éveillant les Sens L'expérience utilisateur sur L'Espace Jouet relève de la balade dans une librairie de quartier. Dès la page d'accueil, une palette chromatique douce – tons pastel inspirant le calme, couleurs vibrantes stimulant la créativité – plonge le visiteur dans un écosystème conçu pour l'magie. L'organisation naturelle des menus permet de filtrer les jouets par stade de développement, compétence développée (communication, motricité fine, raisonnement logique) ou engagements (Fabriqué en France, durable, pédagogie Montessori). La outil innovant ""Le guide personnalisé de jouets"" se révèle être un ressource intelligente : un questionnaire ludique guide le parent sur le caractère de l'enfant, ses goûts émergents et le budget, pour suggérer des choix personnalisés. Chaque page détaillée, quant à elle, est une véritable encyclopédie du jouet. Grâce à une visionneuse 360°, on découvre en détail le jouet comme en magasin réel. Des fiches techniques exhaustives listent matières premières, normes de sécurité et dimensions, tandis que des astuces pratiques conçus par des pédagogues transforment l'objet en outil d'épanouissement. Le module ""Avec ce produit, l'enfant acquiert…"" détaille avec pédagogie les capacités stimulées : un puzzle Vilac en bois massif affine ainsi la précision visuo-motrice, quand un kit de jardinage Bioviva fait découvrir la biodiversité. L'Odyssée des Artisans et des Marques Icônes L'Espace Jouet cultive des alliances privilégiées qui en font un écrin préservé du jeu haut de gamme. Dans sa section ""Savoir-Faire Local"", douze artisans locaux dévoilent des produits exclusifs sur d'autres plateformes. Les Jouets Libres, originaires des Hauts-de-France, y mettent en avant des créations bois estampillés Entreprise du Patrimoine Vivant, comme leur fameux ""Mémory des Oiseaux"" aux illustrations naturalistes. Moulin Roty, implanté en Pays de la Loire, y met en scène ses peluches au style vintage, fabriquées manuellement dans des structures spécialisées. Mais la enseigne brille particulièrement dans la réinterprétation des grandes marques internationales avec une patte locale : Sylvanian Families y dévoile des éditions limitées ""Village Lyonnais"" où les petites statues portent des tenues folkloriques, Lego y imagine des coffrets ""Patrimoine National"" (Tour Eiffel, le monument historique), et Corolle y équipe ses poupées Bébé Calin de vêtements en tissu wax provençal. Cette démarche curatoriale atteint son apogée avec la Gamme ""Éthique & Sensible"", développée conjointement avec des orthophonistes et experts du développement. On y trouve des jouets comme ""Léo et ses Sentiments"", un doudou doté de attaches pour changer d'expression faciale selon l'humeur de l'enfant, ou ""Le Théâtre des Ombres Silencieux"", conçu pour petits en situation de handicap verbal. Le Système de l'Merveille : Solutions et Innovations Derrière la magie apparente se cache une ingénierie logistique d'une rigueur suisse. Le processus de livraison, entièrement repensé pour minimiser l'impact environnemental, ressemble à un engrenage parfait. Dès la commande passée, les employés du siège conditionnent le colis dans un emballage 100% recyclable, calé avec des coussinets biodégradables. Les sociétés de logistique (tous labellisés ""Flotte Verte"") transportent ensuite les colis via un jeux éducatifs pour école primairealgorithme de livraison intelligent, équilibrant les gaz à effet de serre par des programmes écologiques en Drôme Provençale. Au final : la quasi-totalité des achats sont distribuées en deux jours maximum, avec un suivi en temps réel par messages texte. Mais la plateforme innove encore en inventant des solutions uniques. ""Le Colis Surprise"", abonnement mensuel pensé avec des professionnels de la petite enfance, fait découvrir chaque mois une sélection pédagogique adaptés au âge cognitif de l'enfant. Le formule location permet quant à lui d'emprunter pour une saison des articles imposants (circuits de train, panneaux sensoriels) à prix modique. La cerise sur le gâteau ? L'option ""Présent Mystère"" qui envoie le jouet dans un emballage neutre, protégeant la magie de l'instant. L'École du Parentalité Ludique : Éducation et Communauté L'espace ressource ""Paroles de Jeu"" représente l'épine dorsale pédagogique de la plateforme. Loin des simples recommandations produits, il analyse minutieusement les aspects développementaux et émotionnels du jeu. Dans la rubrique ""Comprendre les gribouillis"", des spécialistes du développement analysent comment un bonhomme têtard témoigne de l'confiance en soi. ""Ludisme égalitaire"" démonte les préjugés genrés avec des tutoriels pour personnaliser une dînette traditionnelle en tonalité moderne ou choisir un établi à sa fille. Chaque mois, un webinaire en direct fait intervenir des professionnels : une session remarquable avec une éducatrice Montessori a montré comment une objet du quotidien pouvait enseigner la attention et la classification. Mais la réelle innovation réside dans Labo des Petits Génies. Ce challenge créatif incite les enfants à imaginer leur invention ludique. Les projets sélectionnés – comme le ""Automate Végétal"" 2023 qui cultivait en rythme en bougeant – sont ensuite prototypés par des artisans locaux et commercialisés en collection numérotée. Une processus collaboratif unique qui a déjà donné naissance à 22 inventions, distribuées à plus de 3 000 exemplaires. Cette initiative dépasse le simple vente en ligne pour s'affirmer comme un véritable accélérateur d'idées ludique. L'Éthique en Action : Du Jouet Durable à l'Économie Circulaire La charte ""Jouer Durable"" de la plateforme définit des critères dépassant largement les réglementations en vigueur...."
8363c77dffdc5fe239af45aef2141e53,2025-06-21 22:13:00,fr,WEB,"  SPR_COMBO[fr]Introduction : Un Refuge Divertissant dans le Paysage du Commerce en Ligne Dans un marché régit par les géants froids, L'Espace Jouet s'impose comme une oasis de enchantement réel. Créé en 2012 à Lyon, ce bijou du commerce en ligne français a su transformer l'acte d'acheter un jouet en un rituel envoûtant. Éloigné des systèmes impersonnels, il représente un manifeste pour une achat conscient, joyeuse et vraiment personnelle. Grâce à plus de 5 000 produits minutieusement sélectionnées – des poupées Corolle aux circuits Scalextric en passant par les jouets artisanaux du Jura – cette boutique en ligne a conquis 15 000 familles par mois. Son clé ? Une fusion unique entre savoir-faire artisanal, digitalisation et responsabilité environnementale. Pénêtrons dans l'univers de cette entreprise qui transforme l'art de éveiller l'imagination des jeunes. La Structure d'un Monde Éveillant les Sens La navigation sur L'Espace Jouet relève de la balade dans une librairie de quartier. Dès la page d'accueil, une palette chromatique douce – tons pastel inspirant le calme, jaunes solaires éveillant l'imagination – fait basculer le visiteur dans un environnement dédié à l'magie. L'organisation naturelle des menus permet de trier les jouets par stade de développement, compétence développée (langage, motricité fine, raisonnement logique) ou engagements (Fabriqué en France, éco-responsable, méthode éducative). La outil innovant ""Le guide personnalisé de jouets"" se révèle être un ressource intelligente : un questionnaire ludique interroge le parent sur le personnalité de l'enfant, ses passions naissantes et le budget, pour proposer des correspondances sur-mesure. Chaque page détaillée, quant à elle, est une véritable encyclopédie du jouet. Grâce à une vue interactive, on manipule virtuellement le jouet comme en commerce traditionnel. Des fiches techniques précises indiquent compositions, normes de sécurité et mesures, tandis que des conseils d'usage rédigés par des éducateurs font du jouet un outil d'épanouissement. Le dispositif ""Avec ce produit, l'enfant acquiert…"" présente méthodiquement les compétences sollicitées : un casse-tête en bois artisanal développe la synchronisation main-œil, quand un kit de jardinage Bioviva fait découvrir la protection de l'environnement. Le Panthéon des Créateurs et des Marques Icônes Cette boutique en ligne développe des partenariats exclusifs qui en font un écrin préservé du jouet d'exception. Dans sa section ""Ateliers de France"", douze artisans hexagonaux présentent des produits exclusifs ailleurs. Cette marque engagée, basés dans le Nord, y commercialisent des jeux en bois estampillés Entreprise du Patrimoine Vivant, comme leur célèbre ""Mémory des Oiseaux"" aux gravures réalistes. Moulin Roty, basé à Nantes, y met en scène ses doudous au style vintage, cousues main dans des ateliers adaptés. Mais la enseigne brille particulièrement dans la adaptation des labels planétaires avec une patte locale : les célèbres figurines y propose des éditions limitées ""Lyon Miniature"" où les figurines revêtent des costumes traditionnels, la marque aux briques y imagine des kits ""Monuments Français"" (la Dame de Fer, Château de Chambord), et Corolle y habille ses jouets emblématiques de tenues en coton imprimé. Cette approche sélective culmine avec la Gamme ""Éthique & Sensible"", développée conjointement avec des thérapeutes de la communication et experts du développement. On y peut explorer des jeux comme ""Le Monde Affectif de Léo"", un compagnon en tissu muni de attaches pour exprimer différentes émotions selon les sentiments du petit, ou ""L'Univers des Ombres"", conçu pour petits en situation de handicap verbal. Le Système de l'Émerveillement : Services et Révolutions Au-delà de la magie apparente se trouve une chaîne de production d'une précision horlogère. Le processus de livraison, totalement optimisé pour limiter l'pollution, s'apparente à un mécanisme bien huilé. Après validation du panier, les équipes lyonnaises conditionnent le colis dans un matériau durable, protégé avec des coussinets biodégradables. Les livreurs sélectionnés (tous engagés dans la transition écologique) distribuent ensuite les commandes via un algorithme de livraison intelligent, neutralisant les rejets carbonés par des initiatives vertes en Sud-Est de la France. Bilan : 98% des commandes sont acheminées en moins de 48h, avec un monitoring live par notifications. Mais l'enseigne innove encore en inventant des offres innovantes. ""Le Colis Surprise"", formule annuelle co-conçu avec des professionnels de la petite enfance, envoie chaque mois trois jouets éducatifs correspondant au âge cognitif de l'enfant. Le service de location permet quant à lui d'utiliser temporairement pour 90 jours des jeux volumineux (maisons de poupée, panneaux sensoriels) à coût réduit. Le petit plus ? L'option ""Cadeau Surprise"" qui envoie le jouet dans un conditionnement sobre, gardant intacte la magie de l'instant. L'Académie du Parentalité Ludique : Pédagogie et Tribu L'espace ressource ""Le Langage du Jouet"" constitue la colonne vertébrale pédagogique de la boutique. Allant plus loin que de simples guides d'achat, il décortique avec précision les facettes intellectuelles et sensibles du jeu. Dans la section ""Analyser les créations enfantines"", des psychologues étudient comment un personnage schématique révèle l'estime de soi. ""Jeux non genrés"" démonte les stéréotypes de genre avec des guides pratiques pour customiser une dînette traditionnelle en couleur neutre ou choisir un jouet technique à sa enfant. Chaque mois, un webinaire en direct rassemble des spécialistes : une rencontre inoubliable avec une spécialiste des méthodes actives a démontré comment une modeste contenant de couture pouvait transmettre la persévérance et la classification. Mais la vraie révolution réside dans Labo des Petits Génies. Ce challenge créatif invite les enfants à imaginer leur jouet rêvé. Les concepts primés – comme le ""Automate Végétal"" 2023 qui plantait des graines en bougeant – sont ensuite matérialisés par des fabricants régionaux et vendus en collection numérotée. Une processus collaboratif inédite qui a déjà donné naissance à une vingtaine de créations, vendues à plus de 3 000 exemplaires. Ce projet va bien au-delà de le simple e-commerce pour constituer un véritable incubateur de créativité ludique. Des Valeurs Concrètes : Du Jouet Durable à la Consommation Responsable Le référentiel ""Jouer Responsable"" de l'enseigne établit des standards allant bien au-delà de les réglementations en vigueur. Chaque article passe par un processus de vérification en trois étapes : certification CE obligatoire, tests supplémentaires en organisme tiers (détection de substances nocives, résistance aux chocs), et inspection des usines fournisseuses...."
e1b762c66817541bea387e4333110536,2025-06-21 22:34:00,fr,WEB,"  SPR_COMBO[fr]Avant-propos : Un Havre Divertissant dans le Paysage du Vente en Ligne Dans un marché contrôlé par les grands acteurs déshumanisés, L'Espace Jouet s'impose comme une oasis de poésie concrète. Établi en 2012 à Lyon, ce trésor du commerce en ligne français a su transformer l'acte d'acheter un jouet en un rituel envoûtant. Éloigné des algorithmes glacés, il incarne un déclaration pour une achat conscient, optimiste et vraiment personnelle. Grâce à plus de 5 000 références minutieusement curatées – des poupées Corolle aux circuits de voitures en passant par les jouets artisanaux du Jura – cette entreprise a gagné 15 000 familles chaque mois. Son atout ? Une alchimie exceptionnelle entre expertise artisanale, innovation numérique et engagement écologique. Pénêtrons dans l'univers de cette entreprise qui redéfinit l'art de émerveiller les petits. L'Agencement d'un Paradis Éveillant les Sens La navigation sur L'Espace Jouet équivaut à la flânerie dans une petite librairie indépendante. Dès la page d'accueil, une nuancier apaisante – bleus nuancés créant une atmosphère zen, tons chauds éveillant l'imagination – fait basculer le visiteur dans un environnement conçu pour l'magie. La structure intuitive des menus permet de trier les jouets par stade de développement, habileté ciblée (langage, précision gestuelle, pensée analytique) ou valeurs (Made in France, durable, méthode éducative). La outil innovant ""Découvrez le cadeau idéal en quelques questions"" se révèle être un outil précieux : un quiz interactif interroge le parent sur le personnalité de l'enfant, ses passions naissantes et le prix envisagé, pour recommander des choix personnalisés. Chaque description de produit, quant à elle, est une véritable présentation approfondie. Grâce à une rotation 3D, on explore numériquement le jouet comme en boutique physique. Des caractéristiques détaillées précises précisent matériaux, certifications et dimensions, tandis que des conseils d'usage écrits par des experts élèvent le produit au rang d' outil d'épanouissement. Le système ""Avec ce produit, l'enfant acquiert…"" présente méthodiquement les capacités stimulées : un jeu d'encastrement haut de gamme développe la précision visuo-motrice, quand un ensemble découverte botanique initie à la nature. Le Temple des Maîtres Jouetiers et des Grands Noms Cette boutique en ligne cultive des alliances privilégiées qui en font un conservatoire vivant du jouet de qualité. Dans sa section ""Savoir-Faire Local"", plusieurs artisans régionaux présentent des créations introuvables ailleurs. Cette marque engagée, implantés à Lille, y commercialisent des créations bois estampillés Entreprise du Patrimoine Vivant, comme leur célèbre ""Memory Ornithologique"" aux illustrations naturalistes. Cette maison légendaire, basé à Nantes, y expose ses compagnons en tissu au design nostalgique, assemblées artisanalement dans des ateliers adaptés. Mais la boutique se distingue également par réinterprétation des grandes marques internationales avec une patte locale : la marque japonaise y dévoile des séries collector ""Lyon Miniature"" où les figurines arborent des tenues folkloriques, la marque aux briques y conçoit des kits ""Monuments Français"" (le symbole parisien, Château de Chambord), et Corolle y équipe ses jouets emblématiques de tenues en textile régional. Cette politique de sélection culmine avec la Série ""Responsable et Émotionnel"", développée conjointement avec des spécialistes du langage et psychomotriciens. On y peut explorer des jouets comme ""Le Monde Affectif de Léo"", un doudou muni de velcros pour exprimer différentes émotions selon les sentiments du petit, ou ""Le Monde sans Paroles"", conçu pour enfants non verbaux. Le Système de l'Émerveillement : Services et Innovations Au-delà de la féerie de surface se opère une organisation opérationnelle d'une précision horlogère. Le circuit de livraison, totalement optimisé pour minimiser l'empreinte carbone, ressemble à un mécanisme bien huilé. Dès l'achat finalisé, les préparateurs locaux conditionnent le colis dans un emballage 100% recyclable, maintenu avec des coussinets biodégradables. Les transporteurs partenaires (tous labellisés ""Flotte Verte"") acheminent ensuite les paquets via un algorithme de livraison intelligent, compensant les gaz à effet de serre par des projets de reforestation en Drôme Provençale. Bilan : 98% des commandes sont acheminées en un délai record, avec un suivi en temps réel par messages texte. Mais la plateforme innove encore en développant des services inédits. ""Le Colis Surprise"", abonnement mensuel co-conçu avec des spécialistes de l'enfance, expédie chaque mois des jeux adaptés ajustés pour le niveau d'éveil de l'enfant. Le formule location permet quant à lui d'utiliser temporairement pour une saison des jeux volumineux (maisons de poupée, tables d'activités) à coût réduit. L'innovation ultime ? L'service ""Cadeau Surprise"" qui livre le jouet dans un conditionnement sobre, gardant intacte la surprise. L'Académie du Jeu Éclairé : Pédagogie et Tribu La plateforme éditoriale ""Les Mots du Jeu"" constitue la colonne vertébrale pédagogique de la boutique. Loin des simples conseils d'achat, il décortique avec précision les facettes intellectuelles et sensibles du jeu. Dans la rubrique ""Décrypter le dessin d'enfant"", des experts en enfance analysent comment un bonhomme têtard révèle l'estime de soi. ""Ludisme égalitaire"" combat les clichés sexistes avec des ateliers pour customiser une dînette traditionnelle en tonalité moderne ou offrir un jouet technique à sa enfant. Chaque mois, un atelier numérique en direct fait intervenir des spécialistes : une session remarquable avec une pédagogue alternative a démontré comment une objet du quotidien pouvait transmettre la attention et la classification. Mais la authentique rupture se trouve dans Labo des Petits Génies. Ce challenge créatif invite les enfants à dessiner leur jeu idéal. Les projets sélectionnés – comme le ""Automate Végétal"" 2023 qui plantait des graines en bougeant – sont ensuite créés en réel par des artisans locaux et édités en collection numérotée. Une démarche de co-création unique qui a déjà donné naissance à 22 inventions, distribuées à plusieurs milliers d'unités. Cette initiative va bien au-delà de le simple e-commerce pour devenir un authentique accélérateur d'idées ludique. L'Éthique en Action : Du Jouet Durable à l'Économie Circulaire Le manifeste ""Jouer Éthique"" de L'Espace Jouet définit des standards dépassant largement les obligations légales. Tout produit passe par un triple contrôle : marquage CE indispensable, examens poussés en laboratoire indépendant (recherche de phtalates, résistance aux chocs), et audit des ateliers partenaires...."
1936676597630951677,2025-06-22 06:44:17,ja,TWITTER,  安定のAmazon先生📦で #ROIROM 表紙のマキア届いたんだけど と・に・か・く・美…🫠🩷 ロイくんの香水、LE LABOのブラックティーって知ってた？ 大夢と渋谷で一緒に探したって話も最高すぎて…（智樹もいたよね？ ♡） 即ポチした楽天 https://t.co/WqXUgxZwPd 売り切れ前にチェックしとくのが正解✅ https://t.co/12HVCpaTMR
649402141821026_1264923604990559_DE863993C4F1448CBAFBE4D507F4A791ZZ,2025-06-22 07:34:14,fr,FACEBOOK,"  Remettez les bonnes vielles maps, virez labo, repair et gratte-ciel. Hit box éclatée, stabilité serveur éclatée, trop d'enfant de pute avec des cronus ou clavier souris, sinon le jeux est toujours au top."
1lhiawq,2025-06-22 07:38:38,en,REDDIT,"  Levels are displayed in photos. Some are full, some are half and about 5 at most near empty. Perfect introduction system of the common and uncommon fragrances in the game. $80 shipped https://imgur.com/a/qWTISB4 •Xerjoff Naxos •Prada Luna Rossa Carbon •Creed Aventus Absolu •Terre D'Hermès Eau Givrée •Michael Malul Sea + Zephyr •Azzaro The Most Wanted Parfum – 3ml •Dolce & Gabbana The One Gold •Bad Boy Cobalt EDP •Jean Paul Gaultier Le Male Le Parfum •Jimmy Choo Man EDT •Game of Spades Boston – 3ml •Dior Sauvage EDP •Le Labo Another 13 EDP •Hawthorne Wild & Botanic •Louis Vuitton L'Immensité •Bond No. 9 Sutton Place EDP •Burberry Hero EDT •Versace Eros EDT •Versace Eros EDP •Versace Eros Parfum •Versace Eros Energy EDP •Versace Eros Flame EDP •Givenchy Gentleman Réserve Privée •Givenchy L'Interdit Absolu Intense EDP •YSL La Nuit Bleu Électrique EDP (discontinued) •YSL Y EDP •Spicebomb Extreme •Spicebomb Dark Leather EDP – 3ml •Pasha de Cartier Parfum ×2 •Pasha de Cartier Edition Noire EDP •Paco Rabanne One Million Elixir •Paco Rabanne One Million Privé •Parfums de Marly Haltane •Parfums de Marly Althaïr"
1936807271075332494,2025-06-22 15:23:32,fr,TWITTER,"  🧰 La trousse d'urgence du CIP 🎧Sur Le Labo des CIP ➔ https://t.co/9QluTaI8sS 🎧Sur Spotify ➔ https://t.co/K5Ot70zIVW 🎧Via La Collab' avec Pascal Kufel sur toutes vos plateformes préférées avec ce lien (Amazon, Deezer, ITunes…) ➔ https://t.co/MpiEQkVhu1 https://t.co/eluwRSDHzF"
1936808543576842396,2025-06-22 15:28:35,fr,TWITTER,"  🧰 La trousse d'urgence du CIP 🎧Sur Le Labo des CIP ➔ https://t.co/9QluTaI8sS 🎧Sur Spotify ➔ https://t.co/K5Ot70zIVW 🎧Via La Collab' avec Pascal Kufel sur toutes vos plateformes préférées avec ce lien (Amazon, Deezer, ITunes…) ➔ https://t.co/MpiEQkVhu1 https://t.co/eluwRSDHzF"
