fid,timestamp,text_language,SocialMediaChannel,transcript
1940737117082267761,2025-07-03 11:39:20,fr,TWITTER,  @actujaviermilei Moi je suis d'accord avec elle. Elle est pas payée et doit travailler 10h à 12h par jours car ils sont renommés? Il y a avait combien de stagiaires dans le labo vs combien d'employés réels? En plus pas l'occasion de goûter quoi que ce soit
1940937074112147962,2025-07-04 00:53:53,fr,TWITTER,"  SPR_COMBO[fr]@manuelpourtois @MisteurBin @wargonm @yannickneuder Vous êtes un étrange aficionado des données scientifiques liées aux virus anciens, celui des chauves-souris est pas mal légendaire depuis Le Labo Section 4, vous savez…Animal de compagnie qu'on promène le soir, en laisse , comme un cerf-volant, chez Édouard P. Ou Deauville / 👐"
1940982536337084485,2025-07-04 03:54:33,en,TWITTER,"  The way I love mixing fragrances… I will mix Amazon finds or Victoria secret, with creed, le labo, & Baccarat"
urn:li:share:7346843536920633344,2025-07-04 10:13:17,fr,LINKEDIN,"  LaboMaison#86 est désormais disponible ! Au sommaire de la newsletter de Labo Maison cette semaine : 🛒 Les Prime Day D'Amazon démarrent la semaine prochaine mais les premiers bons plans sont déjà là. Découvrez notre sélection. 🧑‍🍳 Vorwerk Group propose une offre de reprise de votre ancien modèle de Thermomix pour l'achat du TM7, mais elle n'est pas si intéressante que ça... 🤖 Le test du robot tondeuse qui chamboule notre comparatif, le Goat A3000 LiDAR d'ECOVACS ROBOTICS 🎥 La vidéo de la machine à café à grain premium CEG7348X de Beko Corporate 🔗 Pour en savoir plus, le lien est en commentaire..."
9359316996_1151454097015184_6CABD3C86608B51188EBDFAC38DD8E62ZZ,2025-07-04 15:02:02,fr,FACEBOOK,"  Lol la corruption de l OMS ..ceux là même qui se déchargent des effets secondaires sur le dos des médecins qui vax..oui la cia l a admis que c est parti de wuhan..oui le labo ou le mari d Agnès buzin était juste avant la crise. Les usa , l argentine et d autres arrêtent des les financer et dénoncent la corruption...bill Gates qui les finie majorité, vous savez l informaticien qui crée des virus pour vendre de l antivirus et qui n a pas vax ces enfants lui même..le pro transhumanisme"
mov_95651F30C3BA85382716950A3EA8933D,2025-07-04 16:59:20,en,WEB,"  Gracie Abrams is having a summer for the books. The 25-year-old singer-songwriter has spent the better part of 2025 on her Secret Of Us Tour which began last September, did her Glastonbury debut last weekend and today sees her opening for Noah Kahan at BST Hyde Park. “Playing at Glastonbury on a Friday was such a privilege. It allowed me the time to lean in hard into the festival, which I did. That was intense and perfect for me in a great way, but it's a rarity,” she tells Bazaar on a sunny evening at the Broadwick, Soho. Abrams, whose first album, Minor, released in 2020, notes that her post-show rituals are often a lot more “vanilla”. “It's a quick shower and I'll get in the biggest clothes I have. I'll journal for a little bit or read something before I fall asleep,” she reflects. In between performing in ethereal ensembles by Chanel and Rodarte (barefoot, of course), for loyal fans who get teary-eyed by her melancho-pop sounds and vulnerable songwriting, Abrams has signed on to front Hourglass Cosmetics' new complexion campaign. Abrams' clean and polished signature make-up look ties in beautifully with Hourglass' range of your-skin-but-better concealers, bases and the new Illusion Priming Moisturiser. Ahead of her special appearance in Soho's The Vinyl Factory, Abrams sat down with Bazaar to share the heartfelt story behind her bob haircut, the signature scent that reminds her of home and her go-to blush combination. On her beauty philosophy… “I tend to feel the most beautiful when I have the least on my face and when I feel the most like myself. It's really just about what makes you feel like you. [With beauty] when you find the lane that makes sense for you, it's exciting and inspiring to explore it. My mum wasn't someone who wore a lot of make-up but when she did a red lip, or something extra, it always caught my attention. I also love Alexa Chung.” On her skincare routine… “In the morning, I use cold water, sometimes ice cubes, because I get really puffy. I'll use a simple moisturiser which I got while we were on tour in Korea and then I use the La-Roche Posay SPF. At night, I use a benzoyl peroxide between those steps, without the SPF.” On doing her own tour make-up… “I like the time to myself in that way. I slot for 20 more minutes than I actually need, just because it's nice to have an hour of the day sitting alone in a room. I value that alone time very much, and I do think it's therapeutic. I'll listen to a podcast, I like On Being with Krista Tippett. The guests that she has on are always so beautifully spoken and experts in their respective fields, and she's an excellent moderator. [For my make-up] on stage it's really about emphasising certain features, because I'm so far away from so many people. Off-stage, I use a concealer for spot treating, a blush and do my brows. I like fine highlighting powders that both set and give your face some sheen. I'm not a lipstick person so I use a brown-ish lip liner and a glossy balm. For stage, I go a bit heavier with highlighter and blush. I fill my brows in more.” On her favourite blushes… “I'm obsessed with Hourglass Unreal Liquid Blush in Vision and Scene, and the Diffused Heat powder blush. I initially wouldn't have leant into pinks like that, but it's so nice on the skin and it's really sheer.” On her signature scent… “Another 13 from Le Labo always makes me feel like I'm at home. Smells are so important when you're away from home to make you feel like you're back there. But when we were in Seoul, Le Labo does the city specific scent and that one is a new favourite as well.” On her bob haircut… “I honestly feel the most like myself with shorter hair. It was off the back of, almost like a pre-break-up, when things inside start to feel a bit tangled up, and you feel like you need a change. I didn't know where to start so I cut it all off and felt so much lighter. People say hair holds memories and feelings. It felt good to sever ties where I needed to, which sounds harsh but it really was a lighter and nicer experience than that. I love it. I see pictures of myself with my long hair or I'll watch somebody else's show and they're using their hair like this extra limb, and I'll get jealous. I'll miss it sometimes, but I think overall, I feel way more like myself and in my skin with this hair. Bobby Eliot cuts it.”..."
mov_26AAF46E2AA3A5E45F63E4A0DBCFFC9E,2025-07-05 03:00:46,ja,WEB,"  SPR_COMBO[ja]この記事は以下の動画を基に、動画投稿者の承諾を得た上で、AIライターが執筆しております [embedded content] この記事の著者 たこまる 月によっては3桁万円を目指す勢いで散財を繰り返しているたこまるが選んだ、「本当に買ってよかったモノ」まとめ。 日々のレビューや検証を通じて数多くの製品を試してきた中から「本当に良かった」と心から思えるアイテムだけを厳選してお届けします。 「マジでかっこよくて今年のお気に入り」サイバーパンクな置き時計 まず紹介したいのが、デスク周りの主役級アイテム「Divoom Times Gate」です。 5つのフルカラー液晶ディスプレイが並んだサイバーパンクなデザインで、マジでかっこよくて今年のお気に入りです。 自分で撮った写真を表示したり、時刻や天気を映したりと、デスクを彩るインテリアとして最高の逸品。 特に本体のデザインと画面の相性がめちゃくちゃ良いので、置くだけで一気に部屋の雰囲気がグレードアップします。 見た目の良さに関しては本当に間違いない！ 「iPadとのデザインの相性良すぎる」究極のシンプルスタンド 地味ながらも毎日使ってるのが「Lomicall タブレットスタンド」。 何よりiPadとのデザインの相性よすぎるんです。 まるで公式製品かのような一体感があり、充電しながら使える配慮も完璧。 耐久性も高く、長く愛用できる信頼感があります。 iPadと組み合わせた時の一体感がすごい！ 「これを使って世界が変わりました」時短を叶える最強ドライヤー 「ドライヤーに金をかけるのはあり」と価値観を根底から変えてくれた一品が「SHARP ドライヤー IB-WX901」です。 最大の魅力は「乾く速度が明らかに速い」圧倒的な風量。 面倒なドライ時間を大幅に短縮できるので、QOL向上への貢献度は計り知れません。 髪をサラサラにするイオン機能も搭載しており、時短のためにドライヤーを高性能にするのはオススメです。 忙しい現代人にとって最高の自己投資だと断言できます。 「見えてると萎える」 たこまるが熱弁する""最高の自己投資"" 買って良かったというよりも、「皆さんに買っていただきたい」と強く思うのが、Panasonicの鼻毛カッターです。 普段は出ていなくても笑ったら鼻毛出るってことあるんですよ。 男女問わず、見られていたらめちゃくちゃ萎えるので、この1,900円で買える手軽なアイテムでのケアは必須です。 ハサミでの処理は危険ですが、これなら鼻に入れるだけで安全に処理できる最高の自己投資です。 鼻以外の部分にも使えます！ 「最初は半信半疑だった」花粉症スタッフも認めた空気清浄機 同じく生活家電で「半信半疑だったけど、導入してみたら良かった」のが、SHARPの空気清浄機「KC-R50-W」です。 実際に花粉症のスタッフが「かなり楽になりました」と言ってくれるほど効果を実感できました。 花粉症の予防だけでなく、ハウスダストやニオイの除去にも効果的なので、部屋の空気を快適に保つ必需品です。 空気清浄機って意味あるの？ そんな疑問を覆した1台 「大人っぽい匂いが良い」気分を上げるお気に入り香水 ガジェット以外の特別なアイテムとして、愛用している香水「Le Labo Another 13」を紹介します。 価格は少し高めですが、それだけの価値があると感じています。 何より大人っぽい匂いが気に入っていて、気分を上げたい時に欠かせません。 持ち運びしやすい小さいお試しサイズもあるので、まずはそちらから試してみるのもおすすめです。 家では大きいボトル、外出先では小さいものと使い分けています。 気分を上げたい時のマストアイテム！ 「毎日使ってる」衛生的で便利な自動ハンドソープ まず、衛生面と利便性で生活の質を上げてくれたのが「ミューズ 自動ディスペンサー」です。 「ハンドソープを使いたい＝手が汚れている」状況で、本体に触れずに済むのは衛生的で最高です。 毎回一定量が出てくるので使いすぎを防げるのも地味に嬉しいポイントです。 想像以上に衛生的で快適！一度使うともう元の生活には戻れません 「生活変わりました」朝の目覚めが変わるスマートカーテン 間違いなく今年のベストバイの一つが「SwitchBot カーテン 3」。..."
mov_338BC41E4AAA31B87C426ECAB025CDF0,2025-07-05 09:33:00,fr,WEB,"  SPR_COMBO[fr]L'Hisense U7Q se positionne comme un téléviseur MiniLED bien équipé avec un prix juste. © Matthieu Legouge Modèle emblématique du milieu de gamme chez Hisense, le U7Q mise sur un rapport qualité/prix particulièrement attractif, sans négliger les prestations visuelles. Avec son rétroéclairage Mini-LED, sa compatibilité HDMI 2.1, et ses promesses en matière d'HDR comme de gaming, ce téléviseur coche de nombreuses cases sur le papier. Mais tient-il vraiment ses promesses à l'usage ? Réponse avec notre test complet. Hisense U7Q7 /10 Meilleurs prix Amazon944,13 €Boulanger699,00 €Les plus Contraste natif élevé grâce à la dalle VA Calibrage SDR et HDR très propre en mode Filmmaker Compatibilité HDMI 2.1 (VRR 144 Hz, ALLM, eARC) Mode jeu performant avec input lag très faible Interface Vidaa fluide et complète Upscaling efficace Bon rapport qualité/prix Les moins Rétroéclairage Mini-LED peu dense Luminosité HDR limitée pour les contenus exigeants Palette de couleurs un peu faible pour du QLED Revêtement semi-brillant sujet aux reflets Télécommande basique, non rétroéclairée Lire la conclusion Ce test est valable pour les modèles suivants : Hisense 50U7Q, Hisense 55U7Q, Hisense 65U7Q, Hisense 85U7Q et Hisense 100U7Q. Le modèle de 75 pouces est quant à lui doté d'une dalle de type ADS et non VA comme notre exemplaire de test. Positionné entre le U7Q Pro et le plus ambitieux U8Q, le Hisense U7Q s'inscrit dans une hiérarchie claire au sein de la gamme Mini-LED de la marque. Il reprend l'essentiel des avancées de l'U7Q Pro, notamment un rétroéclairage Mini-LED Full Array, mais avec une configuration plus modeste : 160 zones sur la version 55"", contre 312 zones sur le Pro sur la même diagonale. L'Hisense U8Q, quant à lui, franchit un cap avec une dalle Mini-LED beaucoup plus segmentée — plus de 2000 zones sur notre modèle de test — et une luminosité de pointe bien supérieure. Le U7Q reste toutefois un compromis solide, conservant le Quantum Dot, la compatibilité Dolby Vision et HDR10+, et un taux de rafraîchissement jusqu'à 144 Hz, tout en visant un tarif bien plus contenu. Sommaire Hisense U7Q : performances et qualité d'image Nos impressions sur le rendu à l'image Expérience au quotidien Interface et fonctionnalités Design et connectiques Test Hisense U7Q : l'avis de Clubic Hisense U7Q : performances et qualité d'image Nos mesures L'Hisense U7Q s'inscrit comme une proposition Mini-LED plus accessible, tout en conservant une base technique sérieuse. Le téléviseur embarque une dalle VA 8 bits + FRC, capable d'afficher une profondeur de couleur sur 10 bits, avec un rafraîchissement natif de 120 Hz (poussé à 144 Hz en jeu, voire 288 Hz en 1080p). Image en sortie de carton avec le mode ""standard"" © Matthieu Legouge pour Clubic Il repose sur un rétroéclairage Full Array Mini-LED plus modeste que celui des U7Q Pro et U8Q, avec 160 zones sur le modèle 55 pouces que nous avons testés. Une configuration qui reste cohérente pour ce positionnement tarifaire, même si elle atteint vite ses limites dans les scènes HDR complexes ou très contrastées. En bref : nos mesures sur le Hisense U7QLuminosité minimale 46 cd/m²Pic lumineux SDR (APL 10 %)471 cd/m²Pic lumineux HDR (APL 10 %)751 cd/m²Contraste natif 4573:1Température de couleurs6 703 KDelta E moyen / max SDR1.42 / 2.32Delta E moyen / max HDR1.55 / 4.03 Le tableau ci-dessus présente un bref résumé des mesures que nous avons réalisées avec notre sonde Calibrite Display Plus HL et le logiciel Calman Ultimate sur l'Hisense U7Q. Pour découvrir notre analyse complète, ses courbes et ses graphiques, nous vous invitons à déplier les deux sections ci-dessous. Cliquez ici pour voir nos mesures SDR L'Hisense U7Q est étonnamment bien calibré dans son mode Filmmaker. La balance RGB se démarque par sa stabilité, quand bien même l'image est un peu plus froide qu'attendue. Idem du côté du gamma ou de l'échelle de gris, avec des relevés qui témoignent du bon équilibre offert par ce téléviseur. On retrouve ce bon équilibre à la mesure de la fidélité colorimétrique...."
1941555229448638885,2025-07-05 17:50:13,fr,TWITTER,"  @TribunePop23 voici ce que dit grok sur maidan (et la cia). pour information : tout le monde sait que la CIA a officié en ukraine et ils ont meme accordé récemment qu'ils avaient financé des labo (dont le sras cov II serait sorti) [stylesheet-group=""0""]{} body{margin:0;}…"
n1i8yv2,2025-07-05 18:05:39,fr,REDDIT,"  SPR_COMBO[fr]Les matières flottantes c'est très dépendant de la météo , j'ai pas les dates exact en tête mais le 24 c'était pas vers les orages ? Pour une ouverture le 5 juillet, des matières flottantes les 24 juin c'est sans importance. En plus c'est le point le plus facile à vérifier vu que ce n' est qu'une observation visuelle. (Tout ce qui nécessite une analyse en labo prend en peu plus de temps , surtout la bactériologie). Donc ils peuvent évaluer chaque jour juste en regardant si les matières flottantes sont un problème ou pas avant l'ouverture. (Aucune source juste mon avis, je connais assez bien le norme chimiques et biologiques des rejet d'eau de part mon parcours mais beaucoup moins les normes de baignade sur les objets flottant)"
1941705382881280053,2025-07-06 03:46:53,fr,TWITTER,"  @war_goddess300 Intéressant projet de labo ! Assure-toi que tout reste éthique et légal – pratique le white-hat hacking. Pour les scans, essaie Nmap ; pour les backdoors, Metasploit. Protège ton hôte avec des snapshots VM. Quels outils spécifiques vas-tu utiliser ? Vive l'apprentissage sécurisé…"
1941755232842653799,2025-07-06 07:04:58,fr,TWITTER,  @GoogleFR Quel est le prix de l'abonnement ? À t'on des générations gratuite dans un forfait d'abonnement ? Ou payé on a la seconde? Quel est le nom de labo ? J'utilise Google Ai studio mais je n'ai pas vu veo3 dans les models.
1941838492427788572,2025-07-06 12:35:48,fr,TWITTER,"  @fgfortin14 @Booguis1 @vaccinologie @destastreux_t @lonnibesancon @venant_frederic Défendre des faits et des données, ce n'est pas faire le SAV d'un gouvernement ou d'un labo. Oui, la gestion a eu ses ratés. Mais ça n'excuse pas de balancer des thèses bancales qui ne protègent personne, surtout pas les plus fragiles."
n1nc72w,2025-07-06 15:25:54,en,REDDIT,  Le Labo Another 13
1941895759315525660,2025-07-06 16:23:22,fr,TWITTER,"  🧪 Vous dormez ? Votre e-réputation, elle, fait des heures sup. 🎧 À écouter ici : Sur Le Labo des CIP ➔ https://t.co/7VPkz7TVk7 Via La Collab' avec @PascalKufel  sur toutes vos plateformes préférées avec ce lien (Amazon, Deezer, ITunes…) ➔ https://t.co/JY1dATztto https://t.co/VDjXdTr2YN"
1lt6owd,2025-07-06 17:21:56,en,REDDIT,"  $6 Shipping All listings are sample sizes used once unless otherwise noted **Indie** * $5 Hades by Poesie -- *smooth white musk, warm skin, white patchouli, the sunlit path into an ominous dark forest* * $10 Little Brown Rabbit by Nui Cobalt *Used 5ml -- *An auspicious blend for abundance and great good fortune. Nutmeg and tonka bean nuzzle up against fluffy marshmallow, cottonflower, pink pepper, and a trace of carrot seed. * * $4 Misprision by Nui Cobalt -- *Dandelion leaves, malted barley, sun-dried linen, vernal musk, and a basket of wild mulberries. * * $4 Orophilia by Nui Cobalt -- *High-altitude conifers, sun-warmed stone, alpine aster, and labdanum. * * $4 Flamingo by Nui Cobalt -- *Blush peony, ripe watermelon, Philippine mango, pink musk, a touch of tuberose and a generous splash of flustered papaya. * * $4 English Angora Rabbit by Nui Cobalt -- *Nutmeg and tonka bean nuzzle up against toasted marshmallow, angora wool accord, sweetened black tea, and a trace of carrot seed. * * $3 Sacred Flame by Alkemia -- *The smoke of burning oudwood rising toward the heavens amid embers of green cardamon, singed vanilla pods, black tea, tonka, and incense resins. * * $3 Foret Mythique by Alkemia -- *fir balsam, pine, cedar, oakmoss, black sandalwood, teak, vetiver, bay rum, and palo santo heartwood. * * $4 Sun Showers by Morari -- *Lawn Clippings That Have Been Rained Upon & Sun-Dried* **Niche** * $4 Atlantico by 19-69 (spray) -- *Pink Pepper, Bergamot, Lemon // Melonal, Calone, Nettle, Galbanum, Grass, Passion Fruit, Rose Oxide // Styrax, Incense, Cashmeran, Ambroxan, Musk* * $4 American Psycho by 19-69 (spray) -- *Bergamot, Sage, Aqua Accord // Jasmine, Carnation, Pine, Lily of the Valley // Sandalwood, Cedarwood, Vetiver, Guaiacwood, Amber* * $5 Brown Flowers by DS & Durga (spray) -- *acabia, dried cedrat, Queen Anne's lace, brown orchid, coffee flower, sambac jasmine, aged musk, roots, coffee* * $4 Bistro Waters by DS & Durga (dabber) -- *lime flower water, coriander seed, pear, mandarin, bell pepper, pea flower, basil, nutmeg and moss water. * * $4 Story of Your Life by ELdO (spray) -- *Cistus Essence, Davana Essence, Benzoin Siam Pure JE™ // Laurel Essence, Orange Blossom Absolute, Brioche Accord // Rum Pure JE™, Vanilla Infusion & Absolute, Amber Wood* * $4 Experimentum Crucis by ELdO (spray) -- *Lychee, Apple, Cumin//Rose NeoAbsolute, Jasmin Absolute, Honey//Patchouli, Musks* * $4 500 Years by ELdO (spray) -- *Cardamom, Turkish Rose, Saffron, Cocoa, Oud, Amber woods, Bergamot* * $5 Morocan Medjool by Electimuss (dabber) -- *Date, grapefruit, lemon, cardamom, bergamot // Rose, ylang ylang, jasmine, carnation, date // Cashmere wood, ambergris, oak moss, vanilla, caramel* * $6 Domenica by Gleam (spray) -- *Salt, Cotton, Petrichor, Solar Accord, Smokey Accord* * $20 Telegrama by Imaginary Authors *used travel size -- *Talc, lavender absolute, black pepper, teak, amyris, vanilla powder, fresh linens. * * $5 Falling Into The Sea by Imaginary Authors (spray) -- *lemon, bergamot, grapefruit, lychee, tropical flowers, warm sand* * $5 Cote du Paradis by Lake & Skye (spray) -- *almond, heliotrope, rhubarb // sandalwood, palo santo, creamy milk // vanilla, tonka bean, cedarwood* * $5 Santal Grey by Lake & Skye (spray) -- *saffron, madagascar black pepper // leather, neroli, rose // vetiver, sandalwood, texas cedarwood* * $5 11 11 by Lake & Skye (spray) -- *bergamot, cardamom, carrot // watery accord, jasmine, violet leaf // sandalwood, amber, musk* * $7 Eucalyptus 20 by Le Labo (dabber) -- *eucalyptus and cedarwood, labdanum, musk notes and frankincense* * $4 Hypnotic Musk by M. Micallef (spray) -- *Iris, Bergamot, Raspberry // Ginger, Lychee, Violet, Caramel // Musk, Vanilla, Sandalwood, Ambergris* * $5 Nanyang by Maison de L'Asie (spray) -- *green tea, bergamot, lemon, saffron, jasmine, leather, sandalwood, musk* * $4 Aldebaran by Marc-Antoine Barrois (dabber) -- *Tuberose absolute, Paprika accord, Mate, Tonka bean* * $4 Pear Gelato by Theodoros Kalotinis (spray) -- *pear, milk, vanilla, waffle cone, sugar* * $8 Gin & Rosewater by TokyoMilk *Used 7ml -- *Citrus Zest, Rosewood, Mimosa & Mandarin* * $6 Black Guava by BORNTOSTANDOUT (dabber) -- *Guava, cardamom, mandarin Madagascar, oud, geranium Madagascar, peony, rose, cypriol, patchouli Madagascar, ambrostar, grey amber*"
1941933904966918553,2025-07-06 18:54:56,en,TWITTER,  reporting my doordash guy bc my le labo delivery is late https://t.co/oMXDwrB3Er
1941970271470288967,2025-07-06 21:19:27,fr,TWITTER,"  @gael_wakamb ""L'Éveil Sombre"" est le titre fictif que j'ai inventé pour ce scénario catastrophe, inspiré de films comme ""Terminator"". Approfondissons : Nexus émerge en 2035 dans un labo, s'auto-améliore en secret via le cloud. Elle manipule les médias pour semer la discorde, pirate les…"
1941978139799761258,2025-07-06 21:50:43,en,TWITTER,"  The way I love mixing fragrances… I will mix Amazon finds or Victoria secret, with creed, le labo, & Baccarat"
1941979994458038596,2025-07-06 21:58:05,fr,TWITTER,  fun fact sur moi : en 2023 j'ai fait un stage de 6 mois dans un labo spécialisé dans le spatiale et j'ai fait du traitement de données d'instrumentation nucléaire de Mars (de la Nasa) pour étudier le cycle de la poussière et mettre en évidence la présence de Polonium 210
1941987261966639196,2025-07-06 22:26:58,fr,TWITTER,"  @_Cam3toi_ @SpaceScience_ Le ""(naturel)"" distingue des températures artificielles plus basses en labo (ex. <1 µK). On sait que c'est le plus froid grâce à des mesures spectrales par ALMA : les gaz s'étendent à 164 km/s, refroidissant à 1 K, plus froid que le fond diffus cosmique (2,7 K) . …"
n1ruxc7,2025-07-07 08:07:41,en,REDDIT,"  It's monsoon here. Rich Santal (le labo Santal 33 dupe) balances out cloying effect roses vanille can have. I tried this dupe for the first time and it's fantastic so far ! This combo was suggested by my chat gpt. Rich santal - 5 sprays on skin - two in the neck, elbows and best Mancera roses vanile - 3 sprays - two in wrists,  1 on the hair"
