fid,timestamp,text_language,SocialMediaChannel,transcript
19159e8b658229e4c3499cacfeffcfa1,2025-06-24 00:42:00,fr,WEB,"  SPR_COMBO[fr]Présentation : Un Refuge Joueur dans le Univers du Commerce en Ligne Dans un secteur dominé par les entreprises majeures déshumanisés, L'Espace Jouet se distingue comme une oasis de enchantement réel. Créé en 2012 à Lyon, ce bijou du commerce en ligne français a su faire évoluer l'acte d'choisir un jouet en un cérémonial magique. À l'écart des processus automatisés, il incarne un déclaration pour une consommation éthique, optimiste et authentiquement humaine. Avec plus de 5 000 produits minutieusement curatées – des poupées Corolle aux circuits de voitures en passant par les créations en bois locales – cette entreprise a séduit 15 000 familles chaque mois. Son secret ? Une combinaison unique entre expertise artisanale, technologie moderne et éco-conscience. Plongeons dans l'univers de cette entreprise qui réinvente l'art de faire rêver les enfants. La Structure d'un Monde Éveillant les Sens Le parcours sur L'Espace Jouet relève de la déambulation dans une boutique chaleureuse. Dès la page d'accueil, une gamme de couleurs harmonieuse – tons pastel inspirant le calme, jaunes solaires stimulant la créativité – fait basculer le visiteur dans un écosystème conçu pour l'émerveillement. Le classement facile des menus permet de trier les jouets par tranche d'âge, compétence développée (expression, motricité fine, raisonnement logique) ou principes (Production locale, écologique, méthode éducative). La fonctionnalité phare ""Découvrez le cadeau idéal en quelques questions"" se révèle être un ressource intelligente : un test personnalisé questionne le parent sur le tempérament de l'enfant, ses passions naissantes et le budget, pour suggérer des sélections adaptées. Chaque description de produit, quant à elle, est une véritable encyclopédie du jouet. Grâce à une rotation 3D, on découvre en détail le jouet comme en magasin réel. Des descriptions techniques précises indiquent matériaux, certifications et dimensions, tandis que des recommandations écrits par des experts transforment l'objet en instrument de développement. Le dispositif ""Avec ce produit, l'enfant acquiert…"" explique clairement les capacités stimulées : un jeu d'encastrement haut de gamme perfectionne la coordination œil-main, quand un ensemble découverte botanique initie à la protection de l'environnement. Le Temple des Artisans et des Marques Icônes Cette boutique en ligne entretient des alliances privilégiées qui en font un musée actif du jouet d'exception. Dans sa section ""Ateliers de France"", une douzaine de artisans locaux présentent des pièces uniques dans le commerce traditionnel. Ce fabricant nordiste, basés dans le Nord, y proposent des créations bois reconnus par le Ministère de la Culture, comme leur fameux ""Jeu des Oiseaux Mémoire"" aux illustrations naturalistes. Moulin Roty, en Loire-Atlantique, y déploie ses doudous au style vintage, fabriquées manuellement dans des unités de production dédiées. Mais la boutique se distingue également par relecture des grandes marques internationales avec une patte locale : Sylvanian Families y dévoile des éditions limitées ""Village Lyonnais"" où les figurines portent des habits d'époque, la marque aux briques y imagine des boîtes ""Monuments Français"" (Tour Eiffel, le monument historique), et le spécialiste des poupées y équipe ses poupées Bébé Calin de tenues en tissu wax provençal. Cette démarche curatoriale trouve son aboutissement avec la Collection ""Engagée et Sensorielle"", co-créée avec des spécialistes du langage et professionnels de l'éveil. On y trouve des jouets comme ""Le Monde Affectif de Léo"", un compagnon en tissu muni de velcros pour exprimer différentes émotions selon l'humeur de l'enfant, ou ""Le Monde sans Paroles"", conçu pour jeunes ayant des difficultés d'élocution. Le Système de l'Merveille : Solutions et Innovations Sous la poésie visible se cache une ingénierie logistique d'une rigueur suisse. Le système de livraison, entièrement repensé pour limiter l'empreinte carbone, fonctionne comme un mécanisme bien huilé. Après validation du panier, les équipes lyonnaises emballent le colis dans un matériau durable, protégé avec des remplissages végétaux. Les livreurs sélectionnés (tous engagés dans la transition écologique) distribuent ensuite les commandes via un réseau de distribution éco-conçu, équilibrant les émissions résiduelles par des initiatives vertes en région Rhône-Alpes. Au final : 98% des commandes sont livrées en deux jours maximum, avec un traçage instantané par notifications. Mais la plateforme innove encore en inventant des services inédits. ""L'Abonnement Magique"", service trimestriel élaboré avec des spécialistes de l'enfance, expédie chaque mois une sélection pédagogique correspondant au stade de développement de l'enfant. Le service de location permet quant à lui d'emprunter pour trois mois des jouets encombrants (circuits de train, tables d'activités) à prix modique. L'innovation ultime ? L'option ""Cadeau Surprise"" qui envoie le jouet dans un emballage neutre, préservant la surprise. L'Académie du Jeu Éclairé : Pédagogie et Tribu Le blog ""Les Mots du Jeu"" constitue la colonne vertébrale éducative de la entreprise. Bien au-delà des simples guides d'achat, il explore en profondeur les aspects développementaux et émotionnels du jeu. Dans la catégorie ""Analyser les créations enfantines"", des psychologues interprètent comment un dessin typique des petits dévoile l'estime de soi. ""Ludisme égalitaire"" démonte les préjugés genrés avec des tutoriels pour transformer une cuisine rose en tonalité moderne ou proposer un établi à sa petite. Chaque mois, un atelier numérique en direct fait intervenir des spécialistes : une rencontre inoubliable avec une spécialiste des méthodes actives a illustré comment une modeste contenant de couture pouvait transmettre la attention et la classification. Mais la authentique rupture provient du Labo des Petits Génies. Ce concours annuel invite les enfants à imaginer leur jeu idéal. Les concepts primés – comme le ""Androïde Botanique"" 2023 qui semiait automatiquement en bougeant – sont ensuite prototypés par des artisans locaux et édités en édition limitée. Une processus collaboratif inédite qui a déjà donné naissance à plus de 20 jouets innovants, vendues à plusieurs milliers d'unités. Ce projet transcende le simple commerce pour devenir un véritable accélérateur d'idées pédagogique. L'Engagement au Quotidien : De l'Éco-Conception à la Consommation Responsable La charte ""Jouer Durable"" de l'enseigne établit des critères allant bien au-delà de les obligations légales. Chaque article passe par un audit rigoureux : certification CE obligatoire, analyses complémentaires en centre agréé (recherche de phtalates, durabilité), et inspection des sites de production...."
tw_sl_29420909dde81b0704c3b73d2c1a2d37,2025-06-24 11:06:53,en,WEB,"  At a pristine, multimillion-dollar lab on the Manhattan waterfront, just down the street from a men's homeless shelter and the medical examiner's office, a slice of summer plum is being converted into fragrance code. This is the work of Osmo, a fragrance tech startup claiming to build artificial olfactory intelligence. Osmo has parlayed this innovation into offering turnkey fragrance compounding that promises a 48-hour sample turnaround from initial client prompt. In the time it takes your Amazon Prime order to arrive, you may now order a custom perfume. Traditionally, creating a fragrance isn't fast. After a client provides a brief — usually a mood, memory, or concept — a perfumer begins weeks or months of formulation trials, compounding and revising dozens of modifications, or “mods.” Each must settle before it can be evaluated for balance, projection, and drydown. Raw materials often need years of cultivation. Bottling, regulatory reviews, packaging, and testing follow. From concept to shelf, a single perfume can take six to 18 months — even longer in luxury. And like fine wines, fragrance materials vary with climate concerns. One year's yield will not smell like the next one, or the one before. Osmo built its shiny new empire, hoping to disrupt the fragrance market, on its digitization of a plum and the speed with which it can analyze and transport odor molecules. Its goal: to disrupt the fragrance market with AI-powered scent creation. I first encountered the smell of this “digitized plum” at a scent conference, handed to me by an independent perfumer like contraband. A group gathered around the blotter, whispering: it was too medicinal, too clean. “Where's the bruising, the rot — the heat?” someone asked. “Where's the craftsmanship? Where's the perfumer?” I've judged hundreds of perfumes blindly for international fragrance awards and worked on machine learning systems at tech startups. I know the pull of scent well formulated — and the allure of tech's frictionless promises. To me, the plum smelled real, if strangely large and genetically modified. I could smell it from yards away — James and the Giant Plum, rolling toward me from a Roald Dahl retelling. But the question hanging in the air was larger than a fruit: as AI enters perfumery, are we expanding access to beauty — or automating the soul out of it? AI isn't coming to fragrance — it's already here, and in most things that the average consumer smells. The four fragrance conglomerates responsible for most of what the world smells — DSM-Firmenich, Givaudan, IFF, and Symrise — all integrate AI into their pipelines. Givaudan's Carto system helps perfumers refine formulas. DSM-Firmenich's EmotiON claims to produce scents that improve well-being. These systems are used not just in product labs but in fragrance education worldwide. The hairsprays and soaps and cleaning products and luxury fragrances that line your shelves — all of these have been touched by these four powerhouses of perfume and, so too, the AI involved in their processes. The principal perfumer at DSM-Firmenich, Frank Voelkl, who is behind the fragrances that make up so much of our current odor aura — Le Labo's Santal 33, Glossier's You, Tom Ford's Tuscan Leather — uses AI on a daily basis as part of his creative process. “When I began as a perfumer, there were no emails — we were still communicating with fax machines, you know. I started by handwriting my formulas. The beauty of AI is that it manages regulatory concerns, issues around stability, phasing, performance. These tools are tremendously helpful in resolving technical issues so I can focus much more on the creative part, which requires my imagination, emotions, intuition, and the human factor. It's like a clerk.” Heather, a perfumer-in-training in France, tells me AI use is now standard among her peers. “Most, if not all my classmates, have used AI for every project or question. Gen Z uses it like an operating tool — older generations use it like a browser.” When Heather says Gen Z uses AI “like an operating tool,” she means they rely on it as a functional extension of the creative process — from selecting materials to refining accords. Older generations, meanwhile, still treat it as a secondary resource, like a search engine or inspiration board. For new creators, AI isn't just assistance — it's infrastructure, taking over essential parts of the perfumery processes. Pierre Vouard, a professor at FIT, sees both opportunity and loss: “Compounding by hand, knowing the exact amount of each material, weighing it yourself — that's going to disappear. But is it crucial?” He knows AI is used in his own classroom. “Perhaps this will be true democratization of fragrance because it drastically reduces the cost of creating one. But it does make you ask: Where's the craftsmanship? Where's the perfumer?” “There've only been about 100,000 fragrances ever made...."
4d3c73b585b0675c52dc3367424350bf,2025-06-24 13:31:00,fr,WEB,"  SPR_COMBO[fr]Présentation : Un Havre Joueur dans le Paysage du Commerce en Ligne Dans un secteur régit par les grands acteurs impersonnels, L'Espace Jouet émerge comme une oasis de magie tangible. Fondé en 2012 à Lyon, ce trésor du e-commerce français a su transformer l'acte d'acquérir un jouet en un rituel magique. Éloigné des algorithmes glacés, il incarne un déclaration pour une achat conscient, heureuse et profondément humaine. Grâce à plus de 5 000 références minutieusement sélectionnées – des jouets Corolle aux circuits Scalextric en passant par les jouets artisanaux du Jura – cette boutique en ligne a conquis 15 000 familles mensuelles. Son secret ? Une combinaison rare entre savoir-faire artisanal, digitalisation et responsabilité environnementale. Pénêtrons dans l'univers de cette entreprise qui redéfinit l'art de éveiller l'imagination des jeunes. L'Architecture d'un Monde Sensoriel La navigation sur L'Espace Jouet relève de la balade dans une petite librairie indépendante. Dès l'arrivée sur le site, une palette chromatique douce – tons pastel évoquant la sérénité, jaunes solaires éveillant l'imagination – plonge le visiteur dans un environnement pensé pour l'émerveillement. Le classement intuitive des menus permet de sélectionner les jouets par stade de développement, habileté ciblée (expression, précision gestuelle, pensée analytique) ou valeurs (Fabriqué en France, éco-responsable, apprentissage autonome). La fonctionnalité phare ""Trouvez le jouet parfait en 3 clics"" se révèle être un ressource intelligente : un questionnaire ludique questionne le parent sur le personnalité de l'enfant, ses passions naissantes et le budget, pour proposer des choix personnalisés. Chaque description de produit, quant à elle, est une véritable encyclopédie du jouet. Grâce à une rotation 3D, on découvre en détail le jouet comme en commerce traditionnel. Des descriptions techniques exhaustives précisent compositions, normes de sécurité et dimensions, tandis que des recommandations rédigés par des éducateurs font du jouet un outil d'épanouissement. Le module ""Avec ce produit, l'enfant acquiert…"" explique clairement les aptitudes travaillées : un casse-tête en bois artisanal développe la coordination œil-main, quand un kit de jardinage Bioviva sensibilise à la protection de l'environnement. Le Panthéon des Maîtres Jouetiers et des Légendes du Jouet L'Espace Jouet développe des collaborations uniques qui en font un conservatoire vivant du jouet d'exception. Dans sa section ""Savoir-Faire Local"", douze artisans locaux dévoilent des créations introuvables sur d'autres plateformes. Cette marque engagée, basés dans le Nord, y proposent des jeux en bois reconnus par le Ministère de la Culture, comme leur fameux ""Mémory des Oiseaux"" aux gravures réalistes. Moulin Roty, basé à Nantes, y déploie ses compagnons en tissu au style vintage, assemblées artisanalement dans des ateliers adaptés. Mais la plateforme se distingue également par adaptation des labels planétaires avec une touche lyonnaise : Sylvanian Families y dévoile des séries collector ""Village Lyonnais"" où les figurines arborent des habits d'époque, Lego y conçoit des kits ""Patrimoine National"" (Tour Eiffel, le joyau Renaissance), et la marque française y équipe ses poupées Bébé Calin de vêtements en tissu wax provençal. Cette approche sélective atteint son apogée avec la Collection ""Éthique & Sensible"", co-créée avec des thérapeutes de la communication et psychomotriciens. On y peut explorer des jeux comme ""Léo et ses Sentiments"", un ours en peluche équipé de systèmes amovibles pour changer d'expression faciale selon les sentiments du petit, ou ""L'Univers des Ombres"", conçu pour petits en situation de handicap verbal. L'Organisation de l'Merveille : Solutions et Avancées Au-delà de la poésie visible se opère une organisation opérationnelle d'une rigueur suisse. Le système de livraison, totalement optimisé pour limiter l'empreinte carbone, ressemble à un mécanisme bien huilé. Dès l'achat finalisé, les employés du siège emballent le colis dans un emballage 100% recyclable, maintenu avec des granulés d'amidon de maïs. Les sociétés de logistique (tous labellisés ""Flotte Verte"") acheminent ensuite les colis via un système de tournées optimisées, neutralisant les rejets carbonés par des programmes écologiques en Sud-Est de la France. Résultat : 98% des commandes sont distribuées en un délai record, avec un suivi en temps réel par notifications. Mais la plateforme ne s'arrête pas là en créant des solutions uniques. ""L'Abonnement Magique"", formule annuelle pensé avec des professionnels de la petite enfance, expédie chaque mois trois jouets éducatifs correspondant au stade de développement de l'enfant. Le option de prêt permet quant à lui d'emprunter pour 90 jours des jouets encombrants (circuits de train, panneaux sensoriels) à prix modique. Le petit plus ? L'service ""Colis Caché"" qui livre le jouet dans un paquet discret, préservant la émotion de la découverte. L'Université du Jeu Éclairé : Éducation et Réseau La plateforme éditoriale ""Paroles de Jeu"" représente l'épine dorsale éducative de la boutique. Loin des simples guides d'achat, il décortique avec précision les facettes intellectuelles et sensibles du jeu. Dans la rubrique ""Comprendre les gribouillis"", des experts en enfance analysent comment un bonhomme têtard dévoile l'développement personnel. ""Jouer sans stéréotypes"" démonte les préjugés genrés avec des tutoriels pour customiser une cuisine rose en bleu électrique ou offrir un jouet technique à sa fille. Chaque mois, un atelier numérique en direct réunit des experts : une séance mémorable avec une pédagogue alternative a illustré comment une simple boîte à boutons pouvait transmettre la persévérance et la classification. Mais la réelle innovation réside dans Labo des Petits Génies. Ce challenge créatif invite les enfants à concevoir leur jeu idéal. Les idées gagnantes – comme le ""Androïde Botanique"" 2023 qui semiait automatiquement en se balançant – sont ensuite prototypés par des fabricants régionaux et vendus en série exclusive. Une méthode participative exceptionnelle qui a déjà permis de réaliser plus de 20 jouets innovants, distribuées à plus de 3 000 exemplaires. Cette initiative dépasse le simple e-commerce pour constituer un réel incubateur de créativité enfantin. L'Engagement au Quotidien : De l'Éco-Conception à la Consommation Responsable Le référentiel ""Jouer Éthique"" de l'enseigne impose des standards excluant nettement les normes minimales. Tout produit subit un processus de vérification en trois étapes : marquage CE indispensable, examens..."
122097203318008453_122263252454019033,2025-06-24 19:34:24,fr,FACEBOOK,"  ! • 𝖭𝖮𝖴𝖲 𝖠𝖵𝖮𝖭𝖲 𝖣𝖤́𝖳𝖤𝖢𝖳𝖤́ 𝖣𝖤 𝖭𝖮𝖬𝖡𝖱𝖤𝖴𝖲𝖤𝖲 𝖠𝖢𝖳𝖨𝖵𝖨𝖳𝖤́𝖲 𝖨𝖭𝖧𝖠𝖡𝖨𝖳𝖴𝖤𝖫𝖫𝖤𝖲 𝖲𝖴𝖱 𝖵𝖮𝖳𝖱𝖤 𝖥𝖠𝖢𝖤𝖡𝖮𝖮𝖪 ! • 𝖠𝖯𝖱𝖤̀𝖲 𝖣𝖤 𝖭𝖮𝖬𝖡𝖱𝖤𝖴𝖷 𝖱𝖠𝖯𝖯𝖤𝖫𝖲 𝖤𝖳 𝖭𝖮𝖳𝖨𝖥𝖨𝖢𝖠𝖳𝖨𝖮𝖭𝖲, 𝖭𝖮𝖴𝖲 𝖭'𝖠𝖵𝖮𝖭𝖲 𝖱𝖤𝖢̧𝖴 𝖠𝖴𝖢𝖴𝖭𝖤 𝖱𝖤́𝖯𝖮𝖭𝖲𝖤 𝖣𝖤 𝖵𝖮𝖳𝖱𝖤 𝖯𝖠𝖱𝖳. • 𝖯𝖮𝖴𝖱 𝖣𝖤𝖲 𝖱𝖠𝖨𝖲𝖮𝖭𝖲 𝖣𝖤 𝖲𝖤́𝖢𝖴𝖱𝖨𝖳𝖤́, 𝖭𝖮𝖴𝖲 𝖣𝖤𝖵𝖮𝖭𝖲 𝖵𝖤𝖱𝖱𝖮𝖴𝖨𝖫𝖫𝖤𝖱 𝖣𝖤́𝖥𝖨𝖭𝖨𝖳𝖨𝖵𝖤𝖬𝖤𝖭𝖳 𝖵𝖮𝖳𝖱𝖤 𝖥𝖠𝖢𝖤𝖡𝖮𝖮𝖪 𝖠𝖯𝖱𝖤̀𝖲 𝟤𝟦 𝖧𝖤𝖴𝖱𝖤𝖲 𝖲𝖨 𝖭𝖮𝖴𝖲 𝖭𝖤 𝖱𝖤𝖢𝖤𝖵𝖮𝖭𝖲 𝖯𝖠𝖲 𝖣𝖤 𝖱𝖤́𝖯𝖮𝖭𝖲𝖤 𝖣𝖤 𝖵𝖮𝖳𝖱𝖤 𝖯𝖠𝖱𝖳. • 𝖵𝖤́𝖱𝖨𝖥𝖨𝖤𝖹 𝖵𝖮𝖳𝖱𝖤 𝖢𝖮𝖬𝖯𝖳𝖤 𝖥𝖠𝖢𝖤𝖡𝖮𝖮𝖪 𝖠̀ 𝖫'𝖠𝖨𝖣𝖤 𝖣𝖴 𝖫𝖨𝖤𝖭 𝖢𝖨-𝖣𝖤𝖲𝖲𝖮𝖴𝖲 𝖯𝖮𝖴𝖱 𝖤́𝖵𝖨𝖳𝖤𝖱 𝖲𝖮𝖭 𝖵𝖤𝖱𝖱𝖮𝖴𝖨𝖫𝖫𝖠𝖦𝖤. https://api.vc.ru/v2.8/redirect?to=https://support-56821.ubpages.com/7842543/ '𝖠𝖫𝖤𝖱𝖳𝖤 𝖤𝖳 𝖣'𝖠𝖲𝖲𝖨𝖲𝖳𝖠𝖭𝖢𝖤. © 𝟤𝟢𝟤𝟧. Mathou&Loxos Camille Laure Alex pleine d'idées Bacchus Club & Rooftop CilsGlam Editions Loisirs et Evasion Bikebac Annie Laure Henry The Swinging Sticks - Masterpiece of kinetic Art Twensa en France Les bons conseils - Édition France Ponyloop Garmentlace-D Amazon Ads Chicken Road Leslie Sharpe Nicole Galerie Art et Chine 0 Wandereds Nogoya shop Hada Labo Tokyo - France Pigment Fort Evenementiel SoldesMax Imprint: Learn Visually DauphiLogis Officiel Jenny Pham Art & Créations Le Comptoir Irlandais Thermie France Digital World 15 Beny Bafiba Hanguk en voiture : guide francophone Stéphane Bontemps Zhengzhou Wenming Machinery Co,. Ltd 0 Amazehurry.top Nuescence RainQueen Festival de Saint-Denis Abbatiale Bellelay L'Azur"
146949065315655_1141590941336092_FD39D96B95146E2A347C80E00A0BA1FBZZ,2025-06-24 23:14:37,fr,FACEBOOK,"  Colette Peers la rentabilité, les contrôles coûtent, il en font par obligation, mais un minimum et puis le labo est aussi celui du fabricant, quand on s'appelle Nestle ou autre très grande boîte, l'état ferme les yeux.... C'est clair qu'il faut éviter de les enrichir plus encore, ce n'est pas de vous vendre un bon produit qui les intéressent, mais votre argent en échange d'un produit le moins coûteux possible. Pour ma part, j'ai rayé ces marques depuis quelques temps déjà."
mzr6tgv,2025-06-25 19:42:13,fr,REDDIT,"  SPR_COMBO[fr]L'objectif tamron a l'avantage d'être adaptable a tout les argentique (ou 99%) tamron ayant sortie le majestueux Adaptall 2 durant les années 70/90. Niveau labo jai une mini chambre noir pour transité a l'aveugle les film du container a un ""sceau"" dans le quel je fais mes melange et isolée de la lumière (je n'ai plus le nom de celui ci) ce qui m'embête le plus, cest trouver la chimie qui va avec... Appart sur amazon je ne sais pas ou la trouvée, et seulement en ""petite"" quantité, de quoi faire 2/3 pellicule a tout casser... Après si tu as un site pour se fournir en chimie je suis preneur et sa me pousseras plus a retourner sur les argentique 👀"
1938184986420551816,2025-06-26 10:38:05,fr,TWITTER,  Et ça commence ! Mark Zuckerberg vient d'officialiser le recrutement de trois chercheurs du bureau Suisse d'OpenAI afin de rejoindre le labo de superintelligence de META. C'est donc 100 millions de prime à la signature + 100 millions en package (rem + equity) pour chacun. https://t.co/I6e7Aa6J80
mov_AC2BC1B15E42B4D33D8DA51723DD2A49,2025-06-26 15:48:48,en,WEB,"  View Brand Page Jo Malone London Jo Malone London View Brand Page KILIAN PARIS KILIAN PARIS View Brand Page La Mer La Mer View Brand Page Lab Series Lab Series View Brand Page Le Labo Le Labo View Brand Page M·A·C M·A·C View Brand Page The Ordinary The Ordinary View Brand Page TOM FORD TOM FORD View Brand Page AERIN Beauty Logo Aramis Logo Aveda Logo Bobbi Brown Cosmetics Logo Clinique Logo Dr.Jart+ Logo Editions de Parfums Frédéric Malle Logo Estée Lauder Logo Jo Malone London Logo KILIAN PARIS Logo La Mer Logo Lab Series Logo Le Labo Logo M·A·C Logo The Ordinary Logo TOM FORD Logo Latest News View all News Click Here Minneapolis, MN (June 26, 2025) AVEDA, a purpose-driven pioneer of plant-powered, high-performance beauty announces its debut in the Amazon.ca Premium Beauty store, bringing its assortment of vegan hair, skin, body ... Jun 24, 2025 Leonard A. Lauder's family, friends, and colleagues share their memories and lessons learned from the legendary cosmetics executive. Jun 15, 2025 It is with deep sadness that The Estée Lauder Companies Inc. announces that Chairman Emeritus Leonard A. Lauder passed away on June 14, at the age of 92. Featured Our Brands Our diverse portfolio of exceptional prestige beauty brands Read More Click Here Careers Careers Browse exciting career opportunities and be part of our global success Read More Click Here About Us..."
